热搜排名,热搜标题,描述,热搜指数,链接地址,封图链接
0,丹青刻岁月 石窟映千年,甘肃有着“中国石窟艺术之乡”的美誉。散布在陇原大地上的一处处石窟是镌刻在崖壁上的文明瑰宝，承载着悠久的文化记忆，印证了中华文明多元一体。,7904887,https://m.baidu.com/s?word=%E4%B8%B9%E9%9D%92%E5%88%BB%E5%B2%81%E6%9C%88+%E7%9F%B3%E7%AA%9F%E6%98%A0%E5%8D%83%E5%B9%B4&sa=fyb_news,https://fyb-2.cdn.bcebos.com/hotboard_image/44b7e7f248fd39b86a949073f73529b9
1,若武力介入 日本全国有沦为战场风险,11月16日，《解放军报》4版刊发署名文章《叫嚣武力介入台海局势只会把日本引向不归歧途》。文章称，如果武力介入台海局势，日本全国都有沦为战场的风险。,7809803,https://m.baidu.com/s?word=%E8%8B%A5%E6%AD%A6%E5%8A%9B%E4%BB%8B%E5%85%A5+%E6%97%A5%E6%9C%AC%E5%85%A8%E5%9B%BD%E6%9C%89%E6%B2%A6%E4%B8%BA%E6%88%98%E5%9C%BA%E9%A3%8E%E9%99%A9&sa=fyb_news,https://fyb-2.cdn.bcebos.com/hotboard_image/5bb7f3b4e9e11dc8bb23bb8f1af0977f
2,日本民众围堵首相官邸要求高市下台,当地时间15日，上百名日本民众自发在位于东京的首相官邸前集会，抗议日本首相高市早苗的错误言行。抗议者在现场高喊“撤回发言，赶快道歉”“高市下台”“不会外交的人不配当首相”等口号，要求高市早苗辞职下台。,7711789,https://m.baidu.com/s?word=%E6%97%A5%E6%9C%AC%E6%B0%91%E4%BC%97%E5%9B%B4%E5%A0%B5%E9%A6%96%E7%9B%B8%E5%AE%98%E9%82%B8%E8%A6%81%E6%B1%82%E9%AB%98%E5%B8%82%E4%B8%8B%E5%8F%B0&sa=fyb_news,https://fyb-2.cdn.bcebos.com/hotboard_image/bec28b09fdb25ced1cc3e1602289f6c7
3,年轻团队打破“卡脖子”壁垒,在深圳南山，机器人灵巧手五年间打破触觉传感器“卡脖子”壁垒，如今已广泛应用于各类场景。一群平均年龄只有20多岁的年轻创造者，正全力让这双“中国创造的智能之手”搭载到更多机器人上。,7619434,https://m.baidu.com/s?word=%E5%B9%B4%E8%BD%BB%E5%9B%A2%E9%98%9F%E6%89%93%E7%A0%B4%E2%80%9C%E5%8D%A1%E8%84%96%E5%AD%90%E2%80%9D%E5%A3%81%E5%9E%92&sa=fyb_news,https://fyb-2.cdn.bcebos.com/hotboard_image/921e50df6ce926cedc5581c6b8fc6c69
4,中国海警舰艇在我钓鱼岛领海巡航,11月16日，中国海警1307舰艇编队在我钓鱼岛领海内巡航。这是中国海警依法开展的维权巡航活动。,7521623,https://m.baidu.com/s?word=%E4%B8%AD%E5%9B%BD%E6%B5%B7%E8%AD%A6%E8%88%B0%E8%89%87%E5%9C%A8%E6%88%91%E9%92%93%E9%B1%BC%E5%B2%9B%E9%A2%86%E6%B5%B7%E5%B7%A1%E8%88%AA&sa=fyb_news,https://fyb-2.cdn.bcebos.com/hotboard_image/db6b7fc196be78443ac48bb1a2330b2c
5,日本多方批评高市早苗言行：极其愚蠢,连日来，日本首相高市早苗的涉华错误言行在日本国内引发质疑和批评。日本多方表示高市此次的言论践踏了历史，是极其有问题且愚蠢的发言。,7424246,https://m.baidu.com/s?word=%E6%97%A5%E6%9C%AC%E5%A4%9A%E6%96%B9%E6%89%B9%E8%AF%84%E9%AB%98%E5%B8%82%E6%97%A9%E8%8B%97%E8%A8%80%E8%A1%8C%EF%BC%9A%E6%9E%81%E5%85%B6%E6%84%9A%E8%A0%A2&sa=fyb_news,https://fyb-2.cdn.bcebos.com/hotboard_image/4157e2bffda3dccaf1c562f7990c6de1
6,外交部提醒避免赴日 日方回应,对于中国外交部发布近期避免赴日的提醒，日本官房长官木原稔15日称：“这与日本方面的认知有差异。正因为立场不同，日中之间的多层次沟通才更为重要。”,7334254,https://m.baidu.com/s?word=%E5%A4%96%E4%BA%A4%E9%83%A8%E6%8F%90%E9%86%92%E9%81%BF%E5%85%8D%E8%B5%B4%E6%97%A5+%E6%97%A5%E6%96%B9%E5%9B%9E%E5%BA%94&sa=fyb_news,https://fyb-2.cdn.bcebos.com/hotboard_image/51fe8a889b7097468e22aed5bb8a296c
7,“爸妈笑了半小时才舍得寄过来”,天气转冷，许多同学都收到了来自家人的爱心快递，这些快递总是充满惊喜，有些零食藏在鞋盒里、有些快递自带了拎手。或许你知道包裹里是什么却永远猜不到这个包裹长什么样，网友调侃：“爸妈笑了半小时才舍得寄过来”。,7235844,https://m.baidu.com/s?word=%E2%80%9C%E7%88%B8%E5%A6%88%E7%AC%91%E4%BA%86%E5%8D%8A%E5%B0%8F%E6%97%B6%E6%89%8D%E8%88%8D%E5%BE%97%E5%AF%84%E8%BF%87%E6%9D%A5%E2%80%9D&sa=fyb_news,https://fyb-2.cdn.bcebos.com/hotboard_image/8e0b908c2777e2098ef245924a90cdc7
8,女子续费才知认养东北虎已死亡数月,据悉，李女士认养了一只名叫“小独苗”的东北虎，并连续2年缴纳认养费。她在第3年准备继续认养时，却被告知“小独苗”早在两个月前就离世了。园区回复称：系心衰影响其他脏器功能导致死亡。对于这一答复，李女士并不满意，并质疑园方可能存在喂养过失。,7137505,https://m.baidu.com/s?word=%E5%A5%B3%E5%AD%90%E7%BB%AD%E8%B4%B9%E6%89%8D%E7%9F%A5%E8%AE%A4%E5%85%BB%E4%B8%9C%E5%8C%97%E8%99%8E%E5%B7%B2%E6%AD%BB%E4%BA%A1%E6%95%B0%E6%9C%88&sa=fyb_news,https://fyb-2.cdn.bcebos.com/hotboard_image/f286f721ba8069ef55059415eee0ec41
9,流感H3N2毒株严重可致呼吸衰竭,甲型H3N2亚型并非新毒株，作为甲型流感病毒的亚型，其典型症状包括发热、咳嗽、喉咙痛、全身酸痛、头痛、畏寒乏力等，部分患者会出现腹泻、呕吐症状，重症病例可能继发肺炎、呼吸衰竭。,7041965,https://m.baidu.com/s?word=%E6%B5%81%E6%84%9FH3N2%E6%AF%92%E6%A0%AA%E4%B8%A5%E9%87%8D%E5%8F%AF%E8%87%B4%E5%91%BC%E5%90%B8%E8%A1%B0%E7%AB%AD&sa=fyb_news,https://fyb-2.cdn.bcebos.com/hotboard_image/0eea1aca54c62c94ea2fe70f85c946f7
10,多名网友晒赴日机票退票成功记录,近日，我国多家航司声称“出行日期在12月31日之前且符合相关条件的客票，可予以免费退改处理”后，多名网友反映，此前预订的赴日机票，均已免费退票成功并晒出退票记录。,6944671,https://m.baidu.com/s?word=%E5%A4%9A%E5%90%8D%E7%BD%91%E5%8F%8B%E6%99%92%E8%B5%B4%E6%97%A5%E6%9C%BA%E7%A5%A8%E9%80%80%E7%A5%A8%E6%88%90%E5%8A%9F%E8%AE%B0%E5%BD%95&sa=fyb_news,https://fyb-2.cdn.bcebos.com/hotboard_image/a12f6518cad21f590a93d2ae3efa31bb
11,男子编造跳桥失踪虚假险情被罚,近期，网络平台有视频传播，视频内容因涉及跳桥、人员失踪等，引起了社会关注。经调查，该舆情系虚构的舆情。目前，因故意编造虚假险情、扰乱社会秩序，视频发布者晋某某受到行政处罚。,6848103,https://m.baidu.com/s?word=%E7%94%B7%E5%AD%90%E7%BC%96%E9%80%A0%E8%B7%B3%E6%A1%A5%E5%A4%B1%E8%B8%AA%E8%99%9A%E5%81%87%E9%99%A9%E6%83%85%E8%A2%AB%E7%BD%9A&sa=fyb_news,https://fyb-2.cdn.bcebos.com/hotboard_image/55411eab2e712d54a4969c698250fe5a
12,中国看透了高市早苗,高市早苗上台，中日关系天崩开局，但中国其实也看透了高市早苗。第一，看透了她的本性难移。第二，看透了她的狼子野心。第三，看透了她没有信誉。,6757509,https://m.baidu.com/s?word=%E4%B8%AD%E5%9B%BD%E7%9C%8B%E9%80%8F%E4%BA%86%E9%AB%98%E5%B8%82%E6%97%A9%E8%8B%97&sa=fyb_news,https://fyb-2.cdn.bcebos.com/hotboard_image/ba9352408a93e908c6494608c2e84c14
13,郑丽文表态：两岸同属一个中国,近日，郑丽文接受日本媒体专访时强调，只有接受一个中国才能确保台湾的生存，只要台湾当局接受“九二共识”，紧张也将停止。,6658689,https://m.baidu.com/s?word=%E9%83%91%E4%B8%BD%E6%96%87%E8%A1%A8%E6%80%81%EF%BC%9A%E4%B8%A4%E5%B2%B8%E5%90%8C%E5%B1%9E%E4%B8%80%E4%B8%AA%E4%B8%AD%E5%9B%BD&sa=fyb_news,https://fyb-2.cdn.bcebos.com/hotboard_image/0786d618e61eaa3b7c3b98fbb3482733
14,楼市出现新变化,近期，楼市有一些新变化，从国家统计局公布的数据来看，变化具体表现在三个方面：一、商品房销售降幅收窄；二、待售面积连续八个月减少；三、房地产开发企业到位资金降幅收窄。,6571883,https://m.baidu.com/s?word=%E6%A5%BC%E5%B8%82%E5%87%BA%E7%8E%B0%E6%96%B0%E5%8F%98%E5%8C%96&sa=fyb_news,https://fyb-2.cdn.bcebos.com/hotboard_image/448dd44a3ef37c631a322182a8e48f7e
15,高市早苗又要“搞什么事”,日前，日本首相高市早苗在国会宣称，“台湾有事”可能构成日本可行使集体自卫权的“存亡危机事态”。15日，日本媒体曝出，高市早苗正探讨在修订对“无核三原则”中不引进核武器的原则进行修改。,6464949,https://m.baidu.com/s?word=%E9%AB%98%E5%B8%82%E6%97%A9%E8%8B%97%E5%8F%88%E8%A6%81%E2%80%9C%E6%90%9E%E4%BB%80%E4%B9%88%E4%BA%8B%E2%80%9D&sa=fyb_news,https://fyb-2.cdn.bcebos.com/hotboard_image/74445b31048a4a6bdc69452adba048cd
16,黄海中部将连续三天进行实弹射击,据中国海事局网站消息，盐城海事局发布航行警告，11月17日至19日，每日0时到24时，黄海中部部分海域进行实弹射击，禁止驶入。,6367512,https://m.baidu.com/s?word=%E9%BB%84%E6%B5%B7%E4%B8%AD%E9%83%A8%E5%B0%86%E8%BF%9E%E7%BB%AD%E4%B8%89%E5%A4%A9%E8%BF%9B%E8%A1%8C%E5%AE%9E%E5%BC%B9%E5%B0%84%E5%87%BB&sa=fyb_news,https://fyb-2.cdn.bcebos.com/hotboard_image/07759122f0f39d7d1f670204385b01b9
17,特朗普：已对委内瑞拉问题作出决定,11月14日，美国总统特朗普表示，关于对委内瑞拉采取的下一步行动，他已“某种程度上作出决定”，但不能公布具体细节。,6278514,https://m.baidu.com/s?word=%E7%89%B9%E6%9C%97%E6%99%AE%EF%BC%9A%E5%B7%B2%E5%AF%B9%E5%A7%94%E5%86%85%E7%91%9E%E6%8B%89%E9%97%AE%E9%A2%98%E4%BD%9C%E5%87%BA%E5%86%B3%E5%AE%9A&sa=fyb_news,https://fyb-2.cdn.bcebos.com/hotboard_image/562e2b62100c7eaf055feae402a4fb87
18,樊振东王楚钦打扁比赛用球,11月15日，全运会乒乓球男单半决赛中，樊振东以4比2战胜王楚钦晋级决赛。第六局关键分时，两人因高强度对拉导致比赛用球变形，裁判暂停更换新球。,6174618,https://m.baidu.com/s?word=%E6%A8%8A%E6%8C%AF%E4%B8%9C%E7%8E%8B%E6%A5%9A%E9%92%A6%E6%89%93%E6%89%81%E6%AF%94%E8%B5%9B%E7%94%A8%E7%90%83&sa=fyb_news,https://fyb-2.cdn.bcebos.com/hotboard_image/da2c00213f54241804a88cc47145e458
19,日本男子中奖6亿 瞒着家人独自享乐,66岁的日本退休职员于11月15日独中6亿日元彩票大奖后，因恐惧巨额财富选择向家人隐瞒。他在东京都银行领取奖金时感到眩晕，甚至一度想撕毁中奖证明，最终决定独自管理这笔意外之财。,6081222,https://m.baidu.com/s?word=%E6%97%A5%E6%9C%AC%E7%94%B7%E5%AD%90%E4%B8%AD%E5%A5%966%E4%BA%BF+%E7%9E%92%E7%9D%80%E5%AE%B6%E4%BA%BA%E7%8B%AC%E8%87%AA%E4%BA%AB%E4%B9%90&sa=fyb_news,https://fyb-2.cdn.bcebos.com/hotboard_image/20326fb9872cf573fe71f4733b84171a
20,高市“搞事” 中国就让她懂事,11月7日，日本首相高市早苗在国会宣称“台湾有事即日本有事”，暗示可能武力介入台海。13日至14日，中国外交部副部长孙卫东、驻日大使吴江浩相继召见日方官员，严正警告此类言论构成对华“侵略行为”，中方将坚决反制。,5993689,https://m.baidu.com/s?word=%E9%AB%98%E5%B8%82%E2%80%9C%E6%90%9E%E4%BA%8B%E2%80%9D+%E4%B8%AD%E5%9B%BD%E5%B0%B1%E8%AE%A9%E5%A5%B9%E6%87%82%E4%BA%8B&sa=fyb_news,https://fyb-2.cdn.bcebos.com/hotboard_image/a8b43c60e4463a3a9c6ef248147f502a
21,演出过程中突然点烟 知名歌手被罚,近日，歌手蒋文涵在个人巡演北京站表演期间，在舞台上突然点燃香烟并当台抽烟，演出后还在社交平台上发布自己在舞台上持烟的照片。针对此事，北京市朝阳区卫健委工作人员向媒体表示，依据《北京市控制吸烟条例》，已对当事人进行了处罚。,5889458,https://m.baidu.com/s?word=%E6%BC%94%E5%87%BA%E8%BF%87%E7%A8%8B%E4%B8%AD%E7%AA%81%E7%84%B6%E7%82%B9%E7%83%9F+%E7%9F%A5%E5%90%8D%E6%AD%8C%E6%89%8B%E8%A2%AB%E7%BD%9A&sa=fyb_news,https://fyb-2.cdn.bcebos.com/hotboard_image/f8c4dcba70b44b68e049ead51f5fe5ac
22,易烊千玺凭何成最年轻金鸡奖最佳男主,11月15日，第38届中国电影金鸡奖揭晓。易烊千玺凭借《小小的我》刘春和一角获最佳男主角奖。从寻求救赎与爱的街头混混小北，到“没有同类”的绝望人群刘春和，易烊千玺一直在进，一直在变。,5794464,https://m.baidu.com/s?word=%E6%98%93%E7%83%8A%E5%8D%83%E7%8E%BA%E5%87%AD%E4%BD%95%E6%88%90%E6%9C%80%E5%B9%B4%E8%BD%BB%E9%87%91%E9%B8%A1%E5%A5%96%E6%9C%80%E4%BD%B3%E7%94%B7%E4%B8%BB&sa=fyb_news,https://fyb-2.cdn.bcebos.com/hotboard_image/67cca95168cdb96f34451e5fb51caede
23,洪秀柱马英九接连痛批高市早苗,据台媒报道，马英九于15日发文称，高市早苗涉台言论错误引用了日本的“集体自卫权”、无端加剧地区紧张。当天洪秀柱也发文批评高市早苗，称其涉台言论是“赤裸裸的历史傲慢与政治干涉”，并质问：“台海的事，关你日本人什么事？”,5705877,https://m.baidu.com/s?word=%E6%B4%AA%E7%A7%80%E6%9F%B1%E9%A9%AC%E8%8B%B1%E4%B9%9D%E6%8E%A5%E8%BF%9E%E7%97%9B%E6%89%B9%E9%AB%98%E5%B8%82%E6%97%A9%E8%8B%97&sa=fyb_news,https://fyb-2.cdn.bcebos.com/hotboard_image/c0a601f8b4a07e21c34732c531f7b662
24,高市早苗在涉核问题上有新动作,近日，据日媒爆料称，高市早苗正在探讨伴随修改国家安全保障战略等三份安保相关文件，对“无核三原则”进行修改。理由是“不运进核武器”的原则，会限制搭载核武器的美军潜艇停靠日本港口，削弱美国的核威慑力。,5612911,https://m.baidu.com/s?word=%E9%AB%98%E5%B8%82%E6%97%A9%E8%8B%97%E5%9C%A8%E6%B6%89%E6%A0%B8%E9%97%AE%E9%A2%98%E4%B8%8A%E6%9C%89%E6%96%B0%E5%8A%A8%E4%BD%9C&sa=fyb_news,https://fyb-2.cdn.bcebos.com/hotboard_image/35e33ab1b9f3bc02d07f9052288378d2
25,200万一盆 “天价兰花”谁在买,近期，两位兰友以200万元价格买进三苗“蕙兰双艺红素紫苑草”。据悉，“蕙兰传奇”在高峰期价格达到1200万元，品质比它还优的“蕙兰双艺红素紫苑草”还有不少市场空间。兰友花高价买下它，期待在市场逐渐繁荣以后，迎来一个好价钱。,5509763,https://m.baidu.com/s?word=200%E4%B8%87%E4%B8%80%E7%9B%86+%E2%80%9C%E5%A4%A9%E4%BB%B7%E5%85%B0%E8%8A%B1%E2%80%9D%E8%B0%81%E5%9C%A8%E4%B9%B0&sa=fyb_news,https://fyb-2.cdn.bcebos.com/hotboard_image/29376e5b9912e9ae6febf218a1f661a9
26,嫦娥六号土特产现“铁锈” 意味什么,近日，我国科研团队通过分析嫦娥六号采回的月背南极-艾特肯盆地月球样品，首次发现大型撞击事件成因的微米级赤铁矿和磁赤铁矿晶体，为环绕南极-艾特肯盆地磁异常的撞击成因提供了样品实证。,5412568,https://m.baidu.com/s?word=%E5%AB%A6%E5%A8%A5%E5%85%AD%E5%8F%B7%E5%9C%9F%E7%89%B9%E4%BA%A7%E7%8E%B0%E2%80%9C%E9%93%81%E9%94%88%E2%80%9D+%E6%84%8F%E5%91%B3%E4%BB%80%E4%B9%88&sa=fyb_news,https://fyb-2.cdn.bcebos.com/hotboard_image/a0a732d29d2198af4158b4006767f94b
27,舒淇自曝想生小孩但没能如愿,,5317284,https://m.baidu.com/s?word=%E8%88%92%E6%B7%87%E8%87%AA%E6%9B%9D%E6%83%B3%E7%94%9F%E5%B0%8F%E5%AD%A9%E4%BD%86%E6%B2%A1%E8%83%BD%E5%A6%82%E6%84%BF&sa=fyb_news,https://fyb-1.cdn.bcebos.com/fyb/de6163834f53ca92c1273fff98ac9078.jpeg
28,高市之祸：撕裂中日关系的天崩开局,近日，日本新任首相高市早苗口出狂言，公然表示：“台湾有事”可能是日本行使集体自卫权的“存亡危机事态”。这番言论瞬间让她成为东亚地缘政治的焦点。高市早苗招招不离台湾，上台就撕裂中日关系，这样的天崩开局，也是创了纪录。,5231807,https://m.baidu.com/s?word=%E9%AB%98%E5%B8%82%E4%B9%8B%E7%A5%B8%EF%BC%9A%E6%92%95%E8%A3%82%E4%B8%AD%E6%97%A5%E5%85%B3%E7%B3%BB%E7%9A%84%E5%A4%A9%E5%B4%A9%E5%BC%80%E5%B1%80&sa=fyb_news,https://fyb-2.cdn.bcebos.com/hotboard_image/b3fd35b60140e306573fa0ab2a1bb0f0
29,邱毅：沈伯洋是出卖中国人的大汉奸,近日，台湾时事评论员邱毅表示，目前已有沈伯洋、“八炯”“闽南狼”三位“台独”顽固分子被大陆公安机关通缉。沈伯洋违反《反分裂国家法》，迫害陆配、台商。是出卖中国人的大汉奸。,5122990,https://m.baidu.com/s?word=%E9%82%B1%E6%AF%85%EF%BC%9A%E6%B2%88%E4%BC%AF%E6%B4%8B%E6%98%AF%E5%87%BA%E5%8D%96%E4%B8%AD%E5%9B%BD%E4%BA%BA%E7%9A%84%E5%A4%A7%E6%B1%89%E5%A5%B8&sa=fyb_news,https://fyb-2.cdn.bcebos.com/hotboard_image/853969f27b16c7ce192fb9908ece5c7d
30,这4种“假粗粮”正悄悄让你长胖,据悉，粗粮饼干、全麦面包、花式粗粮麦片和八宝粥这4种“假粗粮”，可能都是披着养生外衣的热量炸弹！它们常常打着“全麦”“高纤维”“无糖”的噱头，实则藏着爆表的糖和油。长期吃不仅瘦不下来，还可能让血糖飙升、脂肪肝找上门。,5023775,https://m.baidu.com/s?word=%E8%BF%994%E7%A7%8D%E2%80%9C%E5%81%87%E7%B2%97%E7%B2%AE%E2%80%9D%E6%AD%A3%E6%82%84%E6%82%84%E8%AE%A9%E4%BD%A0%E9%95%BF%E8%83%96&sa=fyb_news,https://fyb-2.cdn.bcebos.com/hotboard_image/2593e8c03216ecde5ab395974674b1fa
31,十分罕见！美国高度敏感目标被曝光,11月4日与10日，美国摄影爱好者两次拍摄到B-52H战略轰炸机携带AGM-181A“远程防区外导弹”原型弹的画面，该导弹此前从未公开展示。,4930802,https://m.baidu.com/s?word=%E5%8D%81%E5%88%86%E7%BD%95%E8%A7%81%EF%BC%81%E7%BE%8E%E5%9B%BD%E9%AB%98%E5%BA%A6%E6%95%8F%E6%84%9F%E7%9B%AE%E6%A0%87%E8%A2%AB%E6%9B%9D%E5%85%89&sa=fyb_news,https://fyb-2.cdn.bcebos.com/hotboard_image/f3f67003e1f4b4b51197ab2365fbcdc0
32,美国陆军部长：我们被防务承包商骗了,当地时间11月14日，美国陆军警告美防务承包商，斥其不是军方采购新装备的唯一选择。陆军部长丹·德里斯科尔直言，美国防务承包商“欺骗了美国民众、五角大楼和陆军”。,4830666,https://m.baidu.com/s?word=%E7%BE%8E%E5%9B%BD%E9%99%86%E5%86%9B%E9%83%A8%E9%95%BF%EF%BC%9A%E6%88%91%E4%BB%AC%E8%A2%AB%E9%98%B2%E5%8A%A1%E6%89%BF%E5%8C%85%E5%95%86%E9%AA%97%E4%BA%86&sa=fyb_news,https://fyb-2.cdn.bcebos.com/hotboard_image/0acfc180786814bf3470140d3a5773de
33,全运会今日看点：樊振东林诗栋争冠,11月16日，乒乓球男子单打决赛。巴黎奥运会男单冠军樊振东，将与首次闯入全运会男单决赛的林诗栋展开直接交锋，究竟谁能夺冠，值得期待。,4749841,https://m.baidu.com/s?word=%E5%85%A8%E8%BF%90%E4%BC%9A%E4%BB%8A%E6%97%A5%E7%9C%8B%E7%82%B9%EF%BC%9A%E6%A8%8A%E6%8C%AF%E4%B8%9C%E6%9E%97%E8%AF%97%E6%A0%8B%E4%BA%89%E5%86%A0&sa=fyb_news,https://fyb-2.cdn.bcebos.com/hotboard_image/01ee2053f36664cc9d2e32ff883db35e
34,“男阿姨”勇闯家政圈 月收入近万元,2003年出生的舟山小伙因从事家政工作走红，其月收入达8000-10000元，主要承接新房开荒保洁、办公楼清洁等业务，日均工作7小时，高峰期达10小时。通过社交媒体分享工作视频后，接单量显著增加。,4670921,https://m.baidu.com/s?word=%E2%80%9C%E7%94%B7%E9%98%BF%E5%A7%A8%E2%80%9D%E5%8B%87%E9%97%AF%E5%AE%B6%E6%94%BF%E5%9C%88+%E6%9C%88%E6%94%B6%E5%85%A5%E8%BF%91%E4%B8%87%E5%85%83&sa=fyb_news,https://fyb-2.cdn.bcebos.com/hotboard_image/9231ad9609824b0d9be3cb4f56cfaf02
35,御寒“神器”电加热衣走红,随着入冬气温不断降低，一些具有加热保暖功能的电加热衣也逐渐走红。专家建议电加热衣要尽量避免被重物按压或者折叠，更不要私自改装或拆卸，导致发热元件受损带来安全隐患。,4559220,https://m.baidu.com/s?word=%E5%BE%A1%E5%AF%92%E2%80%9C%E7%A5%9E%E5%99%A8%E2%80%9D%E7%94%B5%E5%8A%A0%E7%83%AD%E8%A1%A3%E8%B5%B0%E7%BA%A2&sa=fyb_news,https://fyb-2.cdn.bcebos.com/hotboard_image/504afbe291f408995d4ab21d298131d5
36,风电叶片与大巴相撞致3伤,,4479641,https://m.baidu.com/s?word=%E9%A3%8E%E7%94%B5%E5%8F%B6%E7%89%87%E4%B8%8E%E5%A4%A7%E5%B7%B4%E7%9B%B8%E6%92%9E%E8%87%B43%E4%BC%A4&sa=fyb_news,https://fyb-1.cdn.bcebos.com/fyb/de6163834f53ca92c1273fff98ac9078.jpeg
37,高市早苗叫嚣只会把日本引向歧途,日前，日本首相高市早苗在国会答辩时公然发表涉台露骨挑衅言论，在中方表达强烈抗议后，高市拒不撤回错误言论。这是日本在任首相首次明确可能武力介入台海局势，日方种种错误举动，甚至叫嚣武力介入台海局势，只会把自己引向不归歧途。,4368828,https://m.baidu.com/s?word=%E9%AB%98%E5%B8%82%E6%97%A9%E8%8B%97%E5%8F%AB%E5%9A%A3%E5%8F%AA%E4%BC%9A%E6%8A%8A%E6%97%A5%E6%9C%AC%E5%BC%95%E5%90%91%E6%AD%A7%E9%80%94&sa=fyb_news,https://fyb-2.cdn.bcebos.com/hotboard_image/c71e39c10a59571f24a17bcf73b61a21
38,女子买998元羽绒服退货寄手机壳,近日，一消费者网购了一件998元羽绒服，申请退货退款后，寄回的却是一个手机壳。商家称，该顾客退货地址填写店方名称，但收货姓名、电话却写的是顾客自己的。,4259492,https://m.baidu.com/s?word=%E5%A5%B3%E5%AD%90%E4%B9%B0998%E5%85%83%E7%BE%BD%E7%BB%92%E6%9C%8D%E9%80%80%E8%B4%A7%E5%AF%84%E6%89%8B%E6%9C%BA%E5%A3%B3&sa=fyb_news,https://fyb-2.cdn.bcebos.com/hotboard_image/cec8fc62c32e84b570d7874e052d0297
39,1890元机票改签费24400元？多方回应,近日，有网友反映，其在去哪儿网购买了一张1890元的机票，办理改签时被要求支付24400元的改签费。海航回应：国际航班确有此情况。去哪儿网回应：改签费需根据订单舱位、票价差、改签手续费等综合核算。,4182201,https://m.baidu.com/s?word=1890%E5%85%83%E6%9C%BA%E7%A5%A8%E6%94%B9%E7%AD%BE%E8%B4%B924400%E5%85%83%EF%BC%9F%E5%A4%9A%E6%96%B9%E5%9B%9E%E5%BA%94&sa=fyb_news,https://fyb-2.cdn.bcebos.com/hotboard_image/af5a15d39eb32b042e463cefa5c25de0
40,安世半导体事件令荷兰国际形象受损,在荷兰政府9月30日发布行政令后，荷兰企业法庭作出剥夺中国企业股权的错误裁决，严重侵害中国企业合法权益。荷兰知名政治学者奥弗贝克表示，此举与荷兰一直推崇的自由贸易政策不符，使荷兰的国际形象受损。,4082003,https://m.baidu.com/s?word=%E5%AE%89%E4%B8%96%E5%8D%8A%E5%AF%BC%E4%BD%93%E4%BA%8B%E4%BB%B6%E4%BB%A4%E8%8D%B7%E5%85%B0%E5%9B%BD%E9%99%85%E5%BD%A2%E8%B1%A1%E5%8F%97%E6%8D%9F&sa=fyb_news,https://fyb-2.cdn.bcebos.com/hotboard_image/7b68751aeac30f35bfcf689ef07a74b9
41,神舟二十二号飞船将满载货物上太空,神舟二十二号飞船将在无人状态下择机发射，执行满载货物上行任务，主要为空间站运送航天员物资和设备。此次发射标志着中国航天首次将神舟飞船转为货运模式，凸显技术成熟度与任务灵活性。,3977850,https://m.baidu.com/s?word=%E7%A5%9E%E8%88%9F%E4%BA%8C%E5%8D%81%E4%BA%8C%E5%8F%B7%E9%A3%9E%E8%88%B9%E5%B0%86%E6%BB%A1%E8%BD%BD%E8%B4%A7%E7%89%A9%E4%B8%8A%E5%A4%AA%E7%A9%BA&sa=fyb_news,https://fyb-2.cdn.bcebos.com/hotboard_image/283c66ca68218293a173c4227ca27691
42,高市早苗涉台谬论是对中方越线挑衅,日本首相高市早苗日前在国会答辩时公然发表涉台露骨挑衅言论，暗示可能武力介入台海问题，性质影响极其恶劣。多位国际问题专家受访时表示：高市早苗涉台谬论是对中方越线挑衅，已对中日关系造成严重冲击。,3902904,https://m.baidu.com/s?word=%E9%AB%98%E5%B8%82%E6%97%A9%E8%8B%97%E6%B6%89%E5%8F%B0%E8%B0%AC%E8%AE%BA%E6%98%AF%E5%AF%B9%E4%B8%AD%E6%96%B9%E8%B6%8A%E7%BA%BF%E6%8C%91%E8%A1%85&sa=fyb_news,https://fyb-2.cdn.bcebos.com/hotboard_image/cccfddbef45e7183b41020884ac7862e
43,律师称小英丈夫可能被判3至7年,11月12日，百万粉丝网红小英的丈夫王某某酒后驾驶轿车撞上电动自行车致两人受伤（其中一人重伤），随后弃车逃逸。警方于15日通报其因涉嫌交通肇事罪被刑拘，律师分析称其可能面临3至7年有期徒刑，并需承担伤者医疗费等民事赔偿。,3803974,https://m.baidu.com/s?word=%E5%BE%8B%E5%B8%88%E7%A7%B0%E5%B0%8F%E8%8B%B1%E4%B8%88%E5%A4%AB%E5%8F%AF%E8%83%BD%E8%A2%AB%E5%88%A43%E8%87%B37%E5%B9%B4&sa=fyb_news,https://fyb-2.cdn.bcebos.com/hotboard_image/55411eab2e712d54a4969c698250fe5a
44,莫迪取得一场“关键胜利”,,3712750,https://m.baidu.com/s?word=%E8%8E%AB%E8%BF%AA%E5%8F%96%E5%BE%97%E4%B8%80%E5%9C%BA%E2%80%9C%E5%85%B3%E9%94%AE%E8%83%9C%E5%88%A9%E2%80%9D&sa=fyb_news,https://fyb-1.cdn.bcebos.com/fyb/de6163834f53ca92c1273fff98ac9078.jpeg
45,日本樱岛火山连续喷发,当地时间11月16日，日本鹿儿岛县樱岛火山发生两次喷发：首次于凌晨0点57分喷发，喷烟高达4400米，碎石散落800-1200米范围；第二次于2点28分喷发，喷烟达3700米，碎石散落1000-1400米范围。,3600035,https://m.baidu.com/s?word=%E6%97%A5%E6%9C%AC%E6%A8%B1%E5%B2%9B%E7%81%AB%E5%B1%B1%E8%BF%9E%E7%BB%AD%E5%96%B7%E5%8F%91&sa=fyb_news,https://fyb-2.cdn.bcebos.com/hotboard_image/dbbaf0a55a5ec388aa4162e3610e33b6
46,美国副总统车队发生车祸 有人重伤,当地时间11月14日晚，美国两名执法人员在田纳西州马里维尔市为副总统万斯车队提供安保时发生交通事故，导致一名警员身受重伤。,3527100,https://m.baidu.com/s?word=%E7%BE%8E%E5%9B%BD%E5%89%AF%E6%80%BB%E7%BB%9F%E8%BD%A6%E9%98%9F%E5%8F%91%E7%94%9F%E8%BD%A6%E7%A5%B8+%E6%9C%89%E4%BA%BA%E9%87%8D%E4%BC%A4&sa=fyb_news,https://fyb-2.cdn.bcebos.com/hotboard_image/6b47b66f6eef0f66922681f6dc1deabd
47,好莱坞将拍LABUBU电影,丑萌怪兽毛绒玩具系列Labubu有望登上大银幕。索尼影业已拿下这一品牌的影视改编权，计划打造电影，若反响良好将开发系列作品。目前合作刚签署，制片人、导演及影片形式尚未确定，索尼未予置评。,3422487,https://m.baidu.com/s?word=%E5%A5%BD%E8%8E%B1%E5%9D%9E%E5%B0%86%E6%8B%8DLABUBU%E7%94%B5%E5%BD%B1&sa=fyb_news,https://fyb-2.cdn.bcebos.com/hotboard_image/bccd381cd9f50fc845dcd5c6ddb2be13
48,Uzi被曝加入iG,,3300048,https://m.baidu.com/s?word=Uzi%E8%A2%AB%E6%9B%9D%E5%8A%A0%E5%85%A5iG&sa=fyb_news,https://fyb-1.cdn.bcebos.com/fyb/de6163834f53ca92c1273fff98ac9078.jpeg
