热搜排名,热搜标题,描述,热搜指数,链接地址,封图链接
0,思想之光照亮奋进之路,思想之光照亮奋进之路。以习近平同志为核心的党中央带领亿万人民不惧风雨、破浪前行，以无比的勇毅攻坚克难，以坚定的信心开创未来，在理论创新和实践创新相互激荡、彼此辉映的进程中推动中国不断迈向发展新境界。,7904637,https://m.baidu.com/s?word=%E6%80%9D%E6%83%B3%E4%B9%8B%E5%85%89%E7%85%A7%E4%BA%AE%E5%A5%8B%E8%BF%9B%E4%B9%8B%E8%B7%AF&sa=fyb_news,https://fyb-2.cdn.bcebos.com/hotboard_image/72d736a48db2c5707c4182b523c61e9c
1,泽连斯基：已准备好结束俄乌冲突,当地时间21日晚，泽连斯基表示乌方做好与欧洲伙伴会晤准备，本周将签防御新协议，并重申已准备好结束俄乌冲突，称与特朗普同意以当前前线为基础谈判。,7809183,https://m.baidu.com/s?word=%E6%B3%BD%E8%BF%9E%E6%96%AF%E5%9F%BA%EF%BC%9A%E5%B7%B2%E5%87%86%E5%A4%87%E5%A5%BD%E7%BB%93%E6%9D%9F%E4%BF%84%E4%B9%8C%E5%86%B2%E7%AA%81&sa=fyb_news,https://fyb-2.cdn.bcebos.com/hotboard_image/c4c4ac67e28b6eca19194cf47eab440e
2,冰岛首次发现蚊子,当地时间10月20日，据《冰岛评论》报道，冰岛自然历史研究所正式确认，在该国境内首次发现蚊子，颠覆了外界认为冰岛是“全球唯一无蚊国”的固有认知。,7713235,https://m.baidu.com/s?word=%E5%86%B0%E5%B2%9B%E9%A6%96%E6%AC%A1%E5%8F%91%E7%8E%B0%E8%9A%8A%E5%AD%90&sa=fyb_news,https://fyb-2.cdn.bcebos.com/hotboard_image/1ce82642b786de3d9abc7ef7ba578b05
3,国产医疗装备“利器”层出,近五年来，一大批先进医疗装备应用于临床，让诊疗服务更微创，更安全，患者的就医体验不断改善。国产医疗装备不断向高端化、智能化迈进。我国已扭转进口设备占高端市场90%的局面，从“跟跑”转向“并跑”，部分产品实现“领跑”。,7615874,https://m.baidu.com/s?word=%E5%9B%BD%E4%BA%A7%E5%8C%BB%E7%96%97%E8%A3%85%E5%A4%87%E2%80%9C%E5%88%A9%E5%99%A8%E2%80%9D%E5%B1%82%E5%87%BA&sa=fyb_news,https://fyb-2.cdn.bcebos.com/hotboard_image/7da6e28885b9fb14d76022fa2c6232f8
4,胖东来高端研学每人收费100万,10月21日，胖东来创始人于东来宣布，将于明年联合联商学院启动高端研学计划，每年举办2至3次活动，每次为期两天，限招10名以内企业家，单人收费100万元，收入将全部用于“传播美好之路”。,7521181,https://m.baidu.com/s?word=%E8%83%96%E4%B8%9C%E6%9D%A5%E9%AB%98%E7%AB%AF%E7%A0%94%E5%AD%A6%E6%AF%8F%E4%BA%BA%E6%94%B6%E8%B4%B9100%E4%B8%87&sa=fyb_news,https://fyb-2.cdn.bcebos.com/hotboard_image/939b8b7d0ebae553213c201e1c505940
5,武汉一网吧提供海鲜自助走红,武汉一网吧因提供专业厨师现做的海鲜自助走红，68元/餐，充值或住宿可免费享，还含免费淋浴等服务，颠覆传统网吧体验引关注。,7425482,https://m.baidu.com/s?word=%E6%AD%A6%E6%B1%89%E4%B8%80%E7%BD%91%E5%90%A7%E6%8F%90%E4%BE%9B%E6%B5%B7%E9%B2%9C%E8%87%AA%E5%8A%A9%E8%B5%B0%E7%BA%A2&sa=fyb_news,https://fyb-2.cdn.bcebos.com/hotboard_image/132e427c7413c63da3156ac93fab0b1b
6,烤肉店用玉米粒当燃料 玉米专家发声,近日，山东烟台一家烤肉店用玉米粒当燃料，是助农还是浪费粮食？对此，农业专家李少昆表示：不赞同也不支持，很惋惜，我国粮食还处在紧平衡状态，节约粮食仍然是社会共识，不应该浪费。,7331137,https://m.baidu.com/s?word=%E7%83%A4%E8%82%89%E5%BA%97%E7%94%A8%E7%8E%89%E7%B1%B3%E7%B2%92%E5%BD%93%E7%87%83%E6%96%99+%E7%8E%89%E7%B1%B3%E4%B8%93%E5%AE%B6%E5%8F%91%E5%A3%B0&sa=fyb_news,https://fyb-2.cdn.bcebos.com/hotboard_image/da6b83a391210214e64de7afc802fcb8
7,红霉素软膏千万不能随便用,近年来，在某些博主的宣传之下，红霉素软膏被当作“万能药”，被广泛应用于各种病症和场景。但实际上，蚊虫叮咬、湿疹、脚气等场景下，使用红霉素软膏属滥用。,7237878,https://m.baidu.com/s?word=%E7%BA%A2%E9%9C%89%E7%B4%A0%E8%BD%AF%E8%86%8F%E5%8D%83%E4%B8%87%E4%B8%8D%E8%83%BD%E9%9A%8F%E4%BE%BF%E7%94%A8&sa=fyb_news,https://fyb-2.cdn.bcebos.com/hotboard_image/556d9f23da1b12c2e01a0b91fd54606c
8,微信三大更新放出,近期，微信启动灰度测试，将推出三项新功能：群聊消息免打扰优化，撤回操作可一次性撤回多条消息，聊天记录管理功能覆盖安卓端，支持导入导出和备份恢复。,7138047,https://m.baidu.com/s?word=%E5%BE%AE%E4%BF%A1%E4%B8%89%E5%A4%A7%E6%9B%B4%E6%96%B0%E6%94%BE%E5%87%BA&sa=fyb_news,https://fyb-2.cdn.bcebos.com/hotboard_image/8e5d1e66b9b044c09f1495a768605aa6
9,你的幸福拼图是哪一块,中国式现代化，民生为大。抓改革、促发展，归根到底是为了让人民过上更好的日子。五年间我们的生活发生着哪些大改变，大家对未来五年又有着怎样的期待。一起来看看！,7044801,https://m.baidu.com/s?word=%E4%BD%A0%E7%9A%84%E5%B9%B8%E7%A6%8F%E6%8B%BC%E5%9B%BE%E6%98%AF%E5%93%AA%E4%B8%80%E5%9D%97&sa=fyb_news,https://fyb-2.cdn.bcebos.com/hotboard_image/587f945f583a09e3209e45baf7201b5d
10,海景房把清晰看军港当卖点泄密,近期，国家安全机关发现并查处多起违规商业广告行为，个别商家涉嫌在广告宣传中发布敏感单位涉密信息，给国家安全造成潜在危害。其中一违规案例因将“能清晰看到军港”当作噱头进行宣传，给国家相关领域安全造成了危害。,6944739,https://m.baidu.com/s?word=%E6%B5%B7%E6%99%AF%E6%88%BF%E6%8A%8A%E6%B8%85%E6%99%B0%E7%9C%8B%E5%86%9B%E6%B8%AF%E5%BD%93%E5%8D%96%E7%82%B9%E6%B3%84%E5%AF%86&sa=fyb_news,https://fyb-2.cdn.bcebos.com/hotboard_image/efc9e57099c8d727ea445f9abf8e4e9f
11,女子造谣“台风停工停课”被拘,近日，海口一女子因编造发布“全市将因台风停工停课”网络谣言，扰乱公共秩序，被警方依法处以行政拘留五日。,6854281,https://m.baidu.com/s?word=%E5%A5%B3%E5%AD%90%E9%80%A0%E8%B0%A3%E2%80%9C%E5%8F%B0%E9%A3%8E%E5%81%9C%E5%B7%A5%E5%81%9C%E8%AF%BE%E2%80%9D%E8%A2%AB%E6%8B%98&sa=fyb_news,https://fyb-2.cdn.bcebos.com/hotboard_image/8609e6c5d4f1639e78ee31131ee7a716
12,日本警方从女子内衣中搜出黄金8公斤,据日媒报道，日本警方21日宣布已逮捕1名男子及3名女子，称他们涉嫌将重量约为8公斤的黄金藏于内衣，从香港走私入境东京羽田机场。,6752828,https://m.baidu.com/s?word=%E6%97%A5%E6%9C%AC%E8%AD%A6%E6%96%B9%E4%BB%8E%E5%A5%B3%E5%AD%90%E5%86%85%E8%A1%A3%E4%B8%AD%E6%90%9C%E5%87%BA%E9%BB%84%E9%87%918%E5%85%AC%E6%96%A4&sa=fyb_news,https://fyb-2.cdn.bcebos.com/hotboard_image/a38b77e800ad09d6b44ddd28c2fcf52f
13,不用中考 十二年贯通式学校来了,最近，四川成都，迎来多所“小初高”十二年贯通式学校和“初高”六年贯通式学校。当地教育局官网相关政策解读显示，贯通式培养是有序推进中考改革的尝试。成都市自2025年起，探索开展相关贯通式培养改革试点。,6655672,https://m.baidu.com/s?word=%E4%B8%8D%E7%94%A8%E4%B8%AD%E8%80%83+%E5%8D%81%E4%BA%8C%E5%B9%B4%E8%B4%AF%E9%80%9A%E5%BC%8F%E5%AD%A6%E6%A0%A1%E6%9D%A5%E4%BA%86&sa=fyb_news,https://fyb-2.cdn.bcebos.com/hotboard_image/e83bd25056edc42b13368005a296b913
14,留学生被策反当间谍 最终被判无期,近日，“保密观”披露一起留学生被策反当间谍案。郝某留学期间被外国官员以签证为由接触，通过吃饭送礼等方式拉拢，后被情报人员策反。回国后，他进入涉密研究所，多次向境外提供机密情报，被判无期徒刑。,6571948,https://m.baidu.com/s?word=%E7%95%99%E5%AD%A6%E7%94%9F%E8%A2%AB%E7%AD%96%E5%8F%8D%E5%BD%93%E9%97%B4%E8%B0%8D+%E6%9C%80%E7%BB%88%E8%A2%AB%E5%88%A4%E6%97%A0%E6%9C%9F&sa=fyb_news,https://fyb-2.cdn.bcebos.com/hotboard_image/e228e85c660b07f9783a30f3064ae040
15,男子从西安徒步8000公里到罗马,据媒体21日报道，西安一男子因受“张骞出使西域”的影响，徒步8000公里去罗马。共花费两年时间，约20万元，磨坏19双鞋。,6476764,https://m.baidu.com/s?word=%E7%94%B7%E5%AD%90%E4%BB%8E%E8%A5%BF%E5%AE%89%E5%BE%92%E6%AD%A58000%E5%85%AC%E9%87%8C%E5%88%B0%E7%BD%97%E9%A9%AC&sa=fyb_news,https://fyb-2.cdn.bcebos.com/hotboard_image/10f174dd122490aaddcc5860ecdc39a3
16,大学生成为临时父母 3小时收入300元,近年来，在工作与家庭中艰难寻找平衡的家长们，将育儿“外包”给大学生陪着孩子做作业、读绘本、学拼音、捉迷藏、出门玩耍。当大学生成为“临时父母”，用3小时300元的价格，进行着一场关于陪伴的“外包”实验。,6378486,https://m.baidu.com/s?word=%E5%A4%A7%E5%AD%A6%E7%94%9F%E6%88%90%E4%B8%BA%E4%B8%B4%E6%97%B6%E7%88%B6%E6%AF%8D+3%E5%B0%8F%E6%97%B6%E6%94%B6%E5%85%A5300%E5%85%83&sa=fyb_news,https://fyb-2.cdn.bcebos.com/hotboard_image/9b87c9d0ff81aea198631cd483256fe3
17,酒席为小朋友准备两桌肯德基,近日，安徽马鞍山一场儿童生日酒席上，主办方为小朋友单独准备两桌肯德基套餐，包括汉堡、薯条、炸鸡等，现场儿童“吃得开心不吵闹”，视频拍摄者胡先生称此举“考虑周到”。,6284281,https://m.baidu.com/s?word=%E9%85%92%E5%B8%AD%E4%B8%BA%E5%B0%8F%E6%9C%8B%E5%8F%8B%E5%87%86%E5%A4%87%E4%B8%A4%E6%A1%8C%E8%82%AF%E5%BE%B7%E5%9F%BA&sa=fyb_news,https://fyb-2.cdn.bcebos.com/hotboard_image/eb3773c47323245509068b2710756d3e
18,女装店主不建议买300元以下羽绒服,女装店主建议不要买价格低于300元的羽绒服，这个价位的羽绒服基本不是真羽绒，而是飞丝，也就是丝绵和羽绒的混合物，含绒量低，都是羽绒梗，舒适感、回弹度不高，保暖性不强。,6193075,https://m.baidu.com/s?word=%E5%A5%B3%E8%A3%85%E5%BA%97%E4%B8%BB%E4%B8%8D%E5%BB%BA%E8%AE%AE%E4%B9%B0300%E5%85%83%E4%BB%A5%E4%B8%8B%E7%BE%BD%E7%BB%92%E6%9C%8D&sa=fyb_news,https://fyb-2.cdn.bcebos.com/hotboard_image/9f18a71161319db81cade7c85a233486
19,国防部回应澳军机侵闯西沙领空,10月22日，国防部新闻发言人蒋斌就澳军机侵闯西沙领空一事回应称：澳方有关声明颠倒黑白，对中方倒打一耙，妄图掩盖其军机非法侵闯中国领空的恶劣行径，我们对此强烈不满，已向澳方提出严正交涉。,6080168,https://m.baidu.com/s?word=%E5%9B%BD%E9%98%B2%E9%83%A8%E5%9B%9E%E5%BA%94%E6%BE%B3%E5%86%9B%E6%9C%BA%E4%BE%B5%E9%97%AF%E8%A5%BF%E6%B2%99%E9%A2%86%E7%A9%BA&sa=fyb_news,https://fyb-2.cdn.bcebos.com/hotboard_image/f7a3daaa3e6f3fd24ea3480bfd44aa29
20,特朗普对俄乌和谈态度再变,,5989205,https://m.baidu.com/s?word=%E7%89%B9%E6%9C%97%E6%99%AE%E5%AF%B9%E4%BF%84%E4%B9%8C%E5%92%8C%E8%B0%88%E6%80%81%E5%BA%A6%E5%86%8D%E5%8F%98&sa=fyb_news,https://fyb-1.cdn.bcebos.com/fyb/de6163834f53ca92c1273fff98ac9078.jpeg
21,“千年一遇”的彗星来了,近期，C/2025 A6（Lemmon）彗星成为全球瞩目的对象。这是一颗“千年一遇”的彗星，10月21日刚刚过近地点，11月8日还将过近日点。,5895967,https://m.baidu.com/s?word=%E2%80%9C%E5%8D%83%E5%B9%B4%E4%B8%80%E9%81%87%E2%80%9D%E7%9A%84%E5%BD%97%E6%98%9F%E6%9D%A5%E4%BA%86&sa=fyb_news,https://fyb-2.cdn.bcebos.com/hotboard_image/8fa0f7f883bf765c9bc706badbd76020
22,黄金暴跌 有人前一天赚4万今天亏4万,10月21日，国际黄金市场在此前连创纪录高位后急剧下挫。现货黄金一度暴跌超6%，一夜暴跌60元。创下自2013年4月以来最大单日跌幅。有投资者称：前一天还盈利4万，今天直接亏空4万。,5797235,https://m.baidu.com/s?word=%E9%BB%84%E9%87%91%E6%9A%B4%E8%B7%8C+%E6%9C%89%E4%BA%BA%E5%89%8D%E4%B8%80%E5%A4%A9%E8%B5%9A4%E4%B8%87%E4%BB%8A%E5%A4%A9%E4%BA%8F4%E4%B8%87&sa=fyb_news,https://fyb-2.cdn.bcebos.com/hotboard_image/e855a0a921fce53129fa5a4862ec6290
23,教授每年强制自己定投100克黄金,80后的余教授是武汉某高校一名博导，他在投资理财方面颇有独到风格。他就养成了每年将年终奖强制拿出一部分购买100克的金条，最初购买的金条收益已经近四倍。,5702746,https://m.baidu.com/s?word=%E6%95%99%E6%8E%88%E6%AF%8F%E5%B9%B4%E5%BC%BA%E5%88%B6%E8%87%AA%E5%B7%B1%E5%AE%9A%E6%8A%95100%E5%85%8B%E9%BB%84%E9%87%91&sa=fyb_news,https://fyb-2.cdn.bcebos.com/hotboard_image/1e54d5ba18b46d36164b8b5f1adfd1ee
24,云南：公务出行不得租用奔驰宝马奥迪,近日，云南省机关事务管理局、云南省财政厅联合印发《云南省省级行政事业单位公务出行租赁车辆管理办法》。其中明确，公务出行不得租用奔驰宝马奥迪等进口高端豪华品牌。,5611770,https://m.baidu.com/s?word=%E4%BA%91%E5%8D%97%EF%BC%9A%E5%85%AC%E5%8A%A1%E5%87%BA%E8%A1%8C%E4%B8%8D%E5%BE%97%E7%A7%9F%E7%94%A8%E5%A5%94%E9%A9%B0%E5%AE%9D%E9%A9%AC%E5%A5%A5%E8%BF%AA&sa=fyb_news,https://fyb-2.cdn.bcebos.com/hotboard_image/40771c11fa0314c69ad516b295a641ee
25,佩通坦辞去为泰党党首职务,泰国前总理佩通坦22日在社交媒体上发文，宣布辞去为泰党党首职务。,5517612,https://m.baidu.com/s?word=%E4%BD%A9%E9%80%9A%E5%9D%A6%E8%BE%9E%E5%8E%BB%E4%B8%BA%E6%B3%B0%E5%85%9A%E5%85%9A%E9%A6%96%E8%81%8C%E5%8A%A1&sa=fyb_news,https://fyb-2.cdn.bcebos.com/hotboard_image/0474a32d0ae7c29626476c01ca07545d
26,专家回应入秋后脱发门诊一号难求,,5407277,https://m.baidu.com/s?word=%E4%B8%93%E5%AE%B6%E5%9B%9E%E5%BA%94%E5%85%A5%E7%A7%8B%E5%90%8E%E8%84%B1%E5%8F%91%E9%97%A8%E8%AF%8A%E4%B8%80%E5%8F%B7%E9%9A%BE%E6%B1%82&sa=fyb_news,https://fyb-1.cdn.bcebos.com/fyb/de6163834f53ca92c1273fff98ac9078.jpeg
27,作家匪我思存受聘武汉大学文学院,10月20日，武汉大学文学院邀请中国作家协会全国委员会委员、湖北省作家协会副主席、湖北省网络作家协会会长、著名作家匪我思存，举行武汉大学文学院中文创意写作行业导师受聘仪式。,5335124,https://m.baidu.com/s?word=%E4%BD%9C%E5%AE%B6%E5%8C%AA%E6%88%91%E6%80%9D%E5%AD%98%E5%8F%97%E8%81%98%E6%AD%A6%E6%B1%89%E5%A4%A7%E5%AD%A6%E6%96%87%E5%AD%A6%E9%99%A2&sa=fyb_news,https://fyb-2.cdn.bcebos.com/hotboard_image/f40d4c4e700d95b4c6c2f55db10c0d1b
28,探废潮流兴起 年轻人涌入废弃工厂,近日，一股名为“探废”的潮流正在社交平台上悄然兴起，吸引大量年轻人涌入废弃工厂、停诊医院、烂尾楼盘探索、举办活动。这股风潮的兴起，与流量的推动密不可分。许多内容创作者致力于将冒险行为包装成一种深沉的文化探索。,5231878,https://m.baidu.com/s?word=%E6%8E%A2%E5%BA%9F%E6%BD%AE%E6%B5%81%E5%85%B4%E8%B5%B7+%E5%B9%B4%E8%BD%BB%E4%BA%BA%E6%B6%8C%E5%85%A5%E5%BA%9F%E5%BC%83%E5%B7%A5%E5%8E%82&sa=fyb_news,https://fyb-2.cdn.bcebos.com/hotboard_image/44994a64e3ba3afbb6989c318e315196
29,入冬时间提前 北京今年咋这么冷,近日，北京南郊观象台连续两天气温跌破冰点，最低达-0.5℃。受较强冷空气影响，北京10月18日至24日平均气温持续低于10℃，预计将于10月18日提前入冬，比常年提早约半个月。,5144807,https://m.baidu.com/s?word=%E5%85%A5%E5%86%AC%E6%97%B6%E9%97%B4%E6%8F%90%E5%89%8D+%E5%8C%97%E4%BA%AC%E4%BB%8A%E5%B9%B4%E5%92%8B%E8%BF%99%E4%B9%88%E5%86%B7&sa=fyb_news,https://fyb-2.cdn.bcebos.com/hotboard_image/fce74f5872ae16a18a08e5740e9160a1
30,国产机器人大跳迈克尔杰克逊舞蹈,,5028522,https://m.baidu.com/s?word=%E5%9B%BD%E4%BA%A7%E6%9C%BA%E5%99%A8%E4%BA%BA%E5%A4%A7%E8%B7%B3%E8%BF%88%E5%85%8B%E5%B0%94%E6%9D%B0%E5%85%8B%E9%80%8A%E8%88%9E%E8%B9%88&sa=fyb_news,https://fyb-1.cdn.bcebos.com/fyb/de6163834f53ca92c1273fff98ac9078.jpeg
31,波兰外长威胁对普京动手 俄方回应,据俄新社等媒体报道，对于北约成员国波兰外长西科尔斯基发表关于俄罗斯总统普京专机的消极言论，俄外长拉夫罗夫21日发声予以谴责。,4940510,https://m.baidu.com/s?word=%E6%B3%A2%E5%85%B0%E5%A4%96%E9%95%BF%E5%A8%81%E8%83%81%E5%AF%B9%E6%99%AE%E4%BA%AC%E5%8A%A8%E6%89%8B+%E4%BF%84%E6%96%B9%E5%9B%9E%E5%BA%94&sa=fyb_news,https://fyb-2.cdn.bcebos.com/hotboard_image/789fcb82770d08308d254f8e20c5ebd9
32,于东来“个人分享交流”收费50万元,10月21日，胖东来创始人于东来宣布推出50万元/次的个人企业家交流服务，每月限1次、时长3小时，费用将用于传播美好理念。其同步规划了100万元/人的线下企业学习活动，并承诺保留免费线上分享渠道。,4845808,https://m.baidu.com/s?word=%E4%BA%8E%E4%B8%9C%E6%9D%A5%E2%80%9C%E4%B8%AA%E4%BA%BA%E5%88%86%E4%BA%AB%E4%BA%A4%E6%B5%81%E2%80%9D%E6%94%B6%E8%B4%B950%E4%B8%87%E5%85%83&sa=fyb_news,https://fyb-2.cdn.bcebos.com/hotboard_image/49c625782c6fd82e19ce032b784d1ff1
33,孙颖莎职业生涯已获102个冠军,据悉，孙颖莎已手握102枚冠军奖牌。这串数字既印证她能在单打赛场孤军突围，也能在双打与团体战中默契搭档的全能实力。这102枚奖牌每一枚都刻着坚持，也向世界展现中国乒乓代代传承的力量。,4735165,https://m.baidu.com/s?word=%E5%AD%99%E9%A2%96%E8%8E%8E%E8%81%8C%E4%B8%9A%E7%94%9F%E6%B6%AF%E5%B7%B2%E8%8E%B7102%E4%B8%AA%E5%86%A0%E5%86%9B&sa=fyb_news,https://fyb-2.cdn.bcebos.com/hotboard_image/6feea007abdcbb122d1d52eca2f406b5
34,现货黄金创4年来最大跌幅,10月21日，现货黄金一度下跌3.8%，现货黄金创四年来最大跌幅！业内人士：短期存在金价大幅波动风险，避免盲目跟风追涨。,4666574,https://m.baidu.com/s?word=%E7%8E%B0%E8%B4%A7%E9%BB%84%E9%87%91%E5%88%9B4%E5%B9%B4%E6%9D%A5%E6%9C%80%E5%A4%A7%E8%B7%8C%E5%B9%85&sa=fyb_news,https://fyb-2.cdn.bcebos.com/hotboard_image/b2e8ba900aa91cb1cb7a50fe385d45fb
35,雷霆双加时125比124险胜火箭,,4544976,https://m.baidu.com/s?word=%E9%9B%B7%E9%9C%86%E5%8F%8C%E5%8A%A0%E6%97%B6125%E6%AF%94124%E9%99%A9%E8%83%9C%E7%81%AB%E7%AE%AD&sa=fyb_news,https://fyb-1.cdn.bcebos.com/fyb/de6163834f53ca92c1273fff98ac9078.jpeg
36,特朗普又改口：我从未说过乌克兰会赢,美国总统特朗普20日称，他“从未说过乌克兰会赢”。美国媒体解读，这再次表明特朗普对乌克兰在俄乌冲突中获胜的前景持怀疑态度。,4454571,https://m.baidu.com/s?word=%E7%89%B9%E6%9C%97%E6%99%AE%E5%8F%88%E6%94%B9%E5%8F%A3%EF%BC%9A%E6%88%91%E4%BB%8E%E6%9C%AA%E8%AF%B4%E8%BF%87%E4%B9%8C%E5%85%8B%E5%85%B0%E4%BC%9A%E8%B5%A2&sa=fyb_news,https://fyb-2.cdn.bcebos.com/hotboard_image/eb01109db77c51096edc9d4252be7c46
37,第一视角体验TNT实爆现场,,4360791,https://m.baidu.com/s?word=%E7%AC%AC%E4%B8%80%E8%A7%86%E8%A7%92%E4%BD%93%E9%AA%8CTNT%E5%AE%9E%E7%88%86%E7%8E%B0%E5%9C%BA&sa=fyb_news,https://fyb-1.cdn.bcebos.com/fyb/de6163834f53ca92c1273fff98ac9078.jpeg
38,日本流感疫情持续扩散,日本流感疫情持续扩散，10月6日至12日，全国3800多家定点医疗机构报告流感病例9073例，新增病例数连续8周增加，近千所教育机构停课。,4275995,https://m.baidu.com/s?word=%E6%97%A5%E6%9C%AC%E6%B5%81%E6%84%9F%E7%96%AB%E6%83%85%E6%8C%81%E7%BB%AD%E6%89%A9%E6%95%A3&sa=fyb_news,https://fyb-2.cdn.bcebos.com/hotboard_image/2fca213acd582a60fbfb208c904ab7cc
39,行刺斯洛伐克总理枪手获刑21年,,4172328,https://m.baidu.com/s?word=%E8%A1%8C%E5%88%BA%E6%96%AF%E6%B4%9B%E4%BC%90%E5%85%8B%E6%80%BB%E7%90%86%E6%9E%AA%E6%89%8B%E8%8E%B7%E5%88%9121%E5%B9%B4&sa=fyb_news,https://fyb-1.cdn.bcebos.com/fyb/de6163834f53ca92c1273fff98ac9078.jpeg
40,生育津贴这些知识要知道,生育津贴是一种生育保险待遇，也叫“产假工资”。近年来，各地探索由“单位代发”转为“直付个人”，让参保女职工能够更便捷地享受到生育津贴。 生育津贴的这些知识，需要大家知道。,4070698,https://m.baidu.com/s?word=%E7%94%9F%E8%82%B2%E6%B4%A5%E8%B4%B4%E8%BF%99%E4%BA%9B%E7%9F%A5%E8%AF%86%E8%A6%81%E7%9F%A5%E9%81%93&sa=fyb_news,https://fyb-2.cdn.bcebos.com/hotboard_image/355e9eeeb35a31cb9e1cb280d89b0ac2
41,LPL致敬Karsa,,4003756,https://m.baidu.com/s?word=LPL%E8%87%B4%E6%95%ACKarsa&sa=fyb_news,https://fyb-1.cdn.bcebos.com/fyb/de6163834f53ca92c1273fff98ac9078.jpeg
42,俄打击乌军事目标 乌阻止俄军进攻,,3891051,https://m.baidu.com/s?word=%E4%BF%84%E6%89%93%E5%87%BB%E4%B9%8C%E5%86%9B%E4%BA%8B%E7%9B%AE%E6%A0%87+%E4%B9%8C%E9%98%BB%E6%AD%A2%E4%BF%84%E5%86%9B%E8%BF%9B%E6%94%BB&sa=fyb_news,https://fyb-1.cdn.bcebos.com/fyb/de6163834f53ca92c1273fff98ac9078.jpeg
43,台湾岛内政党政治献金收支公布,,3774343,https://m.baidu.com/s?word=%E5%8F%B0%E6%B9%BE%E5%B2%9B%E5%86%85%E6%94%BF%E5%85%9A%E6%94%BF%E6%B2%BB%E7%8C%AE%E9%87%91%E6%94%B6%E6%94%AF%E5%85%AC%E5%B8%83&sa=fyb_news,https://fyb-1.cdn.bcebos.com/fyb/de6163834f53ca92c1273fff98ac9078.jpeg
44,意大利豪掷5.8亿元加强文物安保,,3678282,https://m.baidu.com/s?word=%E6%84%8F%E5%A4%A7%E5%88%A9%E8%B1%AA%E6%8E%B75.8%E4%BA%BF%E5%85%83%E5%8A%A0%E5%BC%BA%E6%96%87%E7%89%A9%E5%AE%89%E4%BF%9D&sa=fyb_news,https://fyb-1.cdn.bcebos.com/fyb/de6163834f53ca92c1273fff98ac9078.jpeg
45,“用AI流浪汉骗家人”走红 民警提醒,近日，用AI制作“流浪汉闯入家中”图片来整蛊家人的帖子，在社交平台走红。有人将流浪汉的AI图片发送给配偶或家人，以此测试对方的反应，以及自己在对方心中的重要性。民警提醒：此举浪费警力或触法，最高可判5年。,3592257,https://m.baidu.com/s?word=%E2%80%9C%E7%94%A8AI%E6%B5%81%E6%B5%AA%E6%B1%89%E9%AA%97%E5%AE%B6%E4%BA%BA%E2%80%9D%E8%B5%B0%E7%BA%A2+%E6%B0%91%E8%AD%A6%E6%8F%90%E9%86%92&sa=fyb_news,https://fyb-2.cdn.bcebos.com/hotboard_image/51fab0fee928eee9ce5650a881d57ca2
46,哥南部一监狱转移囚犯时发生骚乱,,3492582,https://m.baidu.com/s?word=%E5%93%A5%E5%8D%97%E9%83%A8%E4%B8%80%E7%9B%91%E7%8B%B1%E8%BD%AC%E7%A7%BB%E5%9B%9A%E7%8A%AF%E6%97%B6%E5%8F%91%E7%94%9F%E9%AA%9A%E4%B9%B1&sa=fyb_news,https://fyb-1.cdn.bcebos.com/fyb/de6163834f53ca92c1273fff98ac9078.jpeg
47,韩称朝鲜向半岛东部海域发射导弹,当地时间22日，韩国联合参谋本部称，朝鲜向半岛东部方向发射不明弹道导弹。目前，朝鲜方面暂无回应。,3403335,https://m.baidu.com/s?word=%E9%9F%A9%E7%A7%B0%E6%9C%9D%E9%B2%9C%E5%90%91%E5%8D%8A%E5%B2%9B%E4%B8%9C%E9%83%A8%E6%B5%B7%E5%9F%9F%E5%8F%91%E5%B0%84%E5%AF%BC%E5%BC%B9&sa=fyb_news,https://fyb-2.cdn.bcebos.com/hotboard_image/aab7945c4443432a143729983e67329c
48,BOSS直聘回应“前台”被列竞招职位,10月21日，BOSS直聘回应“前台“等基础岗位被列为竞招职位的情况，称竞招职位与普通职位由系统根据市场供求关系自动判定，不同地区不同岗位具体的收费情况不尽相同。,3313760,https://m.baidu.com/s?word=BOSS%E7%9B%B4%E8%81%98%E5%9B%9E%E5%BA%94%E2%80%9C%E5%89%8D%E5%8F%B0%E2%80%9D%E8%A2%AB%E5%88%97%E7%AB%9E%E6%8B%9B%E8%81%8C%E4%BD%8D&sa=fyb_news,https://fyb-2.cdn.bcebos.com/hotboard_image/1e85e71b247018e33f02f1af504cc571
49,厄瓜多尔发生6.0级地震,,3212280,https://m.baidu.com/s?word=%E5%8E%84%E7%93%9C%E5%A4%9A%E5%B0%94%E5%8F%91%E7%94%9F6.0%E7%BA%A7%E5%9C%B0%E9%9C%87&sa=fyb_news,https://fyb-1.cdn.bcebos.com/fyb/de6163834f53ca92c1273fff98ac9078.jpeg
50,台湾媒体人走进杨靖宇将军纪念馆,,3140350,https://m.baidu.com/s?word=%E5%8F%B0%E6%B9%BE%E5%AA%92%E4%BD%93%E4%BA%BA%E8%B5%B0%E8%BF%9B%E6%9D%A8%E9%9D%96%E5%AE%87%E5%B0%86%E5%86%9B%E7%BA%AA%E5%BF%B5%E9%A6%86&sa=fyb_news,https://fyb-1.cdn.bcebos.com/fyb/de6163834f53ca92c1273fff98ac9078.jpeg
