热搜排名,热搜标题,描述,热搜指数,链接地址,封图链接
46,官方通报马库斯和平小屋事件,,3499884,https://m.baidu.com/s?word=%E5%AE%98%E6%96%B9%E9%80%9A%E6%8A%A5%E9%A9%AC%E5%BA%93%E6%96%AF%E5%92%8C%E5%B9%B3%E5%B0%8F%E5%B1%8B%E4%BA%8B%E4%BB%B6&sa=fyb_news,https://fyb-1.cdn.bcebos.com/fyb/de6163834f53ca92c1273fff98ac9078.jpeg
47,全运会“东莞烧鹅”萌翻全场,,3417746,https://m.baidu.com/s?word=%E5%85%A8%E8%BF%90%E4%BC%9A%E2%80%9C%E4%B8%9C%E8%8E%9E%E7%83%A7%E9%B9%85%E2%80%9D%E8%90%8C%E7%BF%BB%E5%85%A8%E5%9C%BA&sa=fyb_news,https://fyb-1.cdn.bcebos.com/fyb/de6163834f53ca92c1273fff98ac9078.jpeg
48,奇瑞天门山测试无需文旅部门审批,近日，奇瑞风云X3L在湖南张家界天门山景区进行挑战测试，从台阶上下滑撞断部分护栏。11月13日，天门山景区工作人员称已重新开放，但被汽车撞坏的护栏暂未修好。文旅局工作人员表示：该活动为景区举办，无需文旅部门审批，后续文旅局将与景区对接。,3312677,https://m.baidu.com/s?word=%E5%A5%87%E7%91%9E%E5%A4%A9%E9%97%A8%E5%B1%B1%E6%B5%8B%E8%AF%95%E6%97%A0%E9%9C%80%E6%96%87%E6%97%85%E9%83%A8%E9%97%A8%E5%AE%A1%E6%89%B9&sa=fyb_news,https://fyb-2.cdn.bcebos.com/hotboard_image/cd87b7f03ae542ea65c4865337ff1251
49,A股收盘：沪指涨0.73%刷新十年新高,11月13日，A股三大指数低开高走，沪指涨0.73%报4029点刷新十年新高，深成指、创业板指分别涨1.78%、2.55%。沪深两市成交额超2万亿元，较前一日放量近千亿，全市场超3900股上涨，锂电池产业链爆发带动近30股涨停。,3206188,https://m.baidu.com/s?word=A%E8%82%A1%E6%94%B6%E7%9B%98%EF%BC%9A%E6%B2%AA%E6%8C%87%E6%B6%A80.73%25%E5%88%B7%E6%96%B0%E5%8D%81%E5%B9%B4%E6%96%B0%E9%AB%98&sa=fyb_news,https://fyb-2.cdn.bcebos.com/hotboard_image/461dd663aeb23efe4285529816627590
50,游泳冠军张展硕是复旦大学新闻学的,11月10日和12日，复旦大学新闻学院本科生、18岁小将张展硕在第十五届全国运动会游泳项目中连续夺得男子400米自由泳和200米自由泳金牌，成为赛事双冠王。赛后，他以新闻学专业身份主动采访亚军选手季新杰，引发关注。,3126210,https://m.baidu.com/s?word=%E6%B8%B8%E6%B3%B3%E5%86%A0%E5%86%9B%E5%BC%A0%E5%B1%95%E7%A1%95%E6%98%AF%E5%A4%8D%E6%97%A6%E5%A4%A7%E5%AD%A6%E6%96%B0%E9%97%BB%E5%AD%A6%E7%9A%84&sa=fyb_news,https://fyb-2.cdn.bcebos.com/hotboard_image/2f054e6b12df2a8aa5c5e0475dc73fb4
