热搜排名,热搜标题,描述,热搜指数,链接地址,封图链接
0,从三个3000万看中国经济潜能,习近平总书记深刻指出：“我国经济基础稳、优势多、韧性强、潜能大，长期向好的支撑条件和基本趋势没有变。”近期，汽车产业的“三个3000万”引发关注。从中，我们可以更好把握中国经济潜能。,7904571,https://m.baidu.com/s?word=%E4%BB%8E%E4%B8%89%E4%B8%AA3000%E4%B8%87%E7%9C%8B%E4%B8%AD%E5%9B%BD%E7%BB%8F%E6%B5%8E%E6%BD%9C%E8%83%BD&sa=fyb_news,https://fyb-2.cdn.bcebos.com/hotboard_image/8b8af19108663b73c770adb97009191c
1,长征十二号甲运载火箭回收未达预期,12月23日，长征十二号甲运载火箭完成首飞并成功实现二级入轨，但一级火箭回收验证未达预期。该火箭为我国首飞即尝试回收的液氧甲烷火箭之一，此次任务获取了多项关键飞行与回收数据。,7809049,https://m.baidu.com/s?word=%E9%95%BF%E5%BE%81%E5%8D%81%E4%BA%8C%E5%8F%B7%E7%94%B2%E8%BF%90%E8%BD%BD%E7%81%AB%E7%AE%AD%E5%9B%9E%E6%94%B6%E6%9C%AA%E8%BE%BE%E9%A2%84%E6%9C%9F&sa=fyb_news,https://fyb-2.cdn.bcebos.com/hotboard_image/5bcae0d8d72bb1fe37e5ee5ca2119238
2,郑丽文激动发声：我们是中国人,12月22日，中国国民党主席郑丽文在台湾东吴大学演讲时回应政治系副教授陈方隅提问，强调“我是中国人”是自然的文化认同，批评民进党30年来将这一身份妖魔化。她以汉字、语言、饮食等生活细节为例，呼吁正视两岸共同历史渊源。,7713404,https://m.baidu.com/s?word=%E9%83%91%E4%B8%BD%E6%96%87%E6%BF%80%E5%8A%A8%E5%8F%91%E5%A3%B0%EF%BC%9A%E6%88%91%E4%BB%AC%E6%98%AF%E4%B8%AD%E5%9B%BD%E4%BA%BA&sa=fyb_news,https://fyb-2.cdn.bcebos.com/hotboard_image/ebbeee2ae6ae2b868cbc3e7333225246
3,我国ETF规模达5.78万亿元,2025年中国公募基金市场迎来历史性突破，ETF规模冲上5.78万亿元，FOF年内发行规模超800亿元，双双刷新纪录。,7617267,https://m.baidu.com/s?word=%E6%88%91%E5%9B%BDETF%E8%A7%84%E6%A8%A1%E8%BE%BE5.78%E4%B8%87%E4%BA%BF%E5%85%83&sa=fyb_news,https://fyb-2.cdn.bcebos.com/hotboard_image/8b40ea1a9ec32207c575acceb819bb53
4,23岁硕士徒步去世前已主动返程,12月21日，有登山经验的23岁硕士跟随重庆户外社群，违规进入已封山的川西田海子冰川徒步。未达目的地因返程时间临近主动下撤，途中突发休克，经同行者急救无效身亡，领队推测或为心源性猝死，警方正调查原因。,7519919,https://m.baidu.com/s?word=23%E5%B2%81%E7%A1%95%E5%A3%AB%E5%BE%92%E6%AD%A5%E5%8E%BB%E4%B8%96%E5%89%8D%E5%B7%B2%E4%B8%BB%E5%8A%A8%E8%BF%94%E7%A8%8B&sa=fyb_news,https://fyb-2.cdn.bcebos.com/hotboard_image/e4138df8b41a03328aeaeec6673ca63b
5,公务员遴选成绩第1却落选 重庆通报,近日，重庆33岁男子参加公务员遴选成绩第一却落选，引发热议。12月23日，重庆市财政局发布情况通报称，考生与岗位要求有较大差距，且档案中有关事项存疑。考察程序合规，10名考察对象中5人未获试用。,7424823,https://m.baidu.com/s?word=%E5%85%AC%E5%8A%A1%E5%91%98%E9%81%B4%E9%80%89%E6%88%90%E7%BB%A9%E7%AC%AC1%E5%8D%B4%E8%90%BD%E9%80%89+%E9%87%8D%E5%BA%86%E9%80%9A%E6%8A%A5&sa=fyb_news,https://fyb-2.cdn.bcebos.com/hotboard_image/66b60a9e90f7bee2fd2e7cd69bb2f44a
6,两男子用AI造谣中国女篮被刑拘,林某某、陈某某利用AI造谣抹黑中国女篮，北京警方迅速查获二人，其行为旨在引流牟利，目前已被刑拘。,7329364,https://m.baidu.com/s?word=%E4%B8%A4%E7%94%B7%E5%AD%90%E7%94%A8AI%E9%80%A0%E8%B0%A3%E4%B8%AD%E5%9B%BD%E5%A5%B3%E7%AF%AE%E8%A2%AB%E5%88%91%E6%8B%98&sa=fyb_news,https://fyb-2.cdn.bcebos.com/hotboard_image/ff9979916a40efdc3eb707eb5fda020e
7,俄中将被炸身亡 传递危险信号,当地时间12月22日，莫斯科街头的一声爆炸，俄罗斯中将萨尔瓦罗夫重伤，随后不治身亡。这起中将遇刺事件，传递了相当危险的信号：第一，俄罗斯将军们很凶险。第二，俄乌双方杀红了眼。,7238938,https://m.baidu.com/s?word=%E4%BF%84%E4%B8%AD%E5%B0%86%E8%A2%AB%E7%82%B8%E8%BA%AB%E4%BA%A1+%E4%BC%A0%E9%80%92%E5%8D%B1%E9%99%A9%E4%BF%A1%E5%8F%B7&sa=fyb_news,https://fyb-2.cdn.bcebos.com/hotboard_image/cfee17aee1abaeb1e3b1404169c404df
8,5兄妹打官司 妹妹们笑着当被告,12月19日，黑龙江双鸭山兄妹五人因房产过户对簿公堂，妹妹们笑着当被告，主动放弃房产同意过户大哥。众人因老母亲行动不便、妹妹在外地，将法庭开到家中，大哥还打算赠外甥一套房作婚房，尽显温情。,7137808,https://m.baidu.com/s?word=5%E5%85%84%E5%A6%B9%E6%89%93%E5%AE%98%E5%8F%B8+%E5%A6%B9%E5%A6%B9%E4%BB%AC%E7%AC%91%E7%9D%80%E5%BD%93%E8%A2%AB%E5%91%8A&sa=fyb_news,https://fyb-2.cdn.bcebos.com/hotboard_image/3ba70f215be0a0cb0e11fe029805b4df
9,80后翻出儿时“武功秘籍”教女儿英语,近日，一名80后爸爸为培养女儿对英语的兴趣，翻出自己儿时的“武功秘籍”。网友：上链接，多一刻都等不了！,7045579,https://m.baidu.com/s?word=80%E5%90%8E%E7%BF%BB%E5%87%BA%E5%84%BF%E6%97%B6%E2%80%9C%E6%AD%A6%E5%8A%9F%E7%A7%98%E7%B1%8D%E2%80%9D%E6%95%99%E5%A5%B3%E5%84%BF%E8%8B%B1%E8%AF%AD&sa=fyb_news,https://fyb-2.cdn.bcebos.com/hotboard_image/161fb5b13bc1547a73f3f3b2278a361b
10,国安机关提醒！碎纸机也可能泄密,随着窃密手段不断迭代，看似可靠的碎纸机，正成为泄密风险的隐秘源头。因此，国家安全机关提示，涉密载体销毁应当使用符合国家保密标准的销毁设备和方法，确保信息无法被还原。,6949689,https://m.baidu.com/s?word=%E5%9B%BD%E5%AE%89%E6%9C%BA%E5%85%B3%E6%8F%90%E9%86%92%EF%BC%81%E7%A2%8E%E7%BA%B8%E6%9C%BA%E4%B9%9F%E5%8F%AF%E8%83%BD%E6%B3%84%E5%AF%86&sa=fyb_news,https://fyb-2.cdn.bcebos.com/hotboard_image/d50663c055df786e399046c5b103c29e
11,福原爱向再婚丈夫家人致歉,12月22日，37岁的日本乒乓球名将福原爱在近期采访中宣布再婚并怀孕，现任丈夫为2021年风波中的“横滨男”。她澄清，两人于离婚后的2021年末正式交往，并向丈夫家人及自己家人致歉，称给他们带来了极大困扰。,6854047,https://m.baidu.com/s?word=%E7%A6%8F%E5%8E%9F%E7%88%B1%E5%90%91%E5%86%8D%E5%A9%9A%E4%B8%88%E5%A4%AB%E5%AE%B6%E4%BA%BA%E8%87%B4%E6%AD%89&sa=fyb_news,https://fyb-2.cdn.bcebos.com/hotboard_image/0d4094a2326204a047d1bc35f3833f88
12,男子参加公务员遴选 成绩第一却落选,近日，重庆一名33岁男子参加市财政局公务员遴选，报考“综合管理2”岗位，笔试、面试成绩及综合成绩均排名第一，并顺利通过体检进入考察环节，最终却未出现在拟试用人员名单中。家属称落选原因系考察评价未满分，引发质疑。,6755646,https://m.baidu.com/s?word=%E7%94%B7%E5%AD%90%E5%8F%82%E5%8A%A0%E5%85%AC%E5%8A%A1%E5%91%98%E9%81%B4%E9%80%89+%E6%88%90%E7%BB%A9%E7%AC%AC%E4%B8%80%E5%8D%B4%E8%90%BD%E9%80%89&sa=fyb_news,https://fyb-2.cdn.bcebos.com/hotboard_image/38f67ca3dd74e6da6e8d0de3502acb9f
13,98%中国亿万富豪都是白手起家,2025年瑞银《亿万富豪报告》显示，中国内地新增70位亿万富豪，总人数达470人（仅次于美国），其中98%为白手起家，财富总额1.8万亿美元。,6664481,https://m.baidu.com/s?word=98%25%E4%B8%AD%E5%9B%BD%E4%BA%BF%E4%B8%87%E5%AF%8C%E8%B1%AA%E9%83%BD%E6%98%AF%E7%99%BD%E6%89%8B%E8%B5%B7%E5%AE%B6&sa=fyb_news,https://fyb-2.cdn.bcebos.com/hotboard_image/0f8132c353bfe8ccda36986f8803e686
14,爱泼斯坦案文件恢复 特朗普出镜两次,近日，美国司法部恢复了编号为“468”的“爱泼斯坦文件”。这张图像文件展示的是爱泼斯坦的一张书桌，书桌的桌面、拉开的抽屉中摆放着涉及现任总统特朗普、前总统克林顿等人的敏感照片。其中特朗普共“出镜”两次。,6570151,https://m.baidu.com/s?word=%E7%88%B1%E6%B3%BC%E6%96%AF%E5%9D%A6%E6%A1%88%E6%96%87%E4%BB%B6%E6%81%A2%E5%A4%8D+%E7%89%B9%E6%9C%97%E6%99%AE%E5%87%BA%E9%95%9C%E4%B8%A4%E6%AC%A1&sa=fyb_news,https://fyb-2.cdn.bcebos.com/hotboard_image/f52cdb442e7023d0afe48a3ab3546bbc
15,新纪录！A股年成交额首破400万亿元,截至12月22日，A股年内总成交额超过405万亿元，历史上首次突破400万亿元，整体换手率接近1.74%。年内共有19只个股成交额超万亿元，中际旭创、东方财富、新易盛等成交额居前。,6467962,https://m.baidu.com/s?word=%E6%96%B0%E7%BA%AA%E5%BD%95%EF%BC%81A%E8%82%A1%E5%B9%B4%E6%88%90%E4%BA%A4%E9%A2%9D%E9%A6%96%E7%A0%B4400%E4%B8%87%E4%BA%BF%E5%85%83&sa=fyb_news,https://fyb-2.cdn.bcebos.com/hotboard_image/2d2fbb140fcb06fb309fb9ce8815c3ab
16,大疆：对美方决定表示遗憾,12月23日，中国无人机制造商大疆创新表示，对于美国联邦通信委员会（FCC）将所有非美国制造的无人机列入“Covered List”（受管制清单）的决定表示遗憾。,6379595,https://m.baidu.com/s?word=%E5%A4%A7%E7%96%86%EF%BC%9A%E5%AF%B9%E7%BE%8E%E6%96%B9%E5%86%B3%E5%AE%9A%E8%A1%A8%E7%A4%BA%E9%81%97%E6%86%BE&sa=fyb_news,https://fyb-2.cdn.bcebos.com/hotboard_image/9059020d50be1d8524a8f3dadaa27fe0
17,女生开电热毯整夜没翻身得压疮,21岁女大学生小林（化名）因长期颈椎疼痛休学在家。2025年初的一个寒夜，她因服用过量安眠药陷入深度睡眠，整夜未翻身，加之电热毯持续开启，导致臀部出现Ⅳ期压疮，损伤深达骶骨。经杭州市第一人民医院城北院区手术治疗后康复出院，医生表示，安眠药抑制翻身反射与电热毯持续加热是主要诱因。,6279913,https://m.baidu.com/s?word=%E5%A5%B3%E7%94%9F%E5%BC%80%E7%94%B5%E7%83%AD%E6%AF%AF%E6%95%B4%E5%A4%9C%E6%B2%A1%E7%BF%BB%E8%BA%AB%E5%BE%97%E5%8E%8B%E7%96%AE&sa=fyb_news,https://fyb-2.cdn.bcebos.com/hotboard_image/aebc7a36414f81c2d7aabc3127e185d8
18,“秒回师”爆火 主打即时回应,近日，“秒回师”这一新兴职业走红网络。该职业主打在约定时段内提供即时消息回应和情感陪伴，服务内容以倾听和共情为主，深受年轻群体欢迎。其收费按时段计价，夜间价格更高，部分从业者兼职月入过万，引发关注与讨论。,6177862,https://m.baidu.com/s?word=%E2%80%9C%E7%A7%92%E5%9B%9E%E5%B8%88%E2%80%9D%E7%88%86%E7%81%AB+%E4%B8%BB%E6%89%93%E5%8D%B3%E6%97%B6%E5%9B%9E%E5%BA%94&sa=fyb_news,https://fyb-2.cdn.bcebos.com/hotboard_image/5e949db38f1dac2bdf10e4e0ea5a713a
19,成龙意大利传递火炬 打醉拳身手矫健,近日，71岁成龙在意大利庞贝古城参与2026年米兰科尔蒂纳冬奥会火炬传递，身穿统一服装手持火炬，现场表演醉拳经典动作并与熊猫玩偶合影，引发国际粉丝欢呼。他受访时表示，火炬象征体育精神与和平。,6095708,https://m.baidu.com/s?word=%E6%88%90%E9%BE%99%E6%84%8F%E5%A4%A7%E5%88%A9%E4%BC%A0%E9%80%92%E7%81%AB%E7%82%AC+%E6%89%93%E9%86%89%E6%8B%B3%E8%BA%AB%E6%89%8B%E7%9F%AB%E5%81%A5&sa=fyb_news,https://fyb-2.cdn.bcebos.com/hotboard_image/30d8d3b23566995fd30d52d152f54cb7
20,独居女子离世无法买墓地？民政局回应,近日，46岁独居女子蒋女士离世后，因其个人遗产归公和“无法用遗产购买墓地”等问题引发争议。12月22日，虹口区民政局工作人员回应：民政局始终以逝者的利益为主。后续如要购买墓地，可从遗产中支出。,5997456,https://m.baidu.com/s?word=%E7%8B%AC%E5%B1%85%E5%A5%B3%E5%AD%90%E7%A6%BB%E4%B8%96%E6%97%A0%E6%B3%95%E4%B9%B0%E5%A2%93%E5%9C%B0%EF%BC%9F%E6%B0%91%E6%94%BF%E5%B1%80%E5%9B%9E%E5%BA%94&sa=fyb_news,https://fyb-2.cdn.bcebos.com/hotboard_image/6148dbb16343722d3680f63eb5f25033
21,苹果实况图总定格尴尬瞬间？客服回应,12月23日，“iPhone实况图的选取机制”相关话题引发关注。对此，苹果官方客服表示，iPhone实况图封面帧为系统随机选取，无法改变系统默认设置，用户可以点开编辑模式手动去选取自己喜欢的画面。,5890584,https://m.baidu.com/s?word=%E8%8B%B9%E6%9E%9C%E5%AE%9E%E5%86%B5%E5%9B%BE%E6%80%BB%E5%AE%9A%E6%A0%BC%E5%B0%B4%E5%B0%AC%E7%9E%AC%E9%97%B4%EF%BC%9F%E5%AE%A2%E6%9C%8D%E5%9B%9E%E5%BA%94&sa=fyb_news,https://fyb-2.cdn.bcebos.com/hotboard_image/85af5dc91e6f8a77e29f8f28015bc93d
22,女孩要水后“炫耀”被一旁女孩打翻,12月21日，浙江绍兴一名女孩去店里找阿姨要了一杯水，小心翼翼走路端着水杯怕洒出来，还开心的和妈妈“炫耀”：阿姨给我的。没想到水突然被另一个女孩打翻。女孩母亲表示：“对方家长对此事没有好的处理态度。”,5795925,https://m.baidu.com/s?word=%E5%A5%B3%E5%AD%A9%E8%A6%81%E6%B0%B4%E5%90%8E%E2%80%9C%E7%82%AB%E8%80%80%E2%80%9D%E8%A2%AB%E4%B8%80%E6%97%81%E5%A5%B3%E5%AD%A9%E6%89%93%E7%BF%BB&sa=fyb_news,https://fyb-2.cdn.bcebos.com/hotboard_image/3d7cc0ef1f60261792cf6f7e1f2a766b
23,一份致癌的精子生下200个孩子,代号Donor7069的捐精者来自丹麦，十多年里，已是近两百个孩子的生物学父亲。最近人们才发现他携带着一种在常规检测中无法识别的遗传突变，会显著提高后代罹患癌症的风险，高达90%。目前，有孩子已被诊断患癌，少数已经去世。,5700778,https://m.baidu.com/s?word=%E4%B8%80%E4%BB%BD%E8%87%B4%E7%99%8C%E7%9A%84%E7%B2%BE%E5%AD%90%E7%94%9F%E4%B8%8B200%E4%B8%AA%E5%AD%A9%E5%AD%90&sa=fyb_news,https://fyb-2.cdn.bcebos.com/hotboard_image/8129cec8669e8380ba5a11ce11624922
24,胖东来公布“三胖”试营业时间,,5601362,https://m.baidu.com/s?word=%E8%83%96%E4%B8%9C%E6%9D%A5%E5%85%AC%E5%B8%83%E2%80%9C%E4%B8%89%E8%83%96%E2%80%9D%E8%AF%95%E8%90%A5%E4%B8%9A%E6%97%B6%E9%97%B4&sa=fyb_news,https://fyb-1.cdn.bcebos.com/fyb/de6163834f53ca92c1273fff98ac9078.jpeg
25,冬至一小车顶饺子行驶 后续来了,12月22日冬至，山东临沂一名车主将一盘饺子放置在车顶行驶，引发后车司机孔先生拍摄记录。车主后续回应称车辆行驶平稳，饺子未散落且已被食用。,5526947,https://m.baidu.com/s?word=%E5%86%AC%E8%87%B3%E4%B8%80%E5%B0%8F%E8%BD%A6%E9%A1%B6%E9%A5%BA%E5%AD%90%E8%A1%8C%E9%A9%B6+%E5%90%8E%E7%BB%AD%E6%9D%A5%E4%BA%86&sa=fyb_news,https://fyb-2.cdn.bcebos.com/hotboard_image/2c16d9053fb752dad5a1c07352d61746
26,“为弟追凶27年”案被告被判死缓,12月23日上午，备受外界关注的“姐姐为亡弟追凶27年”迎来一审宣判，被告人易某华被判处死刑，缓期二年执行。,5410617,https://m.baidu.com/s?word=%E2%80%9C%E4%B8%BA%E5%BC%9F%E8%BF%BD%E5%87%B627%E5%B9%B4%E2%80%9D%E6%A1%88%E8%A2%AB%E5%91%8A%E8%A2%AB%E5%88%A4%E6%AD%BB%E7%BC%93&sa=fyb_news,https://fyb-2.cdn.bcebos.com/hotboard_image/2151e11361c8c9e1ff079cd8b7215bc9
27,特朗普宣布：建造特朗普级战列舰,当地时间22日，美国总统特朗普在佛罗里达州海湖庄园宣布，美国将建造一款新型战舰，他称之为“战列舰”。现场展示牌显示，这款战列舰被命名为特朗普级战列舰。,5320923,https://m.baidu.com/s?word=%E7%89%B9%E6%9C%97%E6%99%AE%E5%AE%A3%E5%B8%83%EF%BC%9A%E5%BB%BA%E9%80%A0%E7%89%B9%E6%9C%97%E6%99%AE%E7%BA%A7%E6%88%98%E5%88%97%E8%88%B0&sa=fyb_news,https://fyb-2.cdn.bcebos.com/hotboard_image/ea4ecc8dc5a67b306627e586d038efe7
28,特朗普提出中美G2概念 日本不安,日前，日本参院批准了该国有史以来最大的国防预算，提前两年将军事开支占GDP的比例提升至2%。多名专家分析指出，特朗普力推“美国优先”和交易型外交政策，同时提出中美“G2”概念，这令日本官员倍感担忧。,5215053,https://m.baidu.com/s?word=%E7%89%B9%E6%9C%97%E6%99%AE%E6%8F%90%E5%87%BA%E4%B8%AD%E7%BE%8EG2%E6%A6%82%E5%BF%B5+%E6%97%A5%E6%9C%AC%E4%B8%8D%E5%AE%89&sa=fyb_news,https://fyb-2.cdn.bcebos.com/hotboard_image/2c73bd862a69cdca9dc0ed4dd11c8758
29,六大国有银行五年期大额存单退场,临近年末，市民储蓄需求增加，六大国有银行五年期大额存单已退场，三年期产品利率降至1.5%-1.75%。部分中小银行也下架相关长期存款产品，此举为应对净息差收窄、稳定银行盈利能力。,5136983,https://m.baidu.com/s?word=%E5%85%AD%E5%A4%A7%E5%9B%BD%E6%9C%89%E9%93%B6%E8%A1%8C%E4%BA%94%E5%B9%B4%E6%9C%9F%E5%A4%A7%E9%A2%9D%E5%AD%98%E5%8D%95%E9%80%80%E5%9C%BA&sa=fyb_news,https://fyb-2.cdn.bcebos.com/hotboard_image/06d029d3d08bbc21c3b026d29da330e5
30,油轮遭美封锁狂发75次求救信号,12月21日，美媒披露，涉委油轮“贝拉1号”在遭美方拦截后逃向公海，并发出超过75次求救信号。美方称其为无国籍船只，涉嫌运输受制裁原油。同日，美军还强行登船拦截“世纪号”，加勒比海局势持续紧张。,5051834,https://m.baidu.com/s?word=%E6%B2%B9%E8%BD%AE%E9%81%AD%E7%BE%8E%E5%B0%81%E9%94%81%E7%8B%82%E5%8F%9175%E6%AC%A1%E6%B1%82%E6%95%91%E4%BF%A1%E5%8F%B7&sa=fyb_news,https://fyb-2.cdn.bcebos.com/hotboard_image/de5df36d83b967a0103bc03572040a05
31,《使命召唤》系列创始人因车祸去世,当地时间12月22日，艺电公司（Electronic Arts，简称EA）证实，《使命召唤》系列共同创作者、资深游戏制作人文斯·赞佩拉于上周末在洛杉矶附近阿尔塔迪纳地区遭遇严重车祸身亡，享年55岁。,4938486,https://m.baidu.com/s?word=%E3%80%8A%E4%BD%BF%E5%91%BD%E5%8F%AC%E5%94%A4%E3%80%8B%E7%B3%BB%E5%88%97%E5%88%9B%E5%A7%8B%E4%BA%BA%E5%9B%A0%E8%BD%A6%E7%A5%B8%E5%8E%BB%E4%B8%96&sa=fyb_news,https://fyb-2.cdn.bcebos.com/hotboard_image/718878f0595068ee9b79f8bd5dbcf6ea
32,昨夜今晨北京又下雪了,12月22日夜间至23日凌晨，北京再迎降雪。全市大部分地区出现小雪或零星小雪，延庆、平谷、密云等山区局地达到小到中雪。全市平均降雪量0.3毫米，最大降雪量出现在延庆小海陀站，为3.3毫米，山区局地积雪深度达1至3厘米，道路结冰黄色预警仍在生效。,4861698,https://m.baidu.com/s?word=%E6%98%A8%E5%A4%9C%E4%BB%8A%E6%99%A8%E5%8C%97%E4%BA%AC%E5%8F%88%E4%B8%8B%E9%9B%AA%E4%BA%86&sa=fyb_news,https://fyb-2.cdn.bcebos.com/hotboard_image/f0788442d07fc76f89f41d03ebb2eb93
33,“粤车南下”入境香港市区正式实施,12月23日零时，“粤车南下”入境香港市区政策正式实施，获批车辆经港珠澳大桥珠海公路口岸通关。政策首批开放广珠江中等4市，半年后推至全省，初期每日配额100辆，每次留港最多三天，助力大湾区融合。,4757892,https://m.baidu.com/s?word=%E2%80%9C%E7%B2%A4%E8%BD%A6%E5%8D%97%E4%B8%8B%E2%80%9D%E5%85%A5%E5%A2%83%E9%A6%99%E6%B8%AF%E5%B8%82%E5%8C%BA%E6%AD%A3%E5%BC%8F%E5%AE%9E%E6%96%BD&sa=fyb_news,https://fyb-2.cdn.bcebos.com/hotboard_image/b0c378f46f75c4fa421acffd71f65430
34,HIT FM停播,12月23日0时，中国国际广播电台劲曲调频(HIT FM)正式停播，结束其在北京FM88.7、上海FM87.9等频点的播出。该频率作为国内欧美音乐与双语综合广播的代表，运营历史超20年。,4642899,https://m.baidu.com/s?word=HIT+FM%E5%81%9C%E6%92%AD&sa=fyb_news,https://fyb-2.cdn.bcebos.com/hotboard_image/4daeb73d80a22ec01d11c73eec1f4085
35,正直播NBA：魔术vs勇士,12月23日，NBA常规赛继续进行。11:00直播：魔术vs勇士。,4544575,https://m.baidu.com/s?word=%E6%AD%A3%E7%9B%B4%E6%92%ADNBA%EF%BC%9A%E9%AD%94%E6%9C%AFvs%E5%8B%87%E5%A3%AB&sa=fyb_news,https://fyb-2.cdn.bcebos.com/hotboard_image/18a91ec94a274f7b638ba068ebf13759
36,日本遗孤在中国当助产士,徐燕（日本名山本樱子）1946年被中国养父母收养，成年后成为助产士，接生众多中国婴儿。她称这是“命运的安排”，以此回报养父母的恩情。,4446099,https://m.baidu.com/s?word=%E6%97%A5%E6%9C%AC%E9%81%97%E5%AD%A4%E5%9C%A8%E4%B8%AD%E5%9B%BD%E5%BD%93%E5%8A%A9%E4%BA%A7%E5%A3%AB&sa=fyb_news,https://fyb-2.cdn.bcebos.com/hotboard_image/32ef6960d39e30f50fa588a415bbbfa7
37,欧洲邮轮失联女子上船当天是生日,,4381665,https://m.baidu.com/s?word=%E6%AC%A7%E6%B4%B2%E9%82%AE%E8%BD%AE%E5%A4%B1%E8%81%94%E5%A5%B3%E5%AD%90%E4%B8%8A%E8%88%B9%E5%BD%93%E5%A4%A9%E6%98%AF%E7%94%9F%E6%97%A5&sa=fyb_news,https://fyb-1.cdn.bcebos.com/fyb/de6163834f53ca92c1273fff98ac9078.jpeg
38,英伟达告知中国客户：春节前对华出货,路透社22日报道，英伟达告知中国客户，计划2026年春节前动用库存对华交付4万至8万颗H200芯片，且拟新增产能。此举是特朗普政府允许该芯片对华出口后的首次实质动作，但中方尚未批准采购订单，交付存不确定性。,4280811,https://m.baidu.com/s?word=%E8%8B%B1%E4%BC%9F%E8%BE%BE%E5%91%8A%E7%9F%A5%E4%B8%AD%E5%9B%BD%E5%AE%A2%E6%88%B7%EF%BC%9A%E6%98%A5%E8%8A%82%E5%89%8D%E5%AF%B9%E5%8D%8E%E5%87%BA%E8%B4%A7&sa=fyb_news,https://fyb-2.cdn.bcebos.com/hotboard_image/b0641dc20ec9694d6196b85043e867ad
39,李艺彤官宣离开丝芭,12月23日，李艺彤生日当天宣布与丝芭传媒合约期满不续约，丝芭传媒官博火速转发并送上“海阔凭鱼跃，天高任鸟飞”的祝福，双方互动被网友称为“教科书级体面分手”。,4183992,https://m.baidu.com/s?word=%E6%9D%8E%E8%89%BA%E5%BD%A4%E5%AE%98%E5%AE%A3%E7%A6%BB%E5%BC%80%E4%B8%9D%E8%8A%AD&sa=fyb_news,https://fyb-2.cdn.bcebos.com/hotboard_image/a98840ffc35a57f4485f4635c84bf752
40,男子头孢停药72小时喝酒后休克,49岁李先生静脉滴注头孢类抗生素停药72小时后饮酒，引发双硫仑反应致休克，经湖南省第二人民医院抢救转危为安。医生提醒，用头孢期间及停药后至少7天需禁酒。,4081617,https://m.baidu.com/s?word=%E7%94%B7%E5%AD%90%E5%A4%B4%E5%AD%A2%E5%81%9C%E8%8D%AF72%E5%B0%8F%E6%97%B6%E5%96%9D%E9%85%92%E5%90%8E%E4%BC%91%E5%85%8B&sa=fyb_news,https://fyb-2.cdn.bcebos.com/hotboard_image/b5e3888e62ee5fd7b994e905417418c2
41,17岁印度少女联合男友杀害父亲,近日，印度瓦多达拉，一名17岁少女因父亲反对恋情，与两名男性朋友策划三个月，最终在给父亲下药后，亲眼目睹朋友将其刺死。目前，三名嫌疑人已被警方逮捕。,3971674,https://m.baidu.com/s?word=17%E5%B2%81%E5%8D%B0%E5%BA%A6%E5%B0%91%E5%A5%B3%E8%81%94%E5%90%88%E7%94%B7%E5%8F%8B%E6%9D%80%E5%AE%B3%E7%88%B6%E4%BA%B2&sa=fyb_news,https://fyb-2.cdn.bcebos.com/hotboard_image/7d3ad39ad54c471e9b62327b06298789
42,韩国首个商业运载火箭发射失败,韩国首尔时间23日10时13分许，韩国民间运载火箭企业INNOSPACE的首枚商业运载火箭“韩光-纳米”在巴西阿尔坎塔拉航天中心发射升空。火箭升空后不久就被捕捉到疑似爆炸的画面，发射以失败告终。,3901185,https://m.baidu.com/s?word=%E9%9F%A9%E5%9B%BD%E9%A6%96%E4%B8%AA%E5%95%86%E4%B8%9A%E8%BF%90%E8%BD%BD%E7%81%AB%E7%AE%AD%E5%8F%91%E5%B0%84%E5%A4%B1%E8%B4%A5&sa=fyb_news,https://fyb-2.cdn.bcebos.com/hotboard_image/97d6dcc94beb8590bc5e78a8b38a1158
43,韩国又接连发生集体作弊事件,近日，首尔大学被曝在考试中发生集体作弊事件，该学校已宣布相关课程考试结果作废。无独有偶，在该事件发生的前一个多月，另一所号称“顶级高校”的韩国延世大学也发生了作弊事件。,3800150,https://m.baidu.com/s?word=%E9%9F%A9%E5%9B%BD%E5%8F%88%E6%8E%A5%E8%BF%9E%E5%8F%91%E7%94%9F%E9%9B%86%E4%BD%93%E4%BD%9C%E5%BC%8A%E4%BA%8B%E4%BB%B6&sa=fyb_news,https://fyb-2.cdn.bcebos.com/hotboard_image/233e965be4458efbe69dfaae8fb8de24
44,苹果公司被罚约9860万欧元,,3681730,https://m.baidu.com/s?word=%E8%8B%B9%E6%9E%9C%E5%85%AC%E5%8F%B8%E8%A2%AB%E7%BD%9A%E7%BA%A69860%E4%B8%87%E6%AC%A7%E5%85%83&sa=fyb_news,https://fyb-1.cdn.bcebos.com/fyb/de6163834f53ca92c1273fff98ac9078.jpeg
45,云南西双版纳深夜4.2级地震,据中国地震台网正式测定，12月22日23时45分在云南西双版纳州勐腊县发生4.2级地震，震源深度10公里，震中位于北纬21.41度，东经101.73度。,3614828,https://m.baidu.com/s?word=%E4%BA%91%E5%8D%97%E8%A5%BF%E5%8F%8C%E7%89%88%E7%BA%B3%E6%B7%B1%E5%A4%9C4.2%E7%BA%A7%E5%9C%B0%E9%9C%87&sa=fyb_news,https://fyb-2.cdn.bcebos.com/hotboard_image/5e9e3a05b0bc63c50030ea9076606736
46,四川宜宾队打人球员被禁赛3年,,3526489,https://m.baidu.com/s?word=%E5%9B%9B%E5%B7%9D%E5%AE%9C%E5%AE%BE%E9%98%9F%E6%89%93%E4%BA%BA%E7%90%83%E5%91%98%E8%A2%AB%E7%A6%81%E8%B5%9B3%E5%B9%B4&sa=fyb_news,https://fyb-1.cdn.bcebos.com/fyb/de6163834f53ca92c1273fff98ac9078.jpeg
47,驻柬使馆再次提醒中国公民尽快撤离,12月23日，中国驻柬埔寨大使馆再次提醒在柬泰边境地区的中国公民尽快撤离至安全地带。此前马德望省一名中国公民被边境冲突炮火波及受轻伤，使馆已核实情况并提供协助，呼吁避免前往边境地区。,3399050,https://m.baidu.com/s?word=%E9%A9%BB%E6%9F%AC%E4%BD%BF%E9%A6%86%E5%86%8D%E6%AC%A1%E6%8F%90%E9%86%92%E4%B8%AD%E5%9B%BD%E5%85%AC%E6%B0%91%E5%B0%BD%E5%BF%AB%E6%92%A4%E7%A6%BB&sa=fyb_news,https://fyb-2.cdn.bcebos.com/hotboard_image/13d64e61d6638c232c2a65a078dfb5e8
48,《疯狂动物城2》近半票房来自中国,近期，好莱坞动画电影《疯狂动物城2》在中国市场持续热映。据统计，该片近一半的全球票房收入来自中国。,3292251,https://m.baidu.com/s?word=%E3%80%8A%E7%96%AF%E7%8B%82%E5%8A%A8%E7%89%A9%E5%9F%8E2%E3%80%8B%E8%BF%91%E5%8D%8A%E7%A5%A8%E6%88%BF%E6%9D%A5%E8%87%AA%E4%B8%AD%E5%9B%BD&sa=fyb_news,https://fyb-2.cdn.bcebos.com/hotboard_image/247d246224ea01c1ec697fdd6f206b1a
49,新西兰本土派跳毛利战舞与印移民对峙,当地时间12月20日，名为“新西兰真爱国者”的团体在奥克兰南部与印度移民锡克教团体对峙，并大跳传统的毛利族哈卡舞。,3236463,https://m.baidu.com/s?word=%E6%96%B0%E8%A5%BF%E5%85%B0%E6%9C%AC%E5%9C%9F%E6%B4%BE%E8%B7%B3%E6%AF%9B%E5%88%A9%E6%88%98%E8%88%9E%E4%B8%8E%E5%8D%B0%E7%A7%BB%E6%B0%91%E5%AF%B9%E5%B3%99&sa=fyb_news,https://fyb-2.cdn.bcebos.com/hotboard_image/71957520f4829456d1e5a7a0bee2ef97
