热搜排名,热搜标题,描述,热搜指数,链接地址,封图链接
0,“大海”的底气,当前，世界百年未有之大变局加速演进，经济全球化遭遇逆流。面对严峻复杂的外部环境，中国坚定不移办好自己的事，与各方做大互利共赢蛋糕，为全球经济注入稳定性和确定性。,7904897,https://m.baidu.com/s?word=%E2%80%9C%E5%A4%A7%E6%B5%B7%E2%80%9D%E7%9A%84%E5%BA%95%E6%B0%94&sa=fyb_news,https://fyb-2.cdn.bcebos.com/hotboard_image/f5cdd80c6ddb2f80892ebe7f5baf4f50
1,丈夫病亡两天后妻子也离世 妹妹发声,11月5日，一网友发视频称，其安徽淮北市的姐夫不幸去世后，姐姐紧随着离去，两人留下一儿一女。社区工作人员介绍，女子因丈夫去世“接受不了”，在其离世两天后突发情况送医，不幸未能抢救回来。,7808774,https://m.baidu.com/s?word=%E4%B8%88%E5%A4%AB%E7%97%85%E4%BA%A1%E4%B8%A4%E5%A4%A9%E5%90%8E%E5%A6%BB%E5%AD%90%E4%B9%9F%E7%A6%BB%E4%B8%96+%E5%A6%B9%E5%A6%B9%E5%8F%91%E5%A3%B0&sa=fyb_news,https://fyb-2.cdn.bcebos.com/hotboard_image/c31f7672783bd88d3062030d4b44c080
2,气球无法穿过大气层但爱可以,,7713612,https://m.baidu.com/s?word=%E6%B0%94%E7%90%83%E6%97%A0%E6%B3%95%E7%A9%BF%E8%BF%87%E5%A4%A7%E6%B0%94%E5%B1%82%E4%BD%86%E7%88%B1%E5%8F%AF%E4%BB%A5&sa=fyb_news,https://fyb-1.cdn.bcebos.com/fyb/de6163834f53ca92c1273fff98ac9078.jpeg
3,别错过！十五运会金牌赛程来了,十五运会即将正式拉开序幕，运动员们已蓄势待发。别错过，快收藏这份全运会金牌赛程。,7615807,https://m.baidu.com/s?word=%E5%88%AB%E9%94%99%E8%BF%87%EF%BC%81%E5%8D%81%E4%BA%94%E8%BF%90%E4%BC%9A%E9%87%91%E7%89%8C%E8%B5%9B%E7%A8%8B%E6%9D%A5%E4%BA%86&sa=fyb_news,https://fyb-2.cdn.bcebos.com/hotboard_image/0d30f321bbc103f684a6f987e40309b4
4,台媒热议解放军攻击-21无人机,近日，台媒热议解放军攻击-21无人机 ：查轰一体，航程很长，机翼很厚，有高度的登陆能耐，可以封锁整个台湾岛！,7524099,https://m.baidu.com/s?word=%E5%8F%B0%E5%AA%92%E7%83%AD%E8%AE%AE%E8%A7%A3%E6%94%BE%E5%86%9B%E6%94%BB%E5%87%BB-21%E6%97%A0%E4%BA%BA%E6%9C%BA&sa=fyb_news,https://fyb-2.cdn.bcebos.com/hotboard_image/4c0f8aa6272f4ba8ba79c9eacf9314cb
5,超级月亮惊艳大图,11月5日晚，2025年度最大的超级月亮现身夜空，月球于21时19分呈现最完满圆形，6日6时27分过近地点（距地球约35.7万公里），为今年的最大满月。,7425206,https://m.baidu.com/s?word=%E8%B6%85%E7%BA%A7%E6%9C%88%E4%BA%AE%E6%83%8A%E8%89%B3%E5%A4%A7%E5%9B%BE&sa=fyb_news,https://fyb-2.cdn.bcebos.com/hotboard_image/7f628a521ec9ebb73e6cfeaa5230fb1f
6,浙大食堂8.8元一只螃蟹引热议,近日，有网友发文称浙江大学玉泉校区食堂售卖的螃蟹价格十分亲民，仅需8.8元一只，引发热议。众多网友纷纷表示羡慕不已，甚至直呼“馋哭了”。,7333453,https://m.baidu.com/s?word=%E6%B5%99%E5%A4%A7%E9%A3%9F%E5%A0%828.8%E5%85%83%E4%B8%80%E5%8F%AA%E8%9E%83%E8%9F%B9%E5%BC%95%E7%83%AD%E8%AE%AE&sa=fyb_news,https://fyb-2.cdn.bcebos.com/hotboard_image/38a8712855c53cd574b1a1c287b4e928
7,专家解读为何春节放9天,11月4日，2026年法定假日公布，其中马年春节假期长达9天。专家解读为何春节放9天：让出行和买年货更从容，并且鼓励单位与个人情况结合，落实带薪休假制度，实际形成较长假期。,7237824,https://m.baidu.com/s?word=%E4%B8%93%E5%AE%B6%E8%A7%A3%E8%AF%BB%E4%B8%BA%E4%BD%95%E6%98%A5%E8%8A%82%E6%94%BE9%E5%A4%A9&sa=fyb_news,https://fyb-2.cdn.bcebos.com/hotboard_image/6d3a4f9b36a61f598a4b8747055efaa7
8,巨型吊牌揭开线上女装高退货率痛点,,7140882,https://m.baidu.com/s?word=%E5%B7%A8%E5%9E%8B%E5%90%8A%E7%89%8C%E6%8F%AD%E5%BC%80%E7%BA%BF%E4%B8%8A%E5%A5%B3%E8%A3%85%E9%AB%98%E9%80%80%E8%B4%A7%E7%8E%87%E7%97%9B%E7%82%B9&sa=fyb_news,https://fyb-1.cdn.bcebos.com/fyb/de6163834f53ca92c1273fff98ac9078.jpeg
9,60秒直击今年最大“超级月亮”,11月5日21时19分，2025年最大超级月亮现身天宇，这是全年最接近地球的满月，视直径达34角分，全国多地通过无人机及肉眼观测到高悬的微红圆月。,7048150,https://m.baidu.com/s?word=60%E7%A7%92%E7%9B%B4%E5%87%BB%E4%BB%8A%E5%B9%B4%E6%9C%80%E5%A4%A7%E2%80%9C%E8%B6%85%E7%BA%A7%E6%9C%88%E4%BA%AE%E2%80%9D&sa=fyb_news,https://fyb-2.cdn.bcebos.com/hotboard_image/c1b91d36f6616ad945d0ace14a9a2bff
10,新任干部炫耀公务员身份泄密被处分,某市直机关新任干部参加市委某会议后，为炫耀公务员身份，擅自将会议领取的秘密级文件首页拍照上传至朋友圈。尽管10分钟后在领导责令下紧急删除照片，但好友截图保存及转发已形成传播链，造成泄密。事后蒋某被给予党纪政务处分。,6953704,https://m.baidu.com/s?word=%E6%96%B0%E4%BB%BB%E5%B9%B2%E9%83%A8%E7%82%AB%E8%80%80%E5%85%AC%E5%8A%A1%E5%91%98%E8%BA%AB%E4%BB%BD%E6%B3%84%E5%AF%86%E8%A2%AB%E5%A4%84%E5%88%86&sa=fyb_news,https://fyb-2.cdn.bcebos.com/hotboard_image/847472df96783b3f06a0656136d382ab
11,海关罚没物品“内部处理”不实,不少网民疑惑海关罚没物品究竟去哪了？朋友圈常见的“海关内部处理”是真的吗？一起来了解下海关罚没物品的处理方式吧。,6847515,https://m.baidu.com/s?word=%E6%B5%B7%E5%85%B3%E7%BD%9A%E6%B2%A1%E7%89%A9%E5%93%81%E2%80%9C%E5%86%85%E9%83%A8%E5%A4%84%E7%90%86%E2%80%9D%E4%B8%8D%E5%AE%9E&sa=fyb_news,https://fyb-2.cdn.bcebos.com/hotboard_image/cffe21b7942636b34d798ba3be44f3fd
12,2025年全球最性感男人被选出,当地时间11月4日，英国演员乔纳森·贝利被《人物》杂志评为2025年“全球最性感男人”，成为该评选历史上首位公开出柜的获奖者。其代表作包括《布里奇顿》《侏罗纪世界4》及《魔法坏女巫》系列。,6756862,https://m.baidu.com/s?word=2025%E5%B9%B4%E5%85%A8%E7%90%83%E6%9C%80%E6%80%A7%E6%84%9F%E7%94%B7%E4%BA%BA%E8%A2%AB%E9%80%89%E5%87%BA&sa=fyb_news,https://fyb-2.cdn.bcebos.com/hotboard_image/696fa9215c906cc5a2dd06eed683abca
13,男子与堂哥合谋车祸撞死7岁儿子骗保,2020年，福建一男子因妻子出轨等原因，与妻子争吵后，产生制造交通事故撞死儿子并骗保的想法，便与堂哥合谋实施此事并骗保。经审理，孩子父亲最终被判死刑，其堂哥被判死缓且限制减刑。,6660645,https://m.baidu.com/s?word=%E7%94%B7%E5%AD%90%E4%B8%8E%E5%A0%82%E5%93%A5%E5%90%88%E8%B0%8B%E8%BD%A6%E7%A5%B8%E6%92%9E%E6%AD%BB7%E5%B2%81%E5%84%BF%E5%AD%90%E9%AA%97%E4%BF%9D&sa=fyb_news,https://fyb-2.cdn.bcebos.com/hotboard_image/b5cc8e5e0833631d345b0b29d66f2f2a
14,甲型H3N2来袭 传染性是否更强,北京时间11月5日，随着季节转换，流感进入活跃期。中国疾控中心最新监测周报显示，我国南方省份流感活动上升，北方部分省份也呈上升态势。今年，甲型H3N2毒株成为主流，相比H1N1，H3N2有着更强的传染性与传播速度。,6568733,https://m.baidu.com/s?word=%E7%94%B2%E5%9E%8BH3N2%E6%9D%A5%E8%A2%AD+%E4%BC%A0%E6%9F%93%E6%80%A7%E6%98%AF%E5%90%A6%E6%9B%B4%E5%BC%BA&sa=fyb_news,https://fyb-2.cdn.bcebos.com/hotboard_image/e8e8beadc2fd1c5bc87cf89c37dc9dae
15,游客投诉点的馄饨上来抄手,11月4日，四川成都一名外地游客在餐馆用餐后，因认为所点的抄手实为馄饨而拒绝付款并威胁投诉。店主解释二者为同一食物的地域名称差异，但游客坚持认为形态不同，最终引发纠纷。,6465626,https://m.baidu.com/s?word=%E6%B8%B8%E5%AE%A2%E6%8A%95%E8%AF%89%E7%82%B9%E7%9A%84%E9%A6%84%E9%A5%A8%E4%B8%8A%E6%9D%A5%E6%8A%84%E6%89%8B&sa=fyb_news,https://fyb-2.cdn.bcebos.com/hotboard_image/56cf2f72725a13caca3b26fc78b92599
16,巴西决定临时迁都,当地时间11月4日，巴西总统卢拉签署法案，在《联合国气候变化框架公约》第三十次缔约方会议（COP30）期间将巴西首都从巴西利亚临时迁至贝伦，时间为2025年11月11日至21日。,6372971,https://m.baidu.com/s?word=%E5%B7%B4%E8%A5%BF%E5%86%B3%E5%AE%9A%E4%B8%B4%E6%97%B6%E8%BF%81%E9%83%BD&sa=fyb_news,https://fyb-2.cdn.bcebos.com/hotboard_image/131a3e5341bf1e9ebf060e90ad1fc3b4
17,成都春熙路现巨型LOL冠军奖杯雕塑,,6281319,https://m.baidu.com/s?word=%E6%88%90%E9%83%BD%E6%98%A5%E7%86%99%E8%B7%AF%E7%8E%B0%E5%B7%A8%E5%9E%8BLOL%E5%86%A0%E5%86%9B%E5%A5%96%E6%9D%AF%E9%9B%95%E5%A1%91&sa=fyb_news,https://fyb-1.cdn.bcebos.com/fyb/de6163834f53ca92c1273fff98ac9078.jpeg
18,王传君获东京电影节影帝,,6188912,https://m.baidu.com/s?word=%E7%8E%8B%E4%BC%A0%E5%90%9B%E8%8E%B7%E4%B8%9C%E4%BA%AC%E7%94%B5%E5%BD%B1%E8%8A%82%E5%BD%B1%E5%B8%9D&sa=fyb_news,https://fyb-1.cdn.bcebos.com/fyb/de6163834f53ca92c1273fff98ac9078.jpeg
19,河南一公墓遭有组织冲击 3人被拘,近日，河南省南阳市龙凤陵园遭以齐某某为首的数十人有组织冲击，涉事者通过围堵大门、暴力破坏设施及恐吓员工等手段扰乱运营，目前雷某某、赵某某、胡某某等3人已被依法行政拘留。,6091348,https://m.baidu.com/s?word=%E6%B2%B3%E5%8D%97%E4%B8%80%E5%85%AC%E5%A2%93%E9%81%AD%E6%9C%89%E7%BB%84%E7%BB%87%E5%86%B2%E5%87%BB+3%E4%BA%BA%E8%A2%AB%E6%8B%98&sa=fyb_news,https://fyb-2.cdn.bcebos.com/hotboard_image/a03ee65b413dbf8dc4bd0efc5192d1ae
20,北京空气质量达到重度污染水平,北京市生态环境监测中心数据显示，11月5日18时，北京空气质量指数为209，达到五级重度污染水平，首要污染物为PM2.5。,5984225,https://m.baidu.com/s?word=%E5%8C%97%E4%BA%AC%E7%A9%BA%E6%B0%94%E8%B4%A8%E9%87%8F%E8%BE%BE%E5%88%B0%E9%87%8D%E5%BA%A6%E6%B1%A1%E6%9F%93%E6%B0%B4%E5%B9%B3&sa=fyb_news,https://fyb-2.cdn.bcebos.com/hotboard_image/af31aaa8ecc8ce5acfc3e8df37b86c8b
21,汽车置换补贴券疑被同一人抢到93张,,5902334,https://m.baidu.com/s?word=%E6%B1%BD%E8%BD%A6%E7%BD%AE%E6%8D%A2%E8%A1%A5%E8%B4%B4%E5%88%B8%E7%96%91%E8%A2%AB%E5%90%8C%E4%B8%80%E4%BA%BA%E6%8A%A2%E5%88%B093%E5%BC%A0&sa=fyb_news,https://fyb-1.cdn.bcebos.com/fyb/de6163834f53ca92c1273fff98ac9078.jpeg
22,太阳连续两次爆发耀斑 或出现极光,北京时间11月5日凌晨，太阳连续两次爆发耀斑，峰值时间分别为01时34分（X1.8级）和06时01分（X1.1级），近期可能会引发极光现象。,5804046,https://m.baidu.com/s?word=%E5%A4%AA%E9%98%B3%E8%BF%9E%E7%BB%AD%E4%B8%A4%E6%AC%A1%E7%88%86%E5%8F%91%E8%80%80%E6%96%91+%E6%88%96%E5%87%BA%E7%8E%B0%E6%9E%81%E5%85%89&sa=fyb_news,https://fyb-2.cdn.bcebos.com/hotboard_image/e2cc4e2ba9cac82405caaace7f8fd1e3
23,中国模特首获亚洲模特盛典奖,,5696931,https://m.baidu.com/s?word=%E4%B8%AD%E5%9B%BD%E6%A8%A1%E7%89%B9%E9%A6%96%E8%8E%B7%E4%BA%9A%E6%B4%B2%E6%A8%A1%E7%89%B9%E7%9B%9B%E5%85%B8%E5%A5%96&sa=fyb_news,https://fyb-1.cdn.bcebos.com/fyb/de6163834f53ca92c1273fff98ac9078.jpeg
24,媒体：“丽春”改名要什么精神证明,近日，四川一网友反映，因不喜欢名字中的“丽春”二字，跑了4次派出所要求改名，却均被驳回。当局回应：成年人更名需要充分理由并提供相应的佐证资料。,5608518,https://m.baidu.com/s?word=%E5%AA%92%E4%BD%93%EF%BC%9A%E2%80%9C%E4%B8%BD%E6%98%A5%E2%80%9D%E6%94%B9%E5%90%8D%E8%A6%81%E4%BB%80%E4%B9%88%E7%B2%BE%E7%A5%9E%E8%AF%81%E6%98%8E&sa=fyb_news,https://fyb-2.cdn.bcebos.com/hotboard_image/c04f9741a16a79f872fe4442521eea11
25,福建舰即将入列？三亚发布航行警告,11月3日，据中国海事局网站消息，三亚海事局发布航行警告，南海部分海域进行军事训练。,5518236,https://m.baidu.com/s?word=%E7%A6%8F%E5%BB%BA%E8%88%B0%E5%8D%B3%E5%B0%86%E5%85%A5%E5%88%97%EF%BC%9F%E4%B8%89%E4%BA%9A%E5%8F%91%E5%B8%83%E8%88%AA%E8%A1%8C%E8%AD%A6%E5%91%8A&sa=fyb_news,https://fyb-2.cdn.bcebos.com/hotboard_image/3550567eaab037cc7d1ef03f69eed4a0
26,为何入秋以来我国已现三次大雾天气,入秋以来我国已出现三次大雾天气，专家解读：这三次大雾天气过程有一个重要天气特点，就是上干下湿。上干下湿的层级结构，有利于大雾天气的形成。,5421551,https://m.baidu.com/s?word=%E4%B8%BA%E4%BD%95%E5%85%A5%E7%A7%8B%E4%BB%A5%E6%9D%A5%E6%88%91%E5%9B%BD%E5%B7%B2%E7%8E%B0%E4%B8%89%E6%AC%A1%E5%A4%A7%E9%9B%BE%E5%A4%A9%E6%B0%94&sa=fyb_news,https://fyb-2.cdn.bcebos.com/hotboard_image/c8a2dc68f70343c4b7b159ec62eb43b2
27,能治十几种病？揭秘朋友圈“神药”,11月5日，最高检披露一起制售假药案，被告人李某甲等人将中药粉与止痛药吡罗昔康混合制成“雪山追风散”和“特效胃药”，宣称可治十几种疾病，6年销售额达54万元。该团伙通过微信朋友圈发展下线分销，最终被全链条打击。,5335904,https://m.baidu.com/s?word=%E8%83%BD%E6%B2%BB%E5%8D%81%E5%87%A0%E7%A7%8D%E7%97%85%EF%BC%9F%E6%8F%AD%E7%A7%98%E6%9C%8B%E5%8F%8B%E5%9C%88%E2%80%9C%E7%A5%9E%E8%8D%AF%E2%80%9D&sa=fyb_news,https://fyb-2.cdn.bcebos.com/hotboard_image/b5cc8e5e0833631d345b0b29d66f2f2a
28,暴雪大暴雪要来了 多大的雪才算暴雪,中央气象台11月5日预报显示，新疆、黑龙江等地将出现暴雪至大暴雪天气，部分地区降雪量达20-40毫米。我国气象标准规定，24小时内降雪量（雪融化成水后的深度10.0~19.9毫米为暴雪，20.0毫米以上为大暴雪，30.0毫米及以上为特大暴雪。,5232036,https://m.baidu.com/s?word=%E6%9A%B4%E9%9B%AA%E5%A4%A7%E6%9A%B4%E9%9B%AA%E8%A6%81%E6%9D%A5%E4%BA%86+%E5%A4%9A%E5%A4%A7%E7%9A%84%E9%9B%AA%E6%89%8D%E7%AE%97%E6%9A%B4%E9%9B%AA&sa=fyb_news,https://fyb-2.cdn.bcebos.com/hotboard_image/c6af125a0f3fc39709cddc95a31e4fd4
29,9天超长春节刚宣布 机票预订量大涨,11月4日，国务院办公厅公布了2026年放假安排，其中春节放假调休共9天，引发关注。“春节连休9天”消息发出后不到半小时，平台上，元旦期间的火车票、春节期间的火车票和国际机票搜索量瞬时增长翻倍，且仍在冲高。,5133643,https://m.baidu.com/s?word=9%E5%A4%A9%E8%B6%85%E9%95%BF%E6%98%A5%E8%8A%82%E5%88%9A%E5%AE%A3%E5%B8%83+%E6%9C%BA%E7%A5%A8%E9%A2%84%E8%AE%A2%E9%87%8F%E5%A4%A7%E6%B6%A8&sa=fyb_news,https://fyb-2.cdn.bcebos.com/hotboard_image/9dc23e9610d100ed1ac0ff65abe1dee2
30,涉对美出口管制管控 中方决定调整,商务部新闻发言人就调整出口管制管控名单措施答记者问：中方将于11月10日起调整对美出口管制措施，根据中美吉隆坡经贸磋商共识，商务部决定解除对15家美国实体的两用物项出口限制，并对另外16家实体的管制措施暂停1年。出口需依法向商务部申请许可。,5039476,https://m.baidu.com/s?word=%E6%B6%89%E5%AF%B9%E7%BE%8E%E5%87%BA%E5%8F%A3%E7%AE%A1%E5%88%B6%E7%AE%A1%E6%8E%A7+%E4%B8%AD%E6%96%B9%E5%86%B3%E5%AE%9A%E8%B0%83%E6%95%B4&sa=fyb_news,https://fyb-2.cdn.bcebos.com/hotboard_image/b582591ca265251d5913ab60a588e65b
31,美坠机事故机场已重新开放航班起降,,4932782,https://m.baidu.com/s?word=%E7%BE%8E%E5%9D%A0%E6%9C%BA%E4%BA%8B%E6%95%85%E6%9C%BA%E5%9C%BA%E5%B7%B2%E9%87%8D%E6%96%B0%E5%BC%80%E6%94%BE%E8%88%AA%E7%8F%AD%E8%B5%B7%E9%99%8D&sa=fyb_news,https://fyb-1.cdn.bcebos.com/fyb/de6163834f53ca92c1273fff98ac9078.jpeg
32,国台办发言人再“扩员” 台媒解读,11月5日，国台办新任发言人、港澳局局长张晗亮相。台媒十分关注国台办发言人的调整，并与设立台湾光复纪念日、对沈伯洋立案侦查等涉台举措串联解读为是大陆所释放的“组合拳”。,4844603,https://m.baidu.com/s?word=%E5%9B%BD%E5%8F%B0%E5%8A%9E%E5%8F%91%E8%A8%80%E4%BA%BA%E5%86%8D%E2%80%9C%E6%89%A9%E5%91%98%E2%80%9D+%E5%8F%B0%E5%AA%92%E8%A7%A3%E8%AF%BB&sa=fyb_news,https://fyb-2.cdn.bcebos.com/hotboard_image/dbf87e36a147dbf1dcc74f9b98c1e9fb
33,醉驾男子车内酣睡 醒来发现在河中,近日，江苏张家港一男子饮酒后，不顾劝阻独自驾车回家。到达小区后因酒力发作，男子在未熄火的情况下将车停在车位上，随即在驾驶座上入睡。不久，车辆突然倒车穿过绿化带，坠入附近的河中。经检测，该男子摄入酒精量远超醉驾标准，因涉嫌危险驾驶罪被刑事立案侦查。,4736450,https://m.baidu.com/s?word=%E9%86%89%E9%A9%BE%E7%94%B7%E5%AD%90%E8%BD%A6%E5%86%85%E9%85%A3%E7%9D%A1+%E9%86%92%E6%9D%A5%E5%8F%91%E7%8E%B0%E5%9C%A8%E6%B2%B3%E4%B8%AD&sa=fyb_news,https://fyb-2.cdn.bcebos.com/hotboard_image/83cd5e6feb61037e687c8d2bc0535d93
34,王传君感谢白百何和刘丹,11月5日，第38届东京国际电影节举行颁奖典礼，王传君凭借电影《春树》获得主竞赛单元最佳男演员奖。在发表获奖感言时，王传君感谢白百何和刘丹：她们高光的表现，照亮了在角落的我。,4641548,https://m.baidu.com/s?word=%E7%8E%8B%E4%BC%A0%E5%90%9B%E6%84%9F%E8%B0%A2%E7%99%BD%E7%99%BE%E4%BD%95%E5%92%8C%E5%88%98%E4%B8%B9&sa=fyb_news,https://fyb-2.cdn.bcebos.com/hotboard_image/a2520ef93c45625212fb92f3cf8483a1
35,邵佳一曾说当国足主帅是梦想,11月5日，青岛西海岸主帅邵佳一确认当选中国国家队新任主帅。据悉，在一次采访中，邵佳一被问及“是否想成为国家队主教练”，其坚定答复：执教国家队是我的最高目标之一。,4556634,https://m.baidu.com/s?word=%E9%82%B5%E4%BD%B3%E4%B8%80%E6%9B%BE%E8%AF%B4%E5%BD%93%E5%9B%BD%E8%B6%B3%E4%B8%BB%E5%B8%85%E6%98%AF%E6%A2%A6%E6%83%B3&sa=fyb_news,https://fyb-2.cdn.bcebos.com/hotboard_image/35815c25805c3711211f7da98ac6f964
36,邵佳一曾任国足梯队主帅和国足助教,11月5日，邵佳一确认出任中国国家队新任主帅。现年45岁的他曾担任国足U19、U20梯队教练及国足助教，去年7月起执教青岛西海岸队，带队取得15胜13平13负战绩，本赛季排名中超第9。,4478051,https://m.baidu.com/s?word=%E9%82%B5%E4%BD%B3%E4%B8%80%E6%9B%BE%E4%BB%BB%E5%9B%BD%E8%B6%B3%E6%A2%AF%E9%98%9F%E4%B8%BB%E5%B8%85%E5%92%8C%E5%9B%BD%E8%B6%B3%E5%8A%A9%E6%95%99&sa=fyb_news,https://fyb-2.cdn.bcebos.com/hotboard_image/50ca198f5ddd1961d28e842c8e35e496
37,国台办发言人连续“上新”,11月5日上午，国务院台办举行例行新闻发布会，新任发言人张晗首次亮相并主持发布会，这也是国台办连续两周有新发言人亮相。,4380921,https://m.baidu.com/s?word=%E5%9B%BD%E5%8F%B0%E5%8A%9E%E5%8F%91%E8%A8%80%E4%BA%BA%E8%BF%9E%E7%BB%AD%E2%80%9C%E4%B8%8A%E6%96%B0%E2%80%9D&sa=fyb_news,https://fyb-2.cdn.bcebos.com/hotboard_image/bde5f7bf1792d4f6067982c0e6f1da5e
38,非洲狮“小毛”因情绪稳定火出圈,近日，黑龙江哈尔滨极地公园的非洲狮“小毛”因为“情绪稳定”，火到“出圈”。保育员表示小狮子已经十一个月了，非常喜欢和人玩耍。,4257138,https://m.baidu.com/s?word=%E9%9D%9E%E6%B4%B2%E7%8B%AE%E2%80%9C%E5%B0%8F%E6%AF%9B%E2%80%9D%E5%9B%A0%E6%83%85%E7%BB%AA%E7%A8%B3%E5%AE%9A%E7%81%AB%E5%87%BA%E5%9C%88&sa=fyb_news,https://fyb-2.cdn.bcebos.com/hotboard_image/bc87a52c6af7014c7edafcc337795e02
39,王传君获东京影帝全程不笑被导演cue,11月5日，王传君凭电影《春树》获东京电影节影帝，该片导演获最佳导演奖。随后，导演上台领奖时，特意提及王传君在领奖时未展露出笑容，他称“我也不太会笑，但今天努力笑一下”。,4157083,https://m.baidu.com/s?word=%E7%8E%8B%E4%BC%A0%E5%90%9B%E8%8E%B7%E4%B8%9C%E4%BA%AC%E5%BD%B1%E5%B8%9D%E5%85%A8%E7%A8%8B%E4%B8%8D%E7%AC%91%E8%A2%AB%E5%AF%BC%E6%BC%94cue&sa=fyb_news,https://fyb-2.cdn.bcebos.com/hotboard_image/a5704763a676c7d6ec626bd47fe35f88
40,#晒晒你拍的超级大月亮#,,4085119,https://m.baidu.com/s?word=%23%E6%99%92%E6%99%92%E4%BD%A0%E6%8B%8D%E7%9A%84%E8%B6%85%E7%BA%A7%E5%A4%A7%E6%9C%88%E4%BA%AE%23&sa=fyb_news,https://fyb-1.cdn.bcebos.com/fyb/444846eeb217ede8c838d13ae8c9c9b0.jpg
41,新华社评宝宝巴士APP现低俗广告,近日，知名儿童启蒙APP“宝宝巴士儿歌”因出现低俗露骨的色情广告，引发广泛关注。对此，新华社11月5日发表时评：卸责式回应难掩公众质疑，儿童成长不容“毒流量”围猎。,3977414,https://m.baidu.com/s?word=%E6%96%B0%E5%8D%8E%E7%A4%BE%E8%AF%84%E5%AE%9D%E5%AE%9D%E5%B7%B4%E5%A3%ABAPP%E7%8E%B0%E4%BD%8E%E4%BF%97%E5%B9%BF%E5%91%8A&sa=fyb_news,https://fyb-2.cdn.bcebos.com/hotboard_image/0cf49b019e25b51126afc8a4adcb259b
42,北京发布大雾黄色预警,11月5日晚，北京市大部分地区能见度小于1000米，部分地区不足500米，请注意防范。,3904677,https://m.baidu.com/s?word=%E5%8C%97%E4%BA%AC%E5%8F%91%E5%B8%83%E5%A4%A7%E9%9B%BE%E9%BB%84%E8%89%B2%E9%A2%84%E8%AD%A6&sa=fyb_news,https://fyb-2.cdn.bcebos.com/hotboard_image/c48add484d761a37a34daeb387e16089
43,世界互联网大会乌镇峰会将举行,,3791648,https://m.baidu.com/s?word=%E4%B8%96%E7%95%8C%E4%BA%92%E8%81%94%E7%BD%91%E5%A4%A7%E4%BC%9A%E4%B9%8C%E9%95%87%E5%B3%B0%E4%BC%9A%E5%B0%86%E4%B8%BE%E8%A1%8C&sa=fyb_news,https://fyb-1.cdn.bcebos.com/fyb/de6163834f53ca92c1273fff98ac9078.jpeg
44,俄副外长：俄美元首会晤条件不具备,当地时间11月5日，俄罗斯副外长谢尔盖·里亚布科夫表示，目前尚未具备组织俄总统普京与美总统特朗普会晤的条件。他指出，两国领导人会晤需要精经过周密准备，两国外交部门正着手处理实质性问题。,3699129,https://m.baidu.com/s?word=%E4%BF%84%E5%89%AF%E5%A4%96%E9%95%BF%EF%BC%9A%E4%BF%84%E7%BE%8E%E5%85%83%E9%A6%96%E4%BC%9A%E6%99%A4%E6%9D%A1%E4%BB%B6%E4%B8%8D%E5%85%B7%E5%A4%87&sa=fyb_news,https://fyb-2.cdn.bcebos.com/hotboard_image/a5c5edd94e99733ff23e67ae9c7037e7
45,疑遭碎片撞击 神舟二十号返回推迟,,3623404,https://m.baidu.com/s?word=%E7%96%91%E9%81%AD%E7%A2%8E%E7%89%87%E6%92%9E%E5%87%BB+%E7%A5%9E%E8%88%9F%E4%BA%8C%E5%8D%81%E5%8F%B7%E8%BF%94%E5%9B%9E%E6%8E%A8%E8%BF%9F&sa=fyb_news,https://fyb-1.cdn.bcebos.com/fyb/de6163834f53ca92c1273fff98ac9078.jpeg
46,邵佳一的岗位目标是进2030世界杯,5日，中国足球协会研究决定聘任邵佳一为中国国家男子足球队主教练。此前的公开选聘公告中注明，男足主教练岗位目标为：持续提升国家男子足球队竞技水平和国际足联排名，完成2030年世界杯参赛目标任务。,3505587,https://m.baidu.com/s?word=%E9%82%B5%E4%BD%B3%E4%B8%80%E7%9A%84%E5%B2%97%E4%BD%8D%E7%9B%AE%E6%A0%87%E6%98%AF%E8%BF%9B2030%E4%B8%96%E7%95%8C%E6%9D%AF&sa=fyb_news,https://fyb-2.cdn.bcebos.com/hotboard_image/3a86f2ad2f8c3578b46ac80829fd842f
47,全运会梁靖崑周雨对练,,3403578,https://m.baidu.com/s?word=%E5%85%A8%E8%BF%90%E4%BC%9A%E6%A2%81%E9%9D%96%E5%B4%91%E5%91%A8%E9%9B%A8%E5%AF%B9%E7%BB%83&sa=fyb_news,https://fyb-1.cdn.bcebos.com/fyb/de6163834f53ca92c1273fff98ac9078.jpeg
48,卢浮宫监控系统密码竟是“louvre”,,3329772,https://m.baidu.com/s?word=%E5%8D%A2%E6%B5%AE%E5%AE%AB%E7%9B%91%E6%8E%A7%E7%B3%BB%E7%BB%9F%E5%AF%86%E7%A0%81%E7%AB%9F%E6%98%AF%E2%80%9Clouvre%E2%80%9D&sa=fyb_news,https://fyb-1.cdn.bcebos.com/fyb/de6163834f53ca92c1273fff98ac9078.jpeg
49,全国首批 卵巢癌治疗新药通关进京,11月5日，记者从北京海关获悉，进口抗癌药索米妥昔单抗注射液（商品名：爱拉赫）已通关进京，并于第一时间抵达患者手中。,3232339,https://m.baidu.com/s?word=%E5%85%A8%E5%9B%BD%E9%A6%96%E6%89%B9+%E5%8D%B5%E5%B7%A2%E7%99%8C%E6%B2%BB%E7%96%97%E6%96%B0%E8%8D%AF%E9%80%9A%E5%85%B3%E8%BF%9B%E4%BA%AC&sa=fyb_news,https://fyb-2.cdn.bcebos.com/hotboard_image/d921616eebba88758da7dd4a3e0733b8
50,京津冀等地大雾会持续多久,11月5日，京津冀及周边地区出现大雾天气，北京东南部、天津中西部、河北中南部等地局地能见度不足200米。中央气象台6时发布大雾黄色预警，预计强浓雾将持续至当天上午。,3109870,https://m.baidu.com/s?word=%E4%BA%AC%E6%B4%A5%E5%86%80%E7%AD%89%E5%9C%B0%E5%A4%A7%E9%9B%BE%E4%BC%9A%E6%8C%81%E7%BB%AD%E5%A4%9A%E4%B9%85&sa=fyb_news,https://fyb-2.cdn.bcebos.com/hotboard_image/6777389add24eacd5192ebcd27ff5bd5
