热搜排名,热搜标题,描述,热搜指数,链接地址,封图链接
0,“忘记历史就意味着背叛”,12月13日是南京大屠杀死难者国家公祭日。“忘记历史就意味着背叛，否认罪责就意味着重犯”，习近平总书记的这番话掷地有声。,7904621,https://m.baidu.com/s?word=%E2%80%9C%E5%BF%98%E8%AE%B0%E5%8E%86%E5%8F%B2%E5%B0%B1%E6%84%8F%E5%91%B3%E7%9D%80%E8%83%8C%E5%8F%9B%E2%80%9D&sa=fyb_news,https://fyb-2.cdn.bcebos.com/hotboard_image/c366bca99d27a2433623f40a62b87b21
1,夫妇拎15万现金想捐给部队支持国防,近日，一对中年夫妇携带15万元现金前往北部战区海军某支队营区，表示希望捐款支持国防建设。执勤官兵表达感谢后婉拒，夫妇将钱袋留在门口离开。,7809674,https://m.baidu.com/s?word=%E5%A4%AB%E5%A6%87%E6%8B%8E15%E4%B8%87%E7%8E%B0%E9%87%91%E6%83%B3%E6%8D%90%E7%BB%99%E9%83%A8%E9%98%9F%E6%94%AF%E6%8C%81%E5%9B%BD%E9%98%B2&sa=fyb_news,https://fyb-2.cdn.bcebos.com/hotboard_image/d8c5ee3a4872838d2952d3d9c04a282e
2,明年力争实现全国生娃基本不花钱,12月13日，全国医疗保障工作会议在北京召开。国家医保局做出最新部署，力争明年全国基本实现政策范围内分娩个人“无自付”。,7713437,https://m.baidu.com/s?word=%E6%98%8E%E5%B9%B4%E5%8A%9B%E4%BA%89%E5%AE%9E%E7%8E%B0%E5%85%A8%E5%9B%BD%E7%94%9F%E5%A8%83%E5%9F%BA%E6%9C%AC%E4%B8%8D%E8%8A%B1%E9%92%B1&sa=fyb_news,https://fyb-2.cdn.bcebos.com/hotboard_image/0c2e3ea635f5d99626bbf7a980dace71
3,这一刻 警报响彻南京,12月13日，南京大屠杀死难者国家公祭日。上午10:01，防空警报响彻南京的天空。铭记，不只为民族的悲怆。纪念，只愿吾辈更加自强。牢记历史，不忘过去。珍爱和平，开创未来。,7619197,https://m.baidu.com/s?word=%E8%BF%99%E4%B8%80%E5%88%BB+%E8%AD%A6%E6%8A%A5%E5%93%8D%E5%BD%BB%E5%8D%97%E4%BA%AC&sa=fyb_news,https://fyb-2.cdn.bcebos.com/hotboard_image/bfcfa9bd79ce781f3d9e251d7d620d1d
4,大雪天演员卖力唱豫剧 台下无人离场,12月10日-12日河南豫剧院赴洛阳演出，期间突遇大雪，演员冻的通红仍卖力开唱，台下观众顶着大雪观看，无人离场。,7523173,https://m.baidu.com/s?word=%E5%A4%A7%E9%9B%AA%E5%A4%A9%E6%BC%94%E5%91%98%E5%8D%96%E5%8A%9B%E5%94%B1%E8%B1%AB%E5%89%A7+%E5%8F%B0%E4%B8%8B%E6%97%A0%E4%BA%BA%E7%A6%BB%E5%9C%BA&sa=fyb_news,https://fyb-2.cdn.bcebos.com/hotboard_image/d4485aa2874d53aa224b111a6ec64cc8
5,投资千万景区荒废沦为鬼城,12月12日，河南周口中华五千年景区因效益不佳、内部矛盾荒废多年，投资方家属回应称将修复扩建。该景区由已故名人牛振海投资1600余万于1997年建成，现被鉴定为D级危房。,7428406,https://m.baidu.com/s?word=%E6%8A%95%E8%B5%84%E5%8D%83%E4%B8%87%E6%99%AF%E5%8C%BA%E8%8D%92%E5%BA%9F%E6%B2%A6%E4%B8%BA%E9%AC%BC%E5%9F%8E&sa=fyb_news,https://fyb-2.cdn.bcebos.com/hotboard_image/5c3553778edb3bb881818fd3959357ee
6,网警起底针对新手主播“推流”骗局,近日，宁夏网警破获一起针对新手网络主播的“推流”骗局。犯罪团伙以“包上热门”“内部流量扶持”为诱饵，诱导主播缴纳服务费，再用网络水军制造虚假流量实施诈骗，涉案金额达360余万元，警方查获大量作案设备和账号并抓获多名嫌疑人。,7330714,https://m.baidu.com/s?word=%E7%BD%91%E8%AD%A6%E8%B5%B7%E5%BA%95%E9%92%88%E5%AF%B9%E6%96%B0%E6%89%8B%E4%B8%BB%E6%92%AD%E2%80%9C%E6%8E%A8%E6%B5%81%E2%80%9D%E9%AA%97%E5%B1%80&sa=fyb_news,https://fyb-2.cdn.bcebos.com/hotboard_image/beee1ccb46e264e5aa79da13fd20389f
7,职工医保个人账户明年全面跨省共济,12月13日，国家医保局公布2026年医保重点工作计划，提出将全面实现职工医保个人账户资金跨省共济使用，并通过推行刷脸支付等新型支付方式，力争用3年左右时间大幅减少医院排队缴费现象。,7231631,https://m.baidu.com/s?word=%E8%81%8C%E5%B7%A5%E5%8C%BB%E4%BF%9D%E4%B8%AA%E4%BA%BA%E8%B4%A6%E6%88%B7%E6%98%8E%E5%B9%B4%E5%85%A8%E9%9D%A2%E8%B7%A8%E7%9C%81%E5%85%B1%E6%B5%8E&sa=fyb_news,https://fyb-2.cdn.bcebos.com/hotboard_image/45a8d853f1fe6199f1bd37e8e0ee519f
8,躺医院7年半无名男子DNA未比对成功,近日，江苏句容躺在医院7年半、仅双眼能动的“无名”男子迎来最新进展，其人脸与DNA比对结果均未匹配成功。此前一名湖北男子称其可能是失联多年的哥哥，警方已开展核查，相关寻亲工作仍在推进中。,7138829,https://m.baidu.com/s?word=%E8%BA%BA%E5%8C%BB%E9%99%A27%E5%B9%B4%E5%8D%8A%E6%97%A0%E5%90%8D%E7%94%B7%E5%AD%90DNA%E6%9C%AA%E6%AF%94%E5%AF%B9%E6%88%90%E5%8A%9F&sa=fyb_news,https://fyb-2.cdn.bcebos.com/hotboard_image/549b787648f44acae13879b9f98d3651
9,“数”看医保5年成效、明年新动向,12月13日，全国医疗保障工作会议在京召开，总结过去5年医保工作，研究部署2026年医保各项工作。让我们通过一组数据，看过去5年医保事业发展成效，了解2026年医保事业工作重点。,7048685,https://m.baidu.com/s?word=%E2%80%9C%E6%95%B0%E2%80%9D%E7%9C%8B%E5%8C%BB%E4%BF%9D5%E5%B9%B4%E6%88%90%E6%95%88%E3%80%81%E6%98%8E%E5%B9%B4%E6%96%B0%E5%8A%A8%E5%90%91&sa=fyb_news,https://fyb-2.cdn.bcebos.com/hotboard_image/da3e39f5f6299bf109c133ccb4fc65c7
10,玉渊谭天：日本八纮一宇塔应被拆除,日本“八纮一宇”塔应当被拆除。二战中的日本，从被侵略的国家掳掠了超370块石头，建起了一座罪恶之塔。战败，日本非但没有拆除这军国主义的象征，归还这些被掳掠的石块，反而为这座塔披上了“和平”的伪装。,6953514,https://m.baidu.com/s?word=%E7%8E%89%E6%B8%8A%E8%B0%AD%E5%A4%A9%EF%BC%9A%E6%97%A5%E6%9C%AC%E5%85%AB%E7%BA%AE%E4%B8%80%E5%AE%87%E5%A1%94%E5%BA%94%E8%A2%AB%E6%8B%86%E9%99%A4&sa=fyb_news,https://fyb-2.cdn.bcebos.com/hotboard_image/23a7344cb1b8bac408d04655b369fad3
11,山东冠县地震致房屋倒塌系谣言,近日，有网民发布关于山东冠县地震的信息，视频中显示大量房屋倒塌、受灾情况严重，引发关注。经有关部门调查核实，相关信息不实。当地附近发生3.7级地震，并无人员伤亡及财产损失，道路交通及通讯均未受影响。,6849311,https://m.baidu.com/s?word=%E5%B1%B1%E4%B8%9C%E5%86%A0%E5%8E%BF%E5%9C%B0%E9%9C%87%E8%87%B4%E6%88%BF%E5%B1%8B%E5%80%92%E5%A1%8C%E7%B3%BB%E8%B0%A3%E8%A8%80&sa=fyb_news,https://fyb-2.cdn.bcebos.com/hotboard_image/db4ea461aa237ede0e2763c150d741bb
12,杭州一小学“咕噜咕噜”一分钟火了,近日，杭州一老师为解决学生冬季饮水不足难题，设置课前一分钟喝水仪式。当预备铃响起，教室里准时播放“课前一分钟，咕噜咕噜喝水”的温馨提醒，伴着“咕噜咕噜”的趣味口号学生们欣然完成喝水任务。,6754777,https://m.baidu.com/s?word=%E6%9D%AD%E5%B7%9E%E4%B8%80%E5%B0%8F%E5%AD%A6%E2%80%9C%E5%92%95%E5%99%9C%E5%92%95%E5%99%9C%E2%80%9D%E4%B8%80%E5%88%86%E9%92%9F%E7%81%AB%E4%BA%86&sa=fyb_news,https://fyb-2.cdn.bcebos.com/hotboard_image/e89a8ba1cc7342b17e370cfb8f66ebcf
13,交警新装备：AI眼镜一眼看透车辆信息,12月13日，长沙交警为一线警力配发新型AI智能眼镜，搭载1200万像素摄像头与智能防抖算法，可在1—2秒内离线识别车牌，准确率超过99%，并能实时调取车辆年检、违法记录等信息。,6666671,https://m.baidu.com/s?word=%E4%BA%A4%E8%AD%A6%E6%96%B0%E8%A3%85%E5%A4%87%EF%BC%9AAI%E7%9C%BC%E9%95%9C%E4%B8%80%E7%9C%BC%E7%9C%8B%E9%80%8F%E8%BD%A6%E8%BE%86%E4%BF%A1%E6%81%AF&sa=fyb_news,https://fyb-2.cdn.bcebos.com/hotboard_image/ae0389c76f41855eb80cf8eb928c46f2
14,90斤儿子把晕倒的120斤妈妈抱回家,近日，山东临沂一名体重90斤的14岁男孩放学后发现母亲晕倒在车内，独自将体重120斤的母亲抱回家。母亲事后回看监控时感动落泪，表示孩子学习好与不好已不重要。,6561260,https://m.baidu.com/s?word=90%E6%96%A4%E5%84%BF%E5%AD%90%E6%8A%8A%E6%99%95%E5%80%92%E7%9A%84120%E6%96%A4%E5%A6%88%E5%A6%88%E6%8A%B1%E5%9B%9E%E5%AE%B6&sa=fyb_news,https://fyb-2.cdn.bcebos.com/hotboard_image/8e97371cc8cde587cd0e446c8533b5f7
15,三预警齐发！这些危险要警惕,中央气象台12月13日连续发布大雾、寒潮、大风预警，需要警惕对应天气给人们的交通出行、生产作业与户外活动带来诸多安全隐患。,6468578,https://m.baidu.com/s?word=%E4%B8%89%E9%A2%84%E8%AD%A6%E9%BD%90%E5%8F%91%EF%BC%81%E8%BF%99%E4%BA%9B%E5%8D%B1%E9%99%A9%E8%A6%81%E8%AD%A6%E6%83%95&sa=fyb_news,https://fyb-2.cdn.bcebos.com/hotboard_image/41312df19cd89f4d8a57bbb054aced71
16,赴俄士兵回朝 金正恩拥抱摸脸,近日，赴俄朝鲜工兵团回国，金正恩现场授予一级勋章，拥抱士兵、抚摸伤员脸。,6379430,https://m.baidu.com/s?word=%E8%B5%B4%E4%BF%84%E5%A3%AB%E5%85%B5%E5%9B%9E%E6%9C%9D+%E9%87%91%E6%AD%A3%E6%81%A9%E6%8B%A5%E6%8A%B1%E6%91%B8%E8%84%B8&sa=fyb_news,https://fyb-2.cdn.bcebos.com/hotboard_image/8b2f16fd1a0db0c76eca6eb57ab5c62a
17,景区演员大雪天跳水引网友心疼,12月12日，多段拍摄河南开封清明上河园内演员在大雪天仍真实表演跳河场景的视频引发关注。不少网友对演员的敬业纷纷给予了点赞，也有部分声音对演员表示了心疼。,6279243,https://m.baidu.com/s?word=%E6%99%AF%E5%8C%BA%E6%BC%94%E5%91%98%E5%A4%A7%E9%9B%AA%E5%A4%A9%E8%B7%B3%E6%B0%B4%E5%BC%95%E7%BD%91%E5%8F%8B%E5%BF%83%E7%96%BC&sa=fyb_news,https://fyb-2.cdn.bcebos.com/hotboard_image/18aa03bf0aa718a78d89e3ae3bd219db
18,妈妈打开孩子的信 网友：好吵一张纸,近日，家长会上，一位妈妈打开孩子写给自己的信，乍看密密麻麻，细看却几乎全是“妈妈妈妈妈妈”，内容不多情绪拉满，网友调侃“好吵一张纸”。不少家长也晒出孩子来信，有暖心表白，有直白想念，字里行间真情流露。,6178154,https://m.baidu.com/s?word=%E5%A6%88%E5%A6%88%E6%89%93%E5%BC%80%E5%AD%A9%E5%AD%90%E7%9A%84%E4%BF%A1+%E7%BD%91%E5%8F%8B%EF%BC%9A%E5%A5%BD%E5%90%B5%E4%B8%80%E5%BC%A0%E7%BA%B8&sa=fyb_news,https://fyb-2.cdn.bcebos.com/hotboard_image/9ecd40a679622139adf6be74b31abfbd
19,多人在故宫偶遇李现拍雪景,,6095979,https://m.baidu.com/s?word=%E5%A4%9A%E4%BA%BA%E5%9C%A8%E6%95%85%E5%AE%AB%E5%81%B6%E9%81%87%E6%9D%8E%E7%8E%B0%E6%8B%8D%E9%9B%AA%E6%99%AF&sa=fyb_news,https://fyb-1.cdn.bcebos.com/fyb/de6163834f53ca92c1273fff98ac9078.jpeg
20,考研准考证出现颜文字 高校回应,近日，2026年全国硕士研究生招生考试准考证开放打印期间，南方医科大学在准考证的报考点说明和招生单位说明中添加了暖心寄语和颜文字，考生纷纷在社交平台分享并称赞“被温暖”。高校回应称考生关键信息无误就行。,5992382,https://m.baidu.com/s?word=%E8%80%83%E7%A0%94%E5%87%86%E8%80%83%E8%AF%81%E5%87%BA%E7%8E%B0%E9%A2%9C%E6%96%87%E5%AD%97+%E9%AB%98%E6%A0%A1%E5%9B%9E%E5%BA%94&sa=fyb_news,https://fyb-2.cdn.bcebos.com/hotboard_image/8f1e1971ab462695b6dbaa85beb35a5c
21,国家公祭日淄博摇旗大叔又现身街头,12月13日，山东淄博的“摇旗大叔”再次现身街头，顶风冒雪挥舞国旗，高呼“勿忘国耻，振兴中华”，以此纪念南京大屠杀死难者国家公祭日。,5891170,https://m.baidu.com/s?word=%E5%9B%BD%E5%AE%B6%E5%85%AC%E7%A5%AD%E6%97%A5%E6%B7%84%E5%8D%9A%E6%91%87%E6%97%97%E5%A4%A7%E5%8F%94%E5%8F%88%E7%8E%B0%E8%BA%AB%E8%A1%97%E5%A4%B4&sa=fyb_news,https://fyb-2.cdn.bcebos.com/hotboard_image/67eacea43b8ebea4e7ed330e09b0cc94
22,邻居深夜将鸡鸭骨头埋入男子家地基,12月12日，广东一男子通过家中监控发现邻居深夜将鸡鸭骨头埋入自家地基。两家多年无矛盾，事件因监控记录曝光。,5804851,https://m.baidu.com/s?word=%E9%82%BB%E5%B1%85%E6%B7%B1%E5%A4%9C%E5%B0%86%E9%B8%A1%E9%B8%AD%E9%AA%A8%E5%A4%B4%E5%9F%8B%E5%85%A5%E7%94%B7%E5%AD%90%E5%AE%B6%E5%9C%B0%E5%9F%BA&sa=fyb_news,https://fyb-2.cdn.bcebos.com/hotboard_image/a78b2810ac769710a44007099b0cdad8
23,泰军F-16飞过 柬重机枪手猛烈开火,12月12日，国外社交媒体X流传一段视频显示，泰军一架F-16战机低空飞越时，地面一名柬埔寨重机枪手突然举枪，对着从头顶掠过的战机方向持续猛烈开火，枪声密集，现场画面紧张，引发外界关注。,5706451,https://m.baidu.com/s?word=%E6%B3%B0%E5%86%9BF-16%E9%A3%9E%E8%BF%87+%E6%9F%AC%E9%87%8D%E6%9C%BA%E6%9E%AA%E6%89%8B%E7%8C%9B%E7%83%88%E5%BC%80%E7%81%AB&sa=fyb_news,https://fyb-2.cdn.bcebos.com/hotboard_image/3f083fedf863f28b17cad59a4e8d443d
24,钟南山：流感患者三种情况立刻就医,,5613215,https://m.baidu.com/s?word=%E9%92%9F%E5%8D%97%E5%B1%B1%EF%BC%9A%E6%B5%81%E6%84%9F%E6%82%A3%E8%80%85%E4%B8%89%E7%A7%8D%E6%83%85%E5%86%B5%E7%AB%8B%E5%88%BB%E5%B0%B1%E5%8C%BB&sa=fyb_news,https://fyb-1.cdn.bcebos.com/fyb/de6163834f53ca92c1273fff98ac9078.jpeg
25,#没想到今年的四六级是高端局#,,5520565,https://m.baidu.com/s?word=%23%E6%B2%A1%E6%83%B3%E5%88%B0%E4%BB%8A%E5%B9%B4%E7%9A%84%E5%9B%9B%E5%85%AD%E7%BA%A7%E6%98%AF%E9%AB%98%E7%AB%AF%E5%B1%80%23&sa=fyb_news,https://fyb-1.cdn.bcebos.com/fyb/444846eeb217ede8c838d13ae8c9c9b0.jpg
26,男子驾车碾压妻子致死获刑5年,,5415616,https://m.baidu.com/s?word=%E7%94%B7%E5%AD%90%E9%A9%BE%E8%BD%A6%E7%A2%BE%E5%8E%8B%E5%A6%BB%E5%AD%90%E8%87%B4%E6%AD%BB%E8%8E%B7%E5%88%915%E5%B9%B4&sa=fyb_news,https://fyb-1.cdn.bcebos.com/fyb/de6163834f53ca92c1273fff98ac9078.jpeg
27,朱雀三号回收失败细节公布,12月3日，由蓝箭航天研制的朱雀三号重复使用运载火箭成功首飞，二子级火箭顺利入轨，一子级火箭回收失败。近日，总台央视记者独家专访了朱雀三号总设计师张晓东，首次对外披露了朱雀三号回收验证的关键技术细节。,5335794,https://m.baidu.com/s?word=%E6%9C%B1%E9%9B%80%E4%B8%89%E5%8F%B7%E5%9B%9E%E6%94%B6%E5%A4%B1%E8%B4%A5%E7%BB%86%E8%8A%82%E5%85%AC%E5%B8%83&sa=fyb_news,https://fyb-2.cdn.bcebos.com/hotboard_image/b868ca6a87281a7cfc27d096be4ace16
28,双子座流星雨迎来极大,,5231143,https://m.baidu.com/s?word=%E5%8F%8C%E5%AD%90%E5%BA%A7%E6%B5%81%E6%98%9F%E9%9B%A8%E8%BF%8E%E6%9D%A5%E6%9E%81%E5%A4%A7&sa=fyb_news,https://fyb-1.cdn.bcebos.com/fyb/de6163834f53ca92c1273fff98ac9078.jpeg
29,印度球迷因梅西提前离场爆发骚乱,北京时间12月13日，梅西印度行在加尔各答球场亮相，因球迷不满主办方向场内投掷杂物，之后该仪式提前结束。,5126973,https://m.baidu.com/s?word=%E5%8D%B0%E5%BA%A6%E7%90%83%E8%BF%B7%E5%9B%A0%E6%A2%85%E8%A5%BF%E6%8F%90%E5%89%8D%E7%A6%BB%E5%9C%BA%E7%88%86%E5%8F%91%E9%AA%9A%E4%B9%B1&sa=fyb_news,https://fyb-2.cdn.bcebos.com/hotboard_image/4b9a88223b95d5a606cbaf4937564f4d
30,重磅！韩文秀详解中央经济工作会议,12月13日，中央财办副主任韩文秀在中国经济年会上详解中央经济工作会议部署，提出稳中求进、提质增效，实施更加积极的财政政策和适度宽松的货币政策，扩大内需、推进改革创新，靠前实施“十五五”重点项目。,5044708,https://m.baidu.com/s?word=%E9%87%8D%E7%A3%85%EF%BC%81%E9%9F%A9%E6%96%87%E7%A7%80%E8%AF%A6%E8%A7%A3%E4%B8%AD%E5%A4%AE%E7%BB%8F%E6%B5%8E%E5%B7%A5%E4%BD%9C%E4%BC%9A%E8%AE%AE&sa=fyb_news,https://fyb-2.cdn.bcebos.com/hotboard_image/79ae85bad4e040af148cf4d40568c101
31,在二手平台买到自己刚被偷的衣服,近日，杭州一名女子网购冲锋衣显示送达却不见踪影，随后在二手交易平台刷到刚上新的同款衣服，卖家就在附近。她以买家身份约线下交易并报警，当场确认衣物正是自己被盗的快递，嫌疑人为邻近小区一名00后男子。,4935312,https://m.baidu.com/s?word=%E5%9C%A8%E4%BA%8C%E6%89%8B%E5%B9%B3%E5%8F%B0%E4%B9%B0%E5%88%B0%E8%87%AA%E5%B7%B1%E5%88%9A%E8%A2%AB%E5%81%B7%E7%9A%84%E8%A1%A3%E6%9C%8D&sa=fyb_news,https://fyb-2.cdn.bcebos.com/hotboard_image/bc0af3c7606242ce40bcd7a8ce22c73c
32,中国科学家发现抗癌“新利器”,12月10日，中国科学家在《细胞》发表研究成果，提出将过敏反应转化为抗癌手段的新思路。团队利用IgE致敏肥大细胞精准识别肿瘤抗原，诱导“肿瘤过敏反应”，在多种小鼠肿瘤模型中显现出显著抑制效果。,4848625,https://m.baidu.com/s?word=%E4%B8%AD%E5%9B%BD%E7%A7%91%E5%AD%A6%E5%AE%B6%E5%8F%91%E7%8E%B0%E6%8A%97%E7%99%8C%E2%80%9C%E6%96%B0%E5%88%A9%E5%99%A8%E2%80%9D&sa=fyb_news,https://fyb-2.cdn.bcebos.com/hotboard_image/58ac2007a0ffbda5068f9a6fdd019803
33,遗失身份证被冒用 大学生成失信人,近日，一名大学生遗失身份证后被冒用登记为公司法定代表人和股东，毫不知情却因公司纠纷被限制高消费并列入失信名单，求职受阻、账户被冻结。经查签名系伪造，法院判决涉事公司及原股东赔偿相关损失并承担侵权责任。,4753458,https://m.baidu.com/s?word=%E9%81%97%E5%A4%B1%E8%BA%AB%E4%BB%BD%E8%AF%81%E8%A2%AB%E5%86%92%E7%94%A8+%E5%A4%A7%E5%AD%A6%E7%94%9F%E6%88%90%E5%A4%B1%E4%BF%A1%E4%BA%BA&sa=fyb_news,https://fyb-2.cdn.bcebos.com/hotboard_image/42b157717e0d3f24e594e90b2087ae58
34,寒潮来袭 劝你多学企鹅走路,12月13日，寒潮继续影响我国，降温核心区域转移到南方，雨雪天气如何安全出行？这份攻略请查收。,4666428,https://m.baidu.com/s?word=%E5%AF%92%E6%BD%AE%E6%9D%A5%E8%A2%AD+%E5%8A%9D%E4%BD%A0%E5%A4%9A%E5%AD%A6%E4%BC%81%E9%B9%85%E8%B5%B0%E8%B7%AF&sa=fyb_news,https://fyb-2.cdn.bcebos.com/hotboard_image/41e2b3a7349261d0a7ec8ccba635b886
35,张本美和用中文称赞中国队厉害,,4546828,https://m.baidu.com/s?word=%E5%BC%A0%E6%9C%AC%E7%BE%8E%E5%92%8C%E7%94%A8%E4%B8%AD%E6%96%87%E7%A7%B0%E8%B5%9E%E4%B8%AD%E5%9B%BD%E9%98%9F%E5%8E%89%E5%AE%B3&sa=fyb_news,https://fyb-1.cdn.bcebos.com/fyb/de6163834f53ca92c1273fff98ac9078.jpeg
36,孙颖莎王楚钦横扫日本组合晋级决赛,12月13日，国乒组合孙颖莎/王楚钦在WTT香港总决赛混双半决赛中，以3-0（具体局分未披露）横扫日本组合松岛辉空/张本美和，强势晋级决赛。,4468867,https://m.baidu.com/s?word=%E5%AD%99%E9%A2%96%E8%8E%8E%E7%8E%8B%E6%A5%9A%E9%92%A6%E6%A8%AA%E6%89%AB%E6%97%A5%E6%9C%AC%E7%BB%84%E5%90%88%E6%99%8B%E7%BA%A7%E5%86%B3%E8%B5%9B&sa=fyb_news,https://fyb-2.cdn.bcebos.com/hotboard_image/c5b1a8d87f9ceb58d1b2272ec21bfde4
37,羽绒服不是越重越暖和,羽绒服保暖与否，与重量没有必然关系，关键看三点：第一，看它能否“锁住空气”，空气是热的不良导体，空气不动就是最好的保温层；第二，看蓬松度，蓬松度越高，保暖性越强；第三，看充绒量，这个直接决定了热量储备。,4356639,https://m.baidu.com/s?word=%E7%BE%BD%E7%BB%92%E6%9C%8D%E4%B8%8D%E6%98%AF%E8%B6%8A%E9%87%8D%E8%B6%8A%E6%9A%96%E5%92%8C&sa=fyb_news,https://fyb-2.cdn.bcebos.com/hotboard_image/abdf41987924a4c1ca70ab7692a0cb0f
38,拉夫罗夫智胜中情局挖出“内鬼”,据俄罗斯连塔网12月11日报道，2017年，俄罗斯外交部长拉夫罗夫智胜中央情报局，使打入克里姆林宫内部的一名美国间谍暴露。,4257274,https://m.baidu.com/s?word=%E6%8B%89%E5%A4%AB%E7%BD%97%E5%A4%AB%E6%99%BA%E8%83%9C%E4%B8%AD%E6%83%85%E5%B1%80%E6%8C%96%E5%87%BA%E2%80%9C%E5%86%85%E9%AC%BC%E2%80%9D&sa=fyb_news,https://fyb-2.cdn.bcebos.com/hotboard_image/106cb399d246b0f234d164bf317bb1b4
39,白银暴涨 有人2月赚16万,曾被视为“冷门品种”的白银以超120%的年度涨幅成为全年投资“黑马”，而同期黄金的涨幅约为60%，为白银的一半。白银收益遥遥领先，不仅刷新历史新高，更吸引机构与散户争相入局，有人借此行情两个月赚了16万。,4185180,https://m.baidu.com/s?word=%E7%99%BD%E9%93%B6%E6%9A%B4%E6%B6%A8+%E6%9C%89%E4%BA%BA2%E6%9C%88%E8%B5%9A16%E4%B8%87&sa=fyb_news,https://fyb-2.cdn.bcebos.com/hotboard_image/2a0a77d3486662d4948550c2ee1ca6e1
40,中国火箭军：以国之名 祭奠,12月13日，国家公祭日当天，中国火箭军发布纪念视频，以国之名祭奠南京大屠杀遇难同胞，“一刻也不敢忘”的画面令人泪目。,4076653,https://m.baidu.com/s?word=%E4%B8%AD%E5%9B%BD%E7%81%AB%E7%AE%AD%E5%86%9B%EF%BC%9A%E4%BB%A5%E5%9B%BD%E4%B9%8B%E5%90%8D+%E7%A5%AD%E5%A5%A0&sa=fyb_news,https://fyb-2.cdn.bcebos.com/hotboard_image/ef8aa6bf58900aab37d2db4bc6b4967f
41,湖南怀化贩婴案18人落网,,3981860,https://m.baidu.com/s?word=%E6%B9%96%E5%8D%97%E6%80%80%E5%8C%96%E8%B4%A9%E5%A9%B4%E6%A1%8818%E4%BA%BA%E8%90%BD%E7%BD%91&sa=fyb_news,https://fyb-1.cdn.bcebos.com/fyb/de6163834f53ca92c1273fff98ac9078.jpeg
42,国家医保局5年追回约1200亿元,近日，全国医疗保障工作会议披露，近5年来，全国医保部门通过飞行检查、协议处理和行政处罚等方式，累计追回医保基金约1200亿元。国家医保局表示，将持续强化监管，扩大飞行检查覆盖范围，严打欺诈骗保行为。,3910108,https://m.baidu.com/s?word=%E5%9B%BD%E5%AE%B6%E5%8C%BB%E4%BF%9D%E5%B1%805%E5%B9%B4%E8%BF%BD%E5%9B%9E%E7%BA%A61200%E4%BA%BF%E5%85%83&sa=fyb_news,https://fyb-2.cdn.bcebos.com/hotboard_image/211e86e07708baa9f79d695f9dc5b24f
43,柬埔寨首相：支持停火提议,当地时间12月13日，柬埔寨首相洪玛奈发文称，柬埔寨欢迎并支持马来西亚总理安瓦尔提出的停火提议，由东盟观察员团进行监督，美国也将参与。,3808968,https://m.baidu.com/s?word=%E6%9F%AC%E5%9F%94%E5%AF%A8%E9%A6%96%E7%9B%B8%EF%BC%9A%E6%94%AF%E6%8C%81%E5%81%9C%E7%81%AB%E6%8F%90%E8%AE%AE&sa=fyb_news,https://fyb-2.cdn.bcebos.com/hotboard_image/ee3a21bca29b97dc58f8be3d74707166
44,歼-16有多厉害 中俄巡航为何选它,12月9日，中俄空军在东海、太平洋西部实施第十次联合空中战略巡航，歼-16作为中方主要护航机型参与行动。专家指出，歼-16航程远、雷达与武器体系先进，具备对空压制和多任务能力，可为轰炸机提供稳定护航，应对复杂空情与潜在空中挑衅。,3677130,https://m.baidu.com/s?word=%E6%AD%BC-16%E6%9C%89%E5%A4%9A%E5%8E%89%E5%AE%B3+%E4%B8%AD%E4%BF%84%E5%B7%A1%E8%88%AA%E4%B8%BA%E4%BD%95%E9%80%89%E5%AE%83&sa=fyb_news,https://fyb-2.cdn.bcebos.com/hotboard_image/1057e21bdbb178cd7bacb02573c6fe3e
45,辽宁舰编队折返形成二次威慑,,3618275,https://m.baidu.com/s?word=%E8%BE%BD%E5%AE%81%E8%88%B0%E7%BC%96%E9%98%9F%E6%8A%98%E8%BF%94%E5%BD%A2%E6%88%90%E4%BA%8C%E6%AC%A1%E5%A8%81%E6%85%91&sa=fyb_news,https://fyb-1.cdn.bcebos.com/fyb/de6163834f53ca92c1273fff98ac9078.jpeg
46,专家：“国补”可能向服务消费倾斜,12月10日至11日中央经济工作会议提出，深入实施提振消费专项行动，优化“两新”政策实施。分析师王青预计，明年财政促消费资金规模或从今年3000亿元上调至5000亿元，支持范围从耐用消费品扩大到服务消费领域。,3518118,https://m.baidu.com/s?word=%E4%B8%93%E5%AE%B6%EF%BC%9A%E2%80%9C%E5%9B%BD%E8%A1%A5%E2%80%9D%E5%8F%AF%E8%83%BD%E5%90%91%E6%9C%8D%E5%8A%A1%E6%B6%88%E8%B4%B9%E5%80%BE%E6%96%9C&sa=fyb_news,https://fyb-2.cdn.bcebos.com/hotboard_image/016a26ade6dea456efe833f386b5f1c6
47,日军细菌战不止针对中国,,3408667,https://m.baidu.com/s?word=%E6%97%A5%E5%86%9B%E7%BB%86%E8%8F%8C%E6%88%98%E4%B8%8D%E6%AD%A2%E9%92%88%E5%AF%B9%E4%B8%AD%E5%9B%BD&sa=fyb_news,https://fyb-1.cdn.bcebos.com/fyb/de6163834f53ca92c1273fff98ac9078.jpeg
48,林诗栋4比0胜向鹏晋级四强,12月13日，WTT香港总决赛男单1/4决赛，林诗栋以4-0击败向鹏晋级四强，四局比分：11-3，11-7，11-5、11-3。,3307095,https://m.baidu.com/s?word=%E6%9E%97%E8%AF%97%E6%A0%8B4%E6%AF%940%E8%83%9C%E5%90%91%E9%B9%8F%E6%99%8B%E7%BA%A7%E5%9B%9B%E5%BC%BA&sa=fyb_news,https://fyb-2.cdn.bcebos.com/hotboard_image/e12eccd3f54a19f2f8a3d3f9aa4f3124
49,88年 我们从未忘记！,,3240856,https://m.baidu.com/s?word=88%E5%B9%B4+%E6%88%91%E4%BB%AC%E4%BB%8E%E6%9C%AA%E5%BF%98%E8%AE%B0%EF%BC%81&sa=fyb_news,https://fyb-1.cdn.bcebos.com/fyb/de6163834f53ca92c1273fff98ac9078.jpeg
50,#88年了南京不会忘记#,,3102605,https://m.baidu.com/s?word=%2388%E5%B9%B4%E4%BA%86%E5%8D%97%E4%BA%AC%E4%B8%8D%E4%BC%9A%E5%BF%98%E8%AE%B0%23&sa=fyb_news,https://fyb-1.cdn.bcebos.com/fyb/444846eeb217ede8c838d13ae8c9c9b0.jpg
