热搜排名,热搜标题,描述,热搜指数,链接地址,封图链接
0,习近平将出席全球妇女峰会开幕式,全球妇女峰会将于10月13日至14日在北京举行。国家主席习近平将出席峰会开幕式并发表主旨讲话。,7904249,https://m.baidu.com/s?word=%E4%B9%A0%E8%BF%91%E5%B9%B3%E5%B0%86%E5%87%BA%E5%B8%AD%E5%85%A8%E7%90%83%E5%A6%87%E5%A5%B3%E5%B3%B0%E4%BC%9A%E5%BC%80%E5%B9%95%E5%BC%8F&sa=fyb_news,https://fyb-2.cdn.bcebos.com/hotboard_image/1dd00a1c875bca7565fff388e2e3efa7
1,全球首颗！中国研发全新架构闪存芯片,10月8日，复旦大学团队在《自然》发表成果，成功研制全球首颗二维—硅基混合架构闪存芯片“长缨（CY-01）”。该芯片兼具超快速度与低功耗，可在现有产线上量产，标志中国在新一代存储技术上实现从“跟跑”到“领跑”的跨越。,7808411,https://m.baidu.com/s?word=%E5%85%A8%E7%90%83%E9%A6%96%E9%A2%97%EF%BC%81%E4%B8%AD%E5%9B%BD%E7%A0%94%E5%8F%91%E5%85%A8%E6%96%B0%E6%9E%B6%E6%9E%84%E9%97%AA%E5%AD%98%E8%8A%AF%E7%89%87&sa=fyb_news,https://fyb-2.cdn.bcebos.com/hotboard_image/75fb27cf2c3f4cd07cd3d9282245c037
2,银行免费短信正在消失,近期，多家银行宣布上调部分动账短信通知服务的起点金额，包括国有大行、股份行、城商行等多个类型银行，调整范围主要为免费短信服务也涉及少部分收费服务。,7712929,https://m.baidu.com/s?word=%E9%93%B6%E8%A1%8C%E5%85%8D%E8%B4%B9%E7%9F%AD%E4%BF%A1%E6%AD%A3%E5%9C%A8%E6%B6%88%E5%A4%B1&sa=fyb_news,https://fyb-2.cdn.bcebos.com/hotboard_image/70d49d6c407848dd1f0c03abc66d4933
3,北方秋雨持续几天,这几天，刚刚进入十月的北方仿佛拿错了“天气剧本”。没有熟悉的秋高气爽，反而是一场接一场的秋雨！这样的秋雨模式还将持续，预计一直到13日，西北地区东部、华北、黄淮等地部分地区仍将有中到大雨，局地暴雨或大暴雨。,7617549,https://m.baidu.com/s?word=%E5%8C%97%E6%96%B9%E7%A7%8B%E9%9B%A8%E6%8C%81%E7%BB%AD%E5%87%A0%E5%A4%A9&sa=fyb_news,https://fyb-2.cdn.bcebos.com/hotboard_image/bd08ee6dc7ea71a79b2792044a36481e
4,日本一飞机穿越台风眼拍下震撼画面,10月9日，台风“夏浪”逼近日本伊豆群岛，观测飞机穿越台风眼拍下螺旋状云带，日本气象厅发布暴风与巨浪特别警报，预警数十年一遇的灾害风险。,7519834,https://m.baidu.com/s?word=%E6%97%A5%E6%9C%AC%E4%B8%80%E9%A3%9E%E6%9C%BA%E7%A9%BF%E8%B6%8A%E5%8F%B0%E9%A3%8E%E7%9C%BC%E6%8B%8D%E4%B8%8B%E9%9C%87%E6%92%BC%E7%94%BB%E9%9D%A2&sa=fyb_news,https://fyb-2.cdn.bcebos.com/hotboard_image/839e193d8a8eff437246acae2f4bee57
5,上海女学警“图图警官”火出圈,继杭州兔子警官后上海南京路步行街的一位女学警彻底火了！有网友逛街时拍到她执勤的画面，因为模样可爱讨喜，大家都亲切地叫她“图图警官”，夸她又美又飒。,7426723,https://m.baidu.com/s?word=%E4%B8%8A%E6%B5%B7%E5%A5%B3%E5%AD%A6%E8%AD%A6%E2%80%9C%E5%9B%BE%E5%9B%BE%E8%AD%A6%E5%AE%98%E2%80%9D%E7%81%AB%E5%87%BA%E5%9C%88&sa=fyb_news,https://fyb-2.cdn.bcebos.com/hotboard_image/6642b0ff6dc44b364283517aafb52482
6,女孩在同学家玩没人接：其父家中离世,10月8日，有网友爆料称，重庆一名7岁女孩中秋节当天到同学家玩，原本答应会接她回家的父亲一直联系不上，女孩也无法回家。同学家人报警后，警方也无法联系上其父亲，直到两天后，才发现其父亲已在家中离世。,7333481,https://m.baidu.com/s?word=%E5%A5%B3%E5%AD%A9%E5%9C%A8%E5%90%8C%E5%AD%A6%E5%AE%B6%E7%8E%A9%E6%B2%A1%E4%BA%BA%E6%8E%A5%EF%BC%9A%E5%85%B6%E7%88%B6%E5%AE%B6%E4%B8%AD%E7%A6%BB%E4%B8%96&sa=fyb_news,https://fyb-2.cdn.bcebos.com/hotboard_image/c157ae50db28e57641c94a607282a05c
7,94岁爷爷早早站在路口送去世发小,近日，94岁老人拄拐杖提前在路口送别同龄发小，红着眼眶不舍道别，反复提及“老朋友我来送送你”，场景令人动容。,7231997,https://m.baidu.com/s?word=94%E5%B2%81%E7%88%B7%E7%88%B7%E6%97%A9%E6%97%A9%E7%AB%99%E5%9C%A8%E8%B7%AF%E5%8F%A3%E9%80%81%E5%8E%BB%E4%B8%96%E5%8F%91%E5%B0%8F&sa=fyb_news,https://fyb-2.cdn.bcebos.com/hotboard_image/02d330e6a47bcd59a62b09cf976f68ff
8,多款产品突降价引不满 大疆回应,近日，大疆多款热门产品突然降价引发消费者不满。大疆回应：本次价格调整是大疆为“双11”推出的常规促销安排，目前正通过各个渠道积极沟通，为用户提供清晰指引与必要支持。,7138921,https://m.baidu.com/s?word=%E5%A4%9A%E6%AC%BE%E4%BA%A7%E5%93%81%E7%AA%81%E9%99%8D%E4%BB%B7%E5%BC%95%E4%B8%8D%E6%BB%A1+%E5%A4%A7%E7%96%86%E5%9B%9E%E5%BA%94&sa=fyb_news,https://fyb-2.cdn.bcebos.com/hotboard_image/ec72d11d95dbb3c46716bf98a3879789
9,节后第1天湖南热到全国第一,10月9日，湖南攸县以37.9℃位居全国高温榜首，省内多地进入前十。长沙、怀化、永州等市相继发布高温黄色或橙色预警，部分地区最高气温达39℃。,7039948,https://m.baidu.com/s?word=%E8%8A%82%E5%90%8E%E7%AC%AC1%E5%A4%A9%E6%B9%96%E5%8D%97%E7%83%AD%E5%88%B0%E5%85%A8%E5%9B%BD%E7%AC%AC%E4%B8%80&sa=fyb_news,https://fyb-2.cdn.bcebos.com/hotboard_image/1357ec6d587eb90b090fe3424ab1f226
10,男子路边停车休息遭野猴入车袭击,近日，一男子驾车途经昆明市禄劝县皎平渡镇半新公路（金银坳大桥路段），停车开窗略作休息时，一只不知从何而来的野猴突然跳进车内对他发起了攻击。,6950441,https://m.baidu.com/s?word=%E7%94%B7%E5%AD%90%E8%B7%AF%E8%BE%B9%E5%81%9C%E8%BD%A6%E4%BC%91%E6%81%AF%E9%81%AD%E9%87%8E%E7%8C%B4%E5%85%A5%E8%BD%A6%E8%A2%AD%E5%87%BB&sa=fyb_news,https://fyb-2.cdn.bcebos.com/hotboard_image/31786be35aeda94975bf73d697bdfdf4
11,长期服用降压药血管会变脆系谣言,长期服用降压药，血管会变脆？这是一个常见误区。长期服用降压药不会让血管变脆，真正让血管变脆的“真凶”是高血压，而不是药物。降压药不仅不会导致血管变脆，相反，部分降压药还能预防动脉硬化加重，保护血管和心脏。,6854844,https://m.baidu.com/s?word=%E9%95%BF%E6%9C%9F%E6%9C%8D%E7%94%A8%E9%99%8D%E5%8E%8B%E8%8D%AF%E8%A1%80%E7%AE%A1%E4%BC%9A%E5%8F%98%E8%84%86%E7%B3%BB%E8%B0%A3%E8%A8%80&sa=fyb_news,https://fyb-2.cdn.bcebos.com/hotboard_image/db4ea461aa237ede0e2763c150d741bb
12,沙溢总结假期：八天成功吃胖十斤,10月9日，沙溢发文称“国庆假期收获了10斤肉”，并配发视频自述假期坚持“吃和睡”两件事，称体重时因震惊闭眼直呼“希望是幻觉”。,6756193,https://m.baidu.com/s?word=%E6%B2%99%E6%BA%A2%E6%80%BB%E7%BB%93%E5%81%87%E6%9C%9F%EF%BC%9A%E5%85%AB%E5%A4%A9%E6%88%90%E5%8A%9F%E5%90%83%E8%83%96%E5%8D%81%E6%96%A4&sa=fyb_news,https://fyb-2.cdn.bcebos.com/hotboard_image/8591e78e8a623b9e9b43061ca8510297
13,5岁男孩在幼儿园被戳伤致左眼失明,近期，江西瑞昌一名5岁男孩在幼儿园被同学用铅笔戳伤左眼，教师未及时送医而是涂抹猪油试图消肿，导致严重感染。经诊断，男孩左眼角膜、虹膜等均破裂，最终失明并需终身佩戴辅助器具。教育局：已多次介入调解，仍在处理中。,6661696,https://m.baidu.com/s?word=5%E5%B2%81%E7%94%B7%E5%AD%A9%E5%9C%A8%E5%B9%BC%E5%84%BF%E5%9B%AD%E8%A2%AB%E6%88%B3%E4%BC%A4%E8%87%B4%E5%B7%A6%E7%9C%BC%E5%A4%B1%E6%98%8E&sa=fyb_news,https://fyb-2.cdn.bcebos.com/hotboard_image/a697b4ed30ea23ea74d502353cfcdde7
14,2名中国游客失联 中方敦促：争分夺秒,,6568940,https://m.baidu.com/s?word=2%E5%90%8D%E4%B8%AD%E5%9B%BD%E6%B8%B8%E5%AE%A2%E5%A4%B1%E8%81%94+%E4%B8%AD%E6%96%B9%E6%95%A6%E4%BF%83%EF%BC%9A%E4%BA%89%E5%88%86%E5%A4%BA%E7%A7%92&sa=fyb_news,https://fyb-1.cdn.bcebos.com/fyb/de6163834f53ca92c1273fff98ac9078.jpeg
15,甘孜党岭女游客高反获救 仍在ICU,近日，四川甘孜党岭发生女游客高原反应被困事件。受伤游客林女士经多名驴友接力救助后送医，仍在重症监护室抢救，尚未脱离生命危险。其母称，林女士术后尚未苏醒，医生表示或需二次手术。,6476115,https://m.baidu.com/s?word=%E7%94%98%E5%AD%9C%E5%85%9A%E5%B2%AD%E5%A5%B3%E6%B8%B8%E5%AE%A2%E9%AB%98%E5%8F%8D%E8%8E%B7%E6%95%91+%E4%BB%8D%E5%9C%A8ICU&sa=fyb_news,https://fyb-2.cdn.bcebos.com/hotboard_image/7354a8e98b2796d91a21fa0e7785b8ef
16,内塔尼亚胡：相比美国 以不算心狠手辣,当地时间10月8日，以色列总理内塔尼亚胡在采访中对比二战历史，称以色列对加沙的军事行动不如美国心狠手辣，并以美国对广岛、长崎的原子弹轰炸为例，强调以军未实施类似行动，同时否认对加沙地毯式轰炸。,6377700,https://m.baidu.com/s?word=%E5%86%85%E5%A1%94%E5%B0%BC%E4%BA%9A%E8%83%A1%EF%BC%9A%E7%9B%B8%E6%AF%94%E7%BE%8E%E5%9B%BD+%E4%BB%A5%E4%B8%8D%E7%AE%97%E5%BF%83%E7%8B%A0%E6%89%8B%E8%BE%A3&sa=fyb_news,https://fyb-2.cdn.bcebos.com/hotboard_image/a9b4f703df04d1a991cde4ee96b07f02
17,寒露过后建议“洋葱穿衣法”,寒露节气昼夜温差变大，意味着一年中穿衣最纠结的时节即将来临，建议大家不妨尝试洋葱穿衣法，即像洋葱一样一层一层穿衣服，也能根据不同场合与温度变化随时穿脱。,6274196,https://m.baidu.com/s?word=%E5%AF%92%E9%9C%B2%E8%BF%87%E5%90%8E%E5%BB%BA%E8%AE%AE%E2%80%9C%E6%B4%8B%E8%91%B1%E7%A9%BF%E8%A1%A3%E6%B3%95%E2%80%9D&sa=fyb_news,https://fyb-2.cdn.bcebos.com/hotboard_image/ccf532ab6a743ba269084657d245d9c1
18,爷爷卖菜攒3万 孙子放宝马车内被盗,近日，一男子向记者透露，年过八旬的爷爷多年卖菜攒3万元，让自己存起来，存钱时密码输错没存成放宝马车内被盗，监控显示俩小毛贼“瞬间”打开车门，南昌警方立案调查。,6176816,https://m.baidu.com/s?word=%E7%88%B7%E7%88%B7%E5%8D%96%E8%8F%9C%E6%94%923%E4%B8%87+%E5%AD%99%E5%AD%90%E6%94%BE%E5%AE%9D%E9%A9%AC%E8%BD%A6%E5%86%85%E8%A2%AB%E7%9B%97&sa=fyb_news,https://fyb-2.cdn.bcebos.com/hotboard_image/362b1e6bd437faeb14262f1f9edabd54
19,小伙回应免费为老人剪王嘉尔发型,,6094815,https://m.baidu.com/s?word=%E5%B0%8F%E4%BC%99%E5%9B%9E%E5%BA%94%E5%85%8D%E8%B4%B9%E4%B8%BA%E8%80%81%E4%BA%BA%E5%89%AA%E7%8E%8B%E5%98%89%E5%B0%94%E5%8F%91%E5%9E%8B&sa=fyb_news,https://fyb-1.cdn.bcebos.com/fyb/de6163834f53ca92c1273fff98ac9078.jpeg
20,长假一群人带着绿豆游遍祖国,近日，不少四年级学生家长为完成语文观察日记作业，带着绿豆出游，“绿豆陪玩全国”成假期新奇景象。家长们一路浇水记录，让绿豆从发芽到长叶全过程“打卡祖国山河”，甚至有网友调侃为“大型历史剧——绿豆八天乐”。,6001081,https://m.baidu.com/s?word=%E9%95%BF%E5%81%87%E4%B8%80%E7%BE%A4%E4%BA%BA%E5%B8%A6%E7%9D%80%E7%BB%BF%E8%B1%86%E6%B8%B8%E9%81%8D%E7%A5%96%E5%9B%BD&sa=fyb_news,https://fyb-2.cdn.bcebos.com/hotboard_image/ee8a55e8ea4653285a0acab3471d4c1a
21,中医医保支付将进行改革试点,,5898275,https://m.baidu.com/s?word=%E4%B8%AD%E5%8C%BB%E5%8C%BB%E4%BF%9D%E6%94%AF%E4%BB%98%E5%B0%86%E8%BF%9B%E8%A1%8C%E6%94%B9%E9%9D%A9%E8%AF%95%E7%82%B9&sa=fyb_news,https://fyb-1.cdn.bcebos.com/fyb/de6163834f53ca92c1273fff98ac9078.jpeg
22,乘客在机场阻止插队被扇耳光,10月8日，南京禄口机场一名乘客在值机时阻止他人插队，遭对方辱骂并扇耳光。警方介入后，涉事双方达成调解，打人者道歉并赔偿3500元及高铁票费用530元。,5795671,https://m.baidu.com/s?word=%E4%B9%98%E5%AE%A2%E5%9C%A8%E6%9C%BA%E5%9C%BA%E9%98%BB%E6%AD%A2%E6%8F%92%E9%98%9F%E8%A2%AB%E6%89%87%E8%80%B3%E5%85%89&sa=fyb_news,https://fyb-2.cdn.bcebos.com/hotboard_image/76417c94ab565627f41a98f8c457dada
23,洛阳一水库漂满垃圾 系饮用水源地,10月8日，河南洛阳故县水库（饮用水源地）被曝水面漂浮大量白色垃圾，主要为矿泉水瓶、泡沫碎粒及医疗废弃物，下游涉及洛宁县和洛阳市供水。博主清理部分垃圾并向部门投诉，卢氏县与水库管理局已调配人员开展清理。,5712566,https://m.baidu.com/s?word=%E6%B4%9B%E9%98%B3%E4%B8%80%E6%B0%B4%E5%BA%93%E6%BC%82%E6%BB%A1%E5%9E%83%E5%9C%BE+%E7%B3%BB%E9%A5%AE%E7%94%A8%E6%B0%B4%E6%BA%90%E5%9C%B0&sa=fyb_news,https://fyb-2.cdn.bcebos.com/hotboard_image/dcf0ebd33e4dd5e3a59e3602b1775bbe
24,销售的烧鸡有七条鸡腿？商家回应,近日，河南一游客在张玉娟烧鸡店购买“道口烧鸡”后，拆开包装竟发现七条鸡腿。9日，涉事门店负责人回应称，产品分烧鸡、鸡翅、鸡腿三种，因外包装统一，可能误将整包鸡腿装入烧鸡袋中。顾客反映后，店家提出补寄烧鸡被拒。,5608663,https://m.baidu.com/s?word=%E9%94%80%E5%94%AE%E7%9A%84%E7%83%A7%E9%B8%A1%E6%9C%89%E4%B8%83%E6%9D%A1%E9%B8%A1%E8%85%BF%EF%BC%9F%E5%95%86%E5%AE%B6%E5%9B%9E%E5%BA%94&sa=fyb_news,https://fyb-2.cdn.bcebos.com/hotboard_image/fcd44330a68e35e8dd40dcb6176d8171
25,德克士回应黑金藤椒小酥肉外形被吐槽,近期，德克士 “黑金藤椒脆皮小酥肉” 因外形被网友吐槽 “太抽象”。10月9日，德克士回应称该产品暑期已陆续下架，现存货为部分门店销售较慢的存货，售罄后不再供应。,5513824,https://m.baidu.com/s?word=%E5%BE%B7%E5%85%8B%E5%A3%AB%E5%9B%9E%E5%BA%94%E9%BB%91%E9%87%91%E8%97%A4%E6%A4%92%E5%B0%8F%E9%85%A5%E8%82%89%E5%A4%96%E5%BD%A2%E8%A2%AB%E5%90%90%E6%A7%BD&sa=fyb_news,https://fyb-2.cdn.bcebos.com/hotboard_image/657a20dcc1ec615a8245f77e8eab86ae
26,女网红从重庆打车到内蒙古引质疑,,5419403,https://m.baidu.com/s?word=%E5%A5%B3%E7%BD%91%E7%BA%A2%E4%BB%8E%E9%87%8D%E5%BA%86%E6%89%93%E8%BD%A6%E5%88%B0%E5%86%85%E8%92%99%E5%8F%A4%E5%BC%95%E8%B4%A8%E7%96%91&sa=fyb_news,https://fyb-1.cdn.bcebos.com/fyb/de6163834f53ca92c1273fff98ac9078.jpeg
27,男子为给领导添堵向境外泄密,近日，某大型企业员工因对部门领导心怀不满，使用VPN注册境外邮箱，多次向境外机构泄露包含货物名称、数量及交易额等商业核心数据，导致企业遭境外恶意抹黑、货船被非法拦截，造成重大经济损失并危害国家利益。,5323476,https://m.baidu.com/s?word=%E7%94%B7%E5%AD%90%E4%B8%BA%E7%BB%99%E9%A2%86%E5%AF%BC%E6%B7%BB%E5%A0%B5%E5%90%91%E5%A2%83%E5%A4%96%E6%B3%84%E5%AF%86&sa=fyb_news,https://fyb-2.cdn.bcebos.com/hotboard_image/a6b3ae4f8d88f0632dc55508cca4ecd9
28,车辆逆行后撞破桥栏坠落？交警回应,近日，“一车辆逆行后撞破桥栏坠落”视频在网络流传。该视频显示，在一交叉路口，一辆黑色轿车疑似高速逆行，左转时冲破桥梁栏杆坠落。吴中区交警大队确认事件正在处理，暂未公布事发原因及救援进展。,5217853,https://m.baidu.com/s?word=%E8%BD%A6%E8%BE%86%E9%80%86%E8%A1%8C%E5%90%8E%E6%92%9E%E7%A0%B4%E6%A1%A5%E6%A0%8F%E5%9D%A0%E8%90%BD%EF%BC%9F%E4%BA%A4%E8%AD%A6%E5%9B%9E%E5%BA%94&sa=fyb_news,https://fyb-2.cdn.bcebos.com/hotboard_image/529cab34e78555bb3835296c01e5274e
29,普京谈阿航客机失事事件,,5130720,https://m.baidu.com/s?word=%E6%99%AE%E4%BA%AC%E8%B0%88%E9%98%BF%E8%88%AA%E5%AE%A2%E6%9C%BA%E5%A4%B1%E4%BA%8B%E4%BA%8B%E4%BB%B6&sa=fyb_news,https://fyb-1.cdn.bcebos.com/fyb/de6163834f53ca92c1273fff98ac9078.jpeg
30,王毅：中方将继续对意延长免签政策,当地时间10月8日，王毅在意大利发声：中方将继续对意延长免签政策，让更多新时代的马可‧波罗能够来一场说走就走的中国之旅。,5049698,https://m.baidu.com/s?word=%E7%8E%8B%E6%AF%85%EF%BC%9A%E4%B8%AD%E6%96%B9%E5%B0%86%E7%BB%A7%E7%BB%AD%E5%AF%B9%E6%84%8F%E5%BB%B6%E9%95%BF%E5%85%8D%E7%AD%BE%E6%94%BF%E7%AD%96&sa=fyb_news,https://fyb-2.cdn.bcebos.com/hotboard_image/391fc38c8aaa7b518c34c552fca4e5a5
31,大理网红稻田遭游客大面积踩踏,10月7日，云南大理喜洲古镇三千亩网红稻田遭游客大面积踩踏，成熟稻谷倒伏数十平方米。镇政府回应称，虽设有田埂及城管巡视，但因游客过多未能有效管控。,4936344,https://m.baidu.com/s?word=%E5%A4%A7%E7%90%86%E7%BD%91%E7%BA%A2%E7%A8%BB%E7%94%B0%E9%81%AD%E6%B8%B8%E5%AE%A2%E5%A4%A7%E9%9D%A2%E7%A7%AF%E8%B8%A9%E8%B8%8F&sa=fyb_news,https://fyb-2.cdn.bcebos.com/hotboard_image/17c004d5cdf4692798c64f9f408b2d68
32,四川5.4级地震 居民：地面巨响20多秒,10月9日，四川甘孜州新龙县发生5.4级地震，震源深度10公里。震中附近居民称地面发出轰隆巨响持续20多秒，震感强烈导致物品坠落，身体像充气城堡不受控制。,4836786,https://m.baidu.com/s?word=%E5%9B%9B%E5%B7%9D5.4%E7%BA%A7%E5%9C%B0%E9%9C%87+%E5%B1%85%E6%B0%91%EF%BC%9A%E5%9C%B0%E9%9D%A2%E5%B7%A8%E5%93%8D20%E5%A4%9A%E7%A7%92&sa=fyb_news,https://fyb-2.cdn.bcebos.com/hotboard_image/79a3e50b4f43edb0d1418722d8d67419
33,这样的真空包装食物可能有卫生隐患,近期，多起肉毒毒素中毒病例与食用真空包装即食肉制品相关，其厌氧环境易滋生肉毒梭菌，毒素毒性为砒霜的1000万倍，需加热至80℃以上30分钟灭活。小微品牌产品因生产储运不当风险更高。,4738352,https://m.baidu.com/s?word=%E8%BF%99%E6%A0%B7%E7%9A%84%E7%9C%9F%E7%A9%BA%E5%8C%85%E8%A3%85%E9%A3%9F%E7%89%A9%E5%8F%AF%E8%83%BD%E6%9C%89%E5%8D%AB%E7%94%9F%E9%9A%90%E6%82%A3&sa=fyb_news,https://fyb-2.cdn.bcebos.com/hotboard_image/6964a2f9991b410de6707cade9c3272c
34,泰国今年接待外国游客人数下降,泰国旅游与体育部数据显示，泰国今年前9个月累计接待外国游客2411万人次，较去年同期下降7.5%。造成下降的原因是泰铢升值、国际经济下滑和周边国家旅游业竞争加剧等。,4650942,https://m.baidu.com/s?word=%E6%B3%B0%E5%9B%BD%E4%BB%8A%E5%B9%B4%E6%8E%A5%E5%BE%85%E5%A4%96%E5%9B%BD%E6%B8%B8%E5%AE%A2%E4%BA%BA%E6%95%B0%E4%B8%8B%E9%99%8D&sa=fyb_news,https://fyb-2.cdn.bcebos.com/hotboard_image/da4a889a638df1b2e364a7aa549f29c7
35,湖北松滋一客运火车撞上野猪,,4548404,https://m.baidu.com/s?word=%E6%B9%96%E5%8C%97%E6%9D%BE%E6%BB%8B%E4%B8%80%E5%AE%A2%E8%BF%90%E7%81%AB%E8%BD%A6%E6%92%9E%E4%B8%8A%E9%87%8E%E7%8C%AA&sa=fyb_news,https://fyb-1.cdn.bcebos.com/fyb/de6163834f53ca92c1273fff98ac9078.jpeg
36,乌克兰批准向境外派遣武装部队法案,当地时间10月9日，乌克兰最高拉达以282票赞成通过法案，批准向境外派遣武装部队。根据法案，乌方将派出护卫舰前往土耳其，数艘扫雷舰及指挥部人员前往英国及北爱尔兰。分析认为，此举意在加强与北约的军事合作，对俄罗斯施加压力。,4474893,https://m.baidu.com/s?word=%E4%B9%8C%E5%85%8B%E5%85%B0%E6%89%B9%E5%87%86%E5%90%91%E5%A2%83%E5%A4%96%E6%B4%BE%E9%81%A3%E6%AD%A6%E8%A3%85%E9%83%A8%E9%98%9F%E6%B3%95%E6%A1%88&sa=fyb_news,https://fyb-2.cdn.bcebos.com/hotboard_image/c9c8ff388108614357b873066a9fb4c7
37,8月抵美留学生人数下降五分之一,,4361701,https://m.baidu.com/s?word=8%E6%9C%88%E6%8A%B5%E7%BE%8E%E7%95%99%E5%AD%A6%E7%94%9F%E4%BA%BA%E6%95%B0%E4%B8%8B%E9%99%8D%E4%BA%94%E5%88%86%E4%B9%8B%E4%B8%80&sa=fyb_news,https://fyb-1.cdn.bcebos.com/fyb/de6163834f53ca92c1273fff98ac9078.jpeg
38,揭秘特朗普宣布达成停火协议幕后,当地时间10月8日，特朗普表示在埃及举行的加沙和谈“进行得非常好”。会议进行过程中，美国国务卿鲁比奥递给他一张纸条，并凑近特朗普耳边轻声低语。随后特朗普发布消息称，以色列和哈马斯已达成协议。,4269201,https://m.baidu.com/s?word=%E6%8F%AD%E7%A7%98%E7%89%B9%E6%9C%97%E6%99%AE%E5%AE%A3%E5%B8%83%E8%BE%BE%E6%88%90%E5%81%9C%E7%81%AB%E5%8D%8F%E8%AE%AE%E5%B9%95%E5%90%8E&sa=fyb_news,https://fyb-2.cdn.bcebos.com/hotboard_image/af2a03cbefc88b94267f4ca751df5862
39,加沙谈判谈成了什么,当地时间10月9日，以色列与哈马斯达成第一阶段加沙停火协议，内容包括结束冲突、以军全面撤出、允许人道援助进入及交换被扣押人员。哈马斯计划释放20名以方人员换取约2000名巴勒斯坦囚犯，停火前5天每日至少400辆援助卡车进入加沙。,4193883,https://m.baidu.com/s?word=%E5%8A%A0%E6%B2%99%E8%B0%88%E5%88%A4%E8%B0%88%E6%88%90%E4%BA%86%E4%BB%80%E4%B9%88&sa=fyb_news,https://fyb-2.cdn.bcebos.com/hotboard_image/5b79f2edfba7080ead7e4a6d9645faf2
40,比利时将全国罢工 中使馆提醒,当地时间2025年10月14日，比工会组织将发起全国性罢工。中使馆提醒：提前确认航班、车次信息，必要时重新规划行程，有效规避滞留风险。同时，请中国公民切实提高安全意识，远离示威游行，注意防盗防抢。,4084652,https://m.baidu.com/s?word=%E6%AF%94%E5%88%A9%E6%97%B6%E5%B0%86%E5%85%A8%E5%9B%BD%E7%BD%A2%E5%B7%A5+%E4%B8%AD%E4%BD%BF%E9%A6%86%E6%8F%90%E9%86%92&sa=fyb_news,https://fyb-2.cdn.bcebos.com/hotboard_image/23498e790ec72673a3e3ee478372308e
41,香港又发生疑犯逃脱事件,,3972726,https://m.baidu.com/s?word=%E9%A6%99%E6%B8%AF%E5%8F%88%E5%8F%91%E7%94%9F%E7%96%91%E7%8A%AF%E9%80%83%E8%84%B1%E4%BA%8B%E4%BB%B6&sa=fyb_news,https://fyb-1.cdn.bcebos.com/fyb/de6163834f53ca92c1273fff98ac9078.jpeg
42,现货白银历史首次突破50美元/盎司,,3896964,https://m.baidu.com/s?word=%E7%8E%B0%E8%B4%A7%E7%99%BD%E9%93%B6%E5%8E%86%E5%8F%B2%E9%A6%96%E6%AC%A1%E7%AA%81%E7%A0%B450%E7%BE%8E%E5%85%83%2F%E7%9B%8E%E5%8F%B8&sa=fyb_news,https://fyb-1.cdn.bcebos.com/fyb/de6163834f53ca92c1273fff98ac9078.jpeg
43,越野车山路逆行 交警霸气拦截,近日，一越野车在内蒙古包头市某山路逆行，包头交警迅速出警将其逼回正常车道。执法人员强调逆行行为严重危害道路安全。,3802556,https://m.baidu.com/s?word=%E8%B6%8A%E9%87%8E%E8%BD%A6%E5%B1%B1%E8%B7%AF%E9%80%86%E8%A1%8C+%E4%BA%A4%E8%AD%A6%E9%9C%B8%E6%B0%94%E6%8B%A6%E6%88%AA&sa=fyb_news,https://fyb-2.cdn.bcebos.com/hotboard_image/6448d36fb16f3c934027ec8551edb80c
44,杨乐乐回应独自手术汪涵未陪同,近日，杨乐乐因阑尾炎在外地独自住院手术，引发网友关注她与汪涵关系。她回应称，因突发健康问题外地就医，所以独自完成手术和恢复，家人的关爱始终在心中，并提醒大家关注自身健康，不要忽视身体信号。,3695169,https://m.baidu.com/s?word=%E6%9D%A8%E4%B9%90%E4%B9%90%E5%9B%9E%E5%BA%94%E7%8B%AC%E8%87%AA%E6%89%8B%E6%9C%AF%E6%B1%AA%E6%B6%B5%E6%9C%AA%E9%99%AA%E5%90%8C&sa=fyb_news,https://fyb-2.cdn.bcebos.com/hotboard_image/68e3c0c894af44cfb73a06d4c7609dc3
45,法国新总理上台能破解僵局吗,当地时间10月8日晚，法国总统府爱丽舍宫证实，总统马克龙将在48小时内任命新总理。中国国际问题研究院全球治理和国际组织研究所所长金玲分析解读：新总理被任命是否能打破目前法国的政治僵局？,3600212,https://m.baidu.com/s?word=%E6%B3%95%E5%9B%BD%E6%96%B0%E6%80%BB%E7%90%86%E4%B8%8A%E5%8F%B0%E8%83%BD%E7%A0%B4%E8%A7%A3%E5%83%B5%E5%B1%80%E5%90%97&sa=fyb_news,https://fyb-2.cdn.bcebos.com/hotboard_image/701469cea14834712948f942eafe52c4
46,奥沙利文5比0横扫老对手马奎尔,,3512260,https://m.baidu.com/s?word=%E5%A5%A5%E6%B2%99%E5%88%A9%E6%96%875%E6%AF%940%E6%A8%AA%E6%89%AB%E8%80%81%E5%AF%B9%E6%89%8B%E9%A9%AC%E5%A5%8E%E5%B0%94&sa=fyb_news,https://fyb-1.cdn.bcebos.com/fyb/de6163834f53ca92c1273fff98ac9078.jpeg
47,曝美军靠“拆零件”维持战备,,3420900,https://m.baidu.com/s?word=%E6%9B%9D%E7%BE%8E%E5%86%9B%E9%9D%A0%E2%80%9C%E6%8B%86%E9%9B%B6%E4%BB%B6%E2%80%9D%E7%BB%B4%E6%8C%81%E6%88%98%E5%A4%87&sa=fyb_news,https://fyb-1.cdn.bcebos.com/fyb/de6163834f53ca92c1273fff98ac9078.jpeg
48,中国对锂电池等实施出口管制,10月9日，中国商务部与海关总署联合发布公告，对锂电池、人造石墨负极材料及相关物项实施出口管制，涵盖能量密度≥300Wh/kg的锂离子电池及卷绕机等6类生产设备。该措施将于11月8日正式实施，依据《出口管制法》等相关法规，旨在维护国家安全并履行防扩散义务。,3331703,https://m.baidu.com/s?word=%E4%B8%AD%E5%9B%BD%E5%AF%B9%E9%94%82%E7%94%B5%E6%B1%A0%E7%AD%89%E5%AE%9E%E6%96%BD%E5%87%BA%E5%8F%A3%E7%AE%A1%E5%88%B6&sa=fyb_news,https://fyb-2.cdn.bcebos.com/hotboard_image/626c9f4f775c677b0e8cc3b80372ece8
49,湖南省人大常委会副主任乌兰被查,湖南省人大常委会党组书记、副主任乌兰涉嫌严重违纪违法，目前正接受中央纪委国家监委纪律审查和监察调查。,3229295,https://m.baidu.com/s?word=%E6%B9%96%E5%8D%97%E7%9C%81%E4%BA%BA%E5%A4%A7%E5%B8%B8%E5%A7%94%E4%BC%9A%E5%89%AF%E4%B8%BB%E4%BB%BB%E4%B9%8C%E5%85%B0%E8%A2%AB%E6%9F%A5&sa=fyb_news,https://fyb-2.cdn.bcebos.com/hotboard_image/ed6841c0d633066e729ba0aa6d19d86e
50,黄子韬徐艺洋自曝要直播婚礼,近日，黄子韬徐艺洋自曝要直播婚礼，已经设想了直播方式，网友跪求EXO合体。,3133780,https://m.baidu.com/s?word=%E9%BB%84%E5%AD%90%E9%9F%AC%E5%BE%90%E8%89%BA%E6%B4%8B%E8%87%AA%E6%9B%9D%E8%A6%81%E7%9B%B4%E6%92%AD%E5%A9%9A%E7%A4%BC&sa=fyb_news,https://fyb-2.cdn.bcebos.com/hotboard_image/fb2fd915a12e6cf989a35a53c1f81cbf
